"colOrder","variable","uniqueVar","dataFile","IRI","label","definition","category","parentLabel","parentIRI","codebookDescription","codebookValues","termType","notesForOnt"
"3","hospitalname","form01::hospitalname","form01","","Hospital","","","Geographic location","GAZ_00000448","","","variable",""
"5","dateofscreening","form01::dateofscreening","form01","EUPATH_0047283","Screening date","","","","","","","variable",""
"6","didmotherdeliveratoneoftheparticipatingstudyhospitalsandinfant","form01::didmotherdeliveratoneoftheparticipatingstudyhospitalsandinfant","form01","","Delivered at study hospital","","","Eligibility criteria","EUPATH_0010036","","","variable",""
"7","wasbabytransferredfromotherfacilitiesorhometooneoftheparticipa","form01::wasbabytransferredfromotherfacilitiesorhometooneoftheparticipa","form01","","Transferred to study hospital before 7 days of age","","","Eligibility criteria","EUPATH_0010036","","","variable",""
"9","gestationalageinweeksbyballard","form01::gestationalageinweeksbyballard","form01","EUPATH_0036409","Estimated gestational age (weeks)","Gestational age estimated by Ballard score","","Gestational age assessment","EUPATH_0036006","","","variable",""
"10","ballardneuromuscularmaturityscore","form01::ballardneuromuscularmaturityscore","form01","","Neuromuscular maturity score","Ballard neuromuscular maturity score","","Gestational age assessment","EUPATH_0036006","","","variable",""
"11","ballardphysicalmaturityscore","form01::ballardphysicalmaturityscore","form01","","Physical maturity score","Ballard physical maturity score","","Gestational age assessment","EUPATH_0036006","","","variable",""
"12","total","form01::total","form01","EUPATH_0036414","Gestational age score","Total Ballard score","","Gestational age assessment","EUPATH_0036006","","","variable",""
"13","bestga","form01::bestga","form01","NCIT_C124435","Gestational age at delivery (weeks)","Best estimate of gestational age at enrollment between last menstrual period, ultrasound, and Ballard methods","","","","","","variable, derived","Update label in PROMOTE to match"
"18","days","form01::days","form01","NCIT_C124435","Gestational age at delivery (weeks)","","","","","","","variable, derived",""
"20","ifyesfirstdayoflastmenstrualperiod","form01::ifyesfirstdayoflastmenstrualperiod","form01","NCIT_C81257","First day of last menstrual period","Recorded at enrollment if date thought to be reliable","","","","","","variable",""
"21","ifyesgestationalagegaatdeliveryinweeksfromlmpwks","form01::ifyesgestationalagegaatdeliveryinweeksfromlmpwks","form01","","Gestational age at delivery (weeks), by last menstrual period","gestational age estimated by LMP","","Labor and delivery","EUPATH_0042001","","","variable, derived",""
"22","days1","form01::days1","form01","","Gestational age at delivery (weeks), by last menstrual period","","","Labor and delivery","EUPATH_0042001","gestational age at delivery in weeks from lmpwks, the days portion","","variable, derived",""
"23","wasultrasoundperformed","form01::wasultrasoundperformed","form01","","Fetal ultrasound performed","Ultrasound performed during pregnancy (before current observation)","","Pregnancy","EUPATH_0042004","","","variable",""
"24","dateoffirstonlyusexam","form01::dateoffirstonlyusexam","form01","","Fetal ultrasound date","Date of ultrasound performed during pregnancy (before current observation)","","Pregnancy","EUPATH_0042004","","","variable",""
"26","trimesterofearliestultrasound","form01::trimesterofearliestultrasound","form01","","Fetal ultrasound pregnancy trimester","Trimester of pregnancy during ultrasound (before current observation)","","Pregnancy","EUPATH_0042004","","","variable",""
"27","gestationalageatthefirstonlyusexamwks","form01::gestationalageatthefirstonlyusexamwks","form01","","Gestational age (weeks), by ultrasound","Gestational age at time ultrasound was performed, not at screening","","Pregnancy","EUPATH_0042004","","","variable, derived",""
"28","days2","form01::days2","form01","","Gestational age (weeks), by ultrasound","","","Pregnancy","EUPATH_0042004","gestational age at first/only ultrasound, the days portion","","variable, derived",""
"29","gestationalageatdeliverybasedonfirstonlyuswks","form01::gestationalageatdeliverybasedonfirstonlyuswks","form01","","Gestational age at delivery (weeks), by ultrasound","","","Labor and delivery","EUPATH_0042001","","","variable, derived",""
"30","days3","form01::days3","form01","","Gestational age at delivery (weeks), by ultrasound","","","Labor and delivery","EUPATH_0042001","gestational age at delivery based on first/only ultrasound, the days portion","","variable, derived",""
"31","dateballardexamdone","form01::dateballardexamdone","form01","EUPATH_0036413","Gestational age assessment date","","","","","","","variable",""
"5","maternalage","form02::maternalage","form02","EUPATH_0036077","Mother's age","","","","","","","variable",""
"6","maritalstatus","form02::maritalstatus","form02","","Mother's marital status","","","Individuals related to participant","EUPATH_0010037","","","variable",""
"7","formaleducationofmother","form02::formaleducationofmother","form02","EUPATH_0036220","Mother's education level","","","","","","","variable",""
"8","occupationofmother","form02::occupationofmother","form02","EUPATH_0036221","Mother's occupation","","","","","","","variable",""
"9","specify","form02::specify","form02","","Other mother's occupation","","","Individuals related to participant","EUPATH_0010037","","","variable",""
"10","isthismothersfirstpregnancy","form02::isthismothersfirstpregnancy","form02","","Mother's first pregnancy","Maternal data assessed at enrollment","","","","","","variable",""
"11","priorpregnanciesendingat20weeks","form02::priorpregnanciesendingat20weeks","form02","","Maternal pregnancies ending <20 weeks (count)","Maternal data assessed at enrollment","","","","","","variable",""
"12","spontaneousabortions","form02::spontaneousabortions","form02","NCIT_C120837","Spontaneous abortions (count)","Maternal data assessed at enrollment","","","","","","variable",""
"13","medicalinducedabortion","form02::medicalinducedabortion","form02","NCIT_C120835","Elective abortions (count)","Maternal data assessed at enrollment","","","","","","variable",""
"14","numberofpriorpregnanciesthatappearedpreterm2037weeks","form02::numberofpriorpregnanciesthatappearedpreterm2037weeks","form02","EUPATH_0042130","Preterm births (count)","Number of prior pregnancies (not including birth of participant) that appeared preterm (20-37 weeks). Maternal data assessed at enrollment","","","","","","variable",""
"15","numberofpregnanciesthatappearedtobeterm37weeks","form02::numberofpregnanciesthatappearedtobeterm37weeks","form02","EUPATH_0042079","Full term births (count)","Number of prior pregnancies (not including birth of participant) that appeared to be at term (>37 weeks). Maternal data assessed at enrollment","","","","","","variable",""
"16","numberoflivingchildren","form02::numberoflivingchildren","form02","EUPATH_0036218","Mother's living children (count)","Maternal data assessed at enrollment","","","","","","variable",""
"17","antenatalcareancreceived","form02::antenatalcareancreceived","form02","","Received antenatal care","Antenatal care received for pregnancy resulting in participant's birth. Maternal data assessed at enrollment","","Antenatal care","EUPATH_0047002","","","variable",""
"18","numberofvisitswhetherinthisorotherhospitalclinics","form02::numberofvisitswhetherinthisorotherhospitalclinics","form02","EUPATH_0047060","Antenatal care visits (count)","Total number of antenatal care visits prior to participant's birth. Maternal data assessed at enrollment","","","","","","variable","Update label for GANC to match this label"
"","","","","EUPATH_0036022","Maternal blood test","","","","","","","category",""
"19","lasthemoglobinlevelhgb","form02::lasthemoglobinlevelhgb","form02","","Hemoglobin (g/dL)","Last maternal hemoglobin level, may have been measured before the associated observation date","","Maternal blood test","EUPATH_0036022","","","variable","See lab_test_template"
"20","lasthctlevel","form02::lasthctlevel","form02","","Hematocrit (%)","Last maternal hematocrit level, may have been measured before the associated observation date","","Maternal blood test","EUPATH_0036022","","","variable","See lab_test_template"
"23","bloodgroup1","form02::bloodgroup1","form02","","Maternal ABO blood group","","","Maternal clinical history","EUPATH_0036493","","1 A;2 B; 3 AB;4 O;5 Don't know","variable",""
"24","rhfactor1","form02::rhfactor1","form02","","Maternal RH blood group","","","Maternal clinical history","EUPATH_0036493","","","variable",""
"25","vdrl1","form02::vdrl1","form02","","Treponema, by VDRL","Syphilis screening test. Performed at enrollment","","Treponema in maternal blood","","Syphilis test","","variable","see non-raw detection template"
"26","hivaidsserostatus1","form02::hivaidsserostatus1","form02","","HIV, by RDT","Performed at enrollment","","Lentivirus in maternal blood","","","","variable","see non-raw detection template"
"27","historyoftuberculosis1","form02::historyoftuberculosis1","form02","","Tuberculosis","Asked at enrollment","","Immediate clinical history","EUPATH_0021098","","","variable",""
"28","urinetestsuggestinginfection1","form02::urinetestsuggestinginfection1","form02","","Infection, by urinalysis","Urine test suggests infection in the mother","","Maternal urine microbiology test","","","","variable",""
"","","","","","Maternal immediate clinical history","","","Observation","EUPATH_0000738","","","category",""
"29","malariaduringhecurrentpregnancy1","form02::malariaduringhecurrentpregnancy1","form02","","Malaria during pregnancy","Whether the mother had malaria during the current pregnancy. Evaluated at enrollment.","","Maternal immediate clinical history","","","","variable",""
"30","ttvaccination1","form02::ttvaccination1","form02","","Tetanus vaccination during pregnancy","Asked at enrollment","","Maternal immediate clinical history","","","","variable",""
"31","cardiacdisease","form02::cardiacdisease","form02","","Maternal cardiac disease","Asked at enrollment","","Maternal immediate clinical history","","","","variable",""
"32","diabetesmellitus","form02::diabetesmellitus","form02","","Maternal diabetes mellitus","Asked at enrollment","","Maternal immediate clinical history","","","","variable",""
"33","ifyes","form02::ifyes","form02","","Maternal diabetes mellitus type","Asked at enrollment","","Maternal immediate clinical history","","if diabetes, type","","variable",""
"34","thyroiddisease","form02::thyroiddisease","form02","","Maternal thyroid disease","Asked at enrollment","","Maternal immediate clinical history","","","","variable",""
"35","ifyes1","form02::ifyes1","form02","","Maternal thyroid disease type","Asked at enrollment","","Maternal immediate clinical history","","if thyroid disease, type","","variable",""
"36","otherdisorders","form02::otherdisorders","form02","","Other maternal disease","Asked at enrollment","","Maternal immediate clinical history","","","","variable",""
"37","ifyesspecify","form02::ifyesspecify","form02","","Other maternal disease type","Asked at enrollment","","Maternal immediate clinical history","","If other disorders, specified","","variable",""
"38","hypertensivedisordersofpregnancy","form02::hypertensivedisordersofpregnancy","form02","","Hypertensive disorder","Asked at enrollment","","Pregnancy","EUPATH_0042004","","","variable",""
"39","antepartumhemorrhageaph","form02::antepartumhemorrhageaph","form02","","Antepartum hemorrhage","Asked at enrollment","","Pregnancy","EUPATH_0042004","","","variable",""
"40","ifyes2","form02::ifyes2","form02","","Antepartum hemorrhage type","Asked at enrollment","","Pregnancy","EUPATH_0042004","if antepartum hemorrhage, type","","variable",""
"41","specify1","form02::specify1","form02","","Other antepartum hemorrhage type","Asked at enrollment","","Pregnancy","EUPATH_0042004","other type of antepartum hemorrhage specified","","variable",""
"42","spontaneouslabor","form02::spontaneouslabor","form02","","Spontaneous labor","Asked at enrollment","","Labor and delivery","EUPATH_0042001","","","variable",""
"43","spontaneousrom","form02::spontaneousrom","form02","","Spontaneous rupture of membranes","Asked at enrollment","","Labor and delivery","EUPATH_0042001","","","variable",""
"44","inductionoflabor","form02::inductionoflabor","form02","","Induced labor","Asked at enrollment","","Labor and delivery","EUPATH_0042001","","","variable",""
"45","ifinduced","form02::ifinduced","form02","","Reason for induced labor","Asked at enrollment","","Labor and delivery","EUPATH_0042001","","","variable",""
"46","specify2","form02::specify2","form02","","Other reason for induced labor","Asked at enrollment","","Labor and delivery","EUPATH_0042001","other reason for induced labor specified","","variable",""
"47","csection","form02::csection","form02","","Caesarean section","Asked at enrollment","","Labor and delivery","EUPATH_0042001","","","variable",""
"48","ispregnancy","form02::ispregnancy","form02","EUPATH_0042087","Infant count","Asked at enrollment","","","","","","variable",""
"49","singletonoriftwintripletsbabya","form02::singletonoriftwintripletsbabya","form02","","Fetal presentation","Asked at enrollment","","Labor and delivery","EUPATH_0042001","","","variable",""
"50","deliverymode","form02::deliverymode","form02","EUPATH_0000581","Delivery mode","Asked at enrollment","","Labor and delivery","EUPATH_0042001","","","variable",""
"51","iftwintripletsbabyb","form02::iftwintripletsbabyb","form02","","Fetal presentation, 2","Asked at enrollment","","Labor and delivery","EUPATH_0042001","","","variable",""
"52","deliverymode1","form02::deliverymode1","form02","","Delivery mode, 2","Asked at enrollment","","Labor and delivery","EUPATH_0042001","","","variable",""
"53","iftripletsbabyc","form02::iftripletsbabyc","form02","","Fetal presentation, 3","Asked at enrollment","","Labor and delivery","EUPATH_0042001","","","variable",""
"54","deliverymode2","form02::deliverymode2","form02","","Delivery mode, 3","Asked at enrollment","","Labor and delivery","EUPATH_0042001","","","variable",""
"55","other4presentation","form02::other4presentation","form02","","Fetal presentation, 4","Asked at enrollment","","Labor and delivery","EUPATH_0042001","","","variable",""
"56","deliverymode3","form02::deliverymode3","form02","","Delivery mode, 4","Asked at enrollment","","Labor and delivery","EUPATH_0042001","","","variable",""
"57","dateandtimeofdeliveryifmultiplebirth","form02::dateandtimeofdeliveryifmultiplebirth","form02","EUPATH_0042043","Delivery date","Asked at enrollment","","","","","","variable, derived",""
"57","dateandtimeofdeliveryifmultiplebirth","form02::dateandtimeofdeliveryifmultiplebirth","form02","EUPATH_0042061","Delivery time","Asked at enrollment","","","","","","variable, derived",""
"","","","","","Hypertensive disorders type","Hypertensive disorders during pregnancy. Asked at enrollment","","Pregnancy","EUPATH_0042004","","","multifilter",""
"58","preeclampsia","form02::preeclampsia","form02","","Preeclampsia","Asked at enrollment","","Hypertensive disorders type","","hypertensive disorders of pregnancy","","value",""
"59","eclampsia","form02::eclampsia","form02","","Eclampsia","Asked at enrollment","","Hypertensive disorders type","","hypertensive disorders of pregnancy","","value",""
"60","superimposedpreeclampsia","form02::superimposedpreeclampsia","form02","","Superimposed preeclampsia","Asked at enrollment","","Hypertensive disorders type","","hypertensive disorders of pregnancy","","value",""
"61","chronichypertension","form02::chronichypertension","form02","","Chronic hypertension","Asked at enrollment","","Hypertensive disorders type","","hypertensive disorders of pregnancy","","value",""
"62","dontknow","form02::dontknow","form02","","Don't know","Asked at enrollment","","Hypertensive disorders type","","hypertensive disorders of pregnancy","","value",""
"63","n32chorioamnionitis","form02::n32chorioamnionitis","form02","","Antepartum chorioamnionitis","Asked at enrollment","","Pregnancy","EUPATH_0042004","","","variable",""
"64","dateandtimeofdeliveryifmultiplebirthrecordtimeofsecond","form02::dateandtimeofdeliveryifmultiplebirthrecordtimeofsecond","form02","","Delivery date, 2","Asked at enrollment","","Labor and delivery","EUPATH_0042001","","","variable, derived",""
"64","dateandtimeofdeliveryifmultiplebirthrecordtimeofsecond","form02::dateandtimeofdeliveryifmultiplebirthrecordtimeofsecond","form02","","Delivery time, 2","Asked at enrollment","","Labor and delivery","EUPATH_0042001","","","variable, derived",""
"","","","","","Reason for cesarean section","Asked at enrollment","","Labor and delivery","EUPATH_0042001","","","multifilter",""
"65","fetaldistress","form02::fetaldistress","form02","","Fetal distress","Asked at enrollment","","Reason for cesarean section","","reason for c-section","","value",""
"66","iugrsga","form02::iugrsga","form02","","Intrauterine growth restriction or small for gestational age","IUGR/SGA. Asked at enrollment","","Reason for cesarean section","","reason for c-section","","value",""
"67","preeclampsiaeclampsia","form02::preeclampsiaeclampsia","form02","","Preeclampsia or eclampsia","Asked at enrollment","","Reason for cesarean section","","reason for c-section","","value",""
"68","cordprolapse1","form02::cordprolapse1","form02","","Cord prolapsed","Asked at enrollment","","Reason for cesarean section","","reason for c-section","","value",""
"69","priorcesereansection","form02::priorcesereansection","form02","","Prior cesarean section","Asked at enrollment","","Reason for cesarean section","","reason for c-section","","value",""
"70","macrosomia","form02::macrosomia","form02","","Macrosomia","Asked at enrollment","","Reason for cesarean section","","reason for c-section","","value",""
"71","breech","form02::breech","form02","","Breech","Asked at enrollment","","Reason for cesarean section","","reason for c-section","","value",""
"72","multiplepregnancy","form02::multiplepregnancy","form02","","Multiple pregnancy","Asked at enrollment","","Reason for cesarean section","","reason for c-section","","value",""
"73","prolongedorobstructedlabor","form02::prolongedorobstructedlabor","form02","","Prolonged or obstructed labor","Asked at enrollment","","Reason for cesarean section","","reason for c-section","","value",""
"74","electivecesareansection","form02::electivecesareansection","form02","","Elective cesarean section","Asked at enrollment","","Reason for cesarean section","","reason for c-section","","value",""
"75","other","form02::other","form02","","Other","Asked at enrollment","","Reason for cesarean section","","reason for c-section","","value",""
"76","specify3","form02::specify3","form02","","Other reason for cesarean section","Asked at enrollment","","Labor and delivery","EUPATH_0042001","other reason for c-section specified","","variable",""
"77","dontknow3","form02::dontknow3","form02","","Don't know","Asked at enrollment","","Reason for cesarean section","","reason for c-section","","value",""
"78","iflaboroveralldurationinhoursandminutes","form02::iflaboroveralldurationinhoursandminutes","form02","","Delivery duration","Asked at enrollment","","Labor and delivery","EUPATH_0042001","hours of labor","","variable, derived",""
"79","overallmin","form02::overallmin","form02","","Delivery duration","Asked at enrollment","","Labor and delivery","EUPATH_0042001","min of labor","","variable, derived",""
"80","durationofruptureofmembraneinhoursandminutes","form02::durationofruptureofmembraneinhoursandminutes","form02","","Ruptured membranes duration","Asked at enrollment","","Labor and delivery","EUPATH_0042001","How long from rupture of membranes to birth","","variable, derived",""
"81","durationofrupturemin","form02::durationofrupturemin","form02","","Ruptured membranes duration","Asked at enrollment","","Labor and delivery","EUPATH_0042001","","","variable, derived",""
"82","diddeliveryoccurduring","form02::diddeliveryoccurduring","form02","","Delivery timing","Asked at enrollment","","Labor and delivery","EUPATH_0042001","Whether delivery occurred during working hours (8am-5pm weekdays) or doctor duty hours (after 5 pm, holidays, weekends)","","variable",""
"83","deliveryattendant","form02::deliveryattendant","form02","","Senior attendant at delivery","Most senior care giver present at delivery. Asked at enrollment","","Labor and delivery","EUPATH_0042001","","","variable",""
"","","","","HP_0001787","Delivery complications","Asked at enrollment","","Labor and delivery","EUPATH_0042001","","","multifilter",""
"84","maternalfeverpriortodelivery","form02::maternalfeverpriortodelivery","form02","","Maternal fever prior to delivery","Asked at enrollment","","Delivery complications","HP_0001787","","","value",""
"85","cordprolapse","form02::cordprolapse","form02","","Cord prolapse","Asked at enrollment","","Delivery complications","HP_0001787","","","value",""
"86","ruptureduterus","form02::ruptureduterus","form02","","Uterine rupture","Asked at enrollment","","Delivery complications","HP_0001787","","","value",""
"87","n47other","form02::n47other","form02","","Other","Asked at enrollment","","Delivery complications","HP_0001787","","","value",""
"88","ifyesspecify1","form02::ifyesspecify1","form02","EUPATH_0042099","Other delivery complication","Asked at enrollment","","Labor and delivery","EUPATH_0042001","","","variable",""
"89","intrapartumfhrmonitoring","form02::intrapartumfhrmonitoring","form02","","Intrapartum fetal heart rate monitoring","Asked at enrollment","","Labor and delivery","EUPATH_0042001","","","variable",""
"90","ifyes3","form02::ifyes3","form02","","Intrapartum fetal heart rate monitoring type","Asked at enrollment","","Labor and delivery","EUPATH_0042001","","","variable",""
"91","wasbabyresuscitatedwithbagandmask","form02::wasbabyresuscitatedwithbagandmask","form02","","Bag and mask resuscitation","Whether infant was resuscitated with a bag and mask. Asked at enrollment","","Labor and delivery","EUPATH_0042001","","","variable",""
"92","antibiotics","form02::antibiotics","form02","","Antibiotics before delivery","Asked at enrollment","","Pregnancy","EUPATH_0042004","","","variable",""
"","","","","","Antibiotics before delivery indication","Asked at enrollment","","Pregnancy","EUPATH_0042004","","","multifilter",""
"93","prom","form02::prom","form02","","Prelabor rupture of membranes","PROM. Asked at enrollment","","Antibiotics before delivery indication","","Reason antibiotics given","","value",""
"94","chorioamnionitis","form02::chorioamnionitis","form02","","Chorioamnionitis","Asked at enrollment","","Antibiotics before delivery indication","","Reason antibiotics given","","value",""
"95","maternalurinarytractinfection","form02::maternalurinarytractinfection","form02","","Maternal urinary tract infection","Asked at enrollment","","Antibiotics before delivery indication","","Reason antibiotics given","","value",""
"96","prophylaxisforcsection","form02::prophylaxisforcsection","form02","","Cesarean section prophylaxis","Asked at enrollment","","Antibiotics before delivery indication","","Reason antibiotics given","","value",""
"97","othermaternalinfection1","form02::othermaternalinfection1","form02","","Other maternal infection","Asked at enrollment","","Antibiotics before delivery indication","","Reason antibiotics given","","value",""
"98","ifyesspecify2","form02::ifyesspecify2","form02","","Other maternal infection","Asked at enrollment","","Pregnancy","EUPATH_0042001","Other reason antibiotics given specified","","variable",""
"","","","","","Medications before delivery","Dexamethasone given specifically for fetal lung maturation. Other medications asked about more generally. Asked at enrollment","","Pregnancy","EUPATH_0042001","","","multifilter",""
"99","dexamethasonegivenforfetallungmaturation","form02::dexamethasonegivenforfetallungmaturation","form02","","Dexamethasone","Dexamethasone given for fetal lung maturation. Asked at enrollment","","Medications before delivery","","","","value",""
"100","ifyesnumberofdoses","form02::ifyesnumberofdoses","form02","","Dexamethasone doses (count)","Asked at enrollment","","Pregnancy","EUPATH_0042001","","","variable",""
"101","n512ifyestimefromthelastdoseofsteroidtodelivery","form02::n512ifyestimefromthelastdoseofsteroidtodelivery","form02","","Last steroid dose to delivery duration (days)","Asked at enrollment","","Pregnancy","EUPATH_0042001","","","variable, derived",""
"102","hrs","form02::hrs","form02","","Last steroid dose to delivery duration (days)","Asked at enrollment","","Pregnancy","EUPATH_0042001","","","variable, derived",""
"104","magnesiumsulfate","form02::magnesiumsulfate","form02","","Magnesium sulfate","Asked at enrollment","","Medications before delivery","","","","value",""
"105","diazepam","form02::diazepam","form02","","Diazepam","Asked at enrollment","","Medications before delivery","","","","value",""
"106","pethidine","form02::pethidine","form02","","Pethidine","Asked at enrollment","","Medications before delivery","","","","value",""
"107","othermedication","form02::othermedication","form02","","Other","Asked at enrollment","","Medications before delivery","","","","value",""
"108","ifotherspecify","form02::ifotherspecify","form02","","Other medications before delivery","Asked at enrollment","","Pregnancy","EUPATH_0042001","","","variable",""
"112","dateandtimeofdeliveryifmultiplebirthrecordtimeofthird","form02::dateandtimeofdeliveryifmultiplebirthrecordtimeofthird","form02","","Delivery date, 2","Asked at enrollment","","Labor and delivery","EUPATH_0042001","","","variable, derived",""
