"colOrder","variable","uniqueVar","dataFile","IRI","label","definition","category","parentLabel","parentIRI","codebookDescription","codebookValues","termType","notesForOnt"
"116","specify9","form03b::specify9","form03b","","Other abdominal exam findings","","","Physical examination","OGMS_0000083","if abdomen not normal and other, specified","","variable",""
"117","bowelsounds","form03b::bowelsounds","form03b","","Bowel sounds","","","Physical examination","OGMS_0000083","","","variable",""
"118","organsizenormal","form03b::organsizenormal","form03b","","Organ size","","","Abnormal physical exam","EUPATH_0041001","","","value",""
"119","ifno3","form03b::ifno3","form03b","","Organ size findings","","","Physical examination","OGMS_0000083","if organ abnormal, how","","variable",""
"120","anuspatent","form03b::anuspatent","form03b","","Anus patent","","","Physical examination","OGMS_0000083","","","variable",""
"121","stoolpresent","form03b::stoolpresent","form03b","","Stool present","","","Physical examination","OGMS_0000083","","","variable",""
"122","n451ifyes","form03b::n451ifyes","form03b","","Stool description","","","Physical examination","OGMS_0000083","If stool present, description","","variable",""
"123","urineoutputnormal","form03b::urineoutputnormal","form03b","","Urine output","","","Abnormal physical exam","EUPATH_0041001","","","value",""
"124","genitaliakidneysnormal","form03b::genitaliakidneysnormal","form03b","","Genitalia and kidneys","","","Abnormal physical exam","EUPATH_0041001","","","value",""
"125","ifno4","form03b::ifno4","form03b","","Genitalia and kidneys findings","","","Physical examination","OGMS_0000083","if genitalia/kidneys abnormal, how","","variable",""
"126","specify10","form03b::specify10","form03b","","Other genitalia and kidneys findings","","","Physical examination","OGMS_0000083","if genitalia/kidneys abnormal and other, specified","","variable",""
"127","skintexturenormal","form03b::skintexturenormal","form03b","","Skin","","","Abnormal physical exam","EUPATH_0041001","","","value",""
"128","n481ifno","form03b::n481ifno","form03b","","Skin exam findings","","","Physical examination","OGMS_0000083","if skin abnormal, how","","variable",""
"129","specify11","form03b::specify11","form03b","","Other skin exam findings","","","Physical examination","OGMS_0000083","if skin abnormal and other, specified","","variable",""
"130","umbilicalstumpnormal","form03b::umbilicalstumpnormal","form03b","","Umbilical stump","","","Abnormal physical exam","EUPATH_0041001","","","value",""
"131","n491ifno","form03b::n491ifno","form03b","","Umbilical stump exam findings","","","Physical examination","OGMS_0000083","if umbilical stump abnormal, how","","variable",""
"132","specify12","form03b::specify12","form03b","","Umbilical stump exam findings","","","Physical examination","OGMS_0000083","if umbilical stump abnormal and other, specified","","variable",""
"133","musculoskeletalsystemnormal","form03b::musculoskeletalsystemnormal","form03b","","Musculoskeletal","","","Abnormal physical exam","EUPATH_0041001","","","value",""
"134","ifno5","form03b::ifno5","form03b","","Musculoskeletal exam findings","","","Physical examination","OGMS_0000083","if musculoskeletal system abnormal, how","","variable",""
"135","specify13","form03b::specify13","form03b","","Other musculoskeletal exam findings","","","Physical examination","OGMS_0000083","if musculoskeletal system abnormal and other, specified","","variable",""
"136","indicateconsciousnessstatus","form03b::indicateconsciousnessstatus","form03b","","Consciousness status","","","Physical examination","OGMS_0000083","","","variable",""
"137","reflexesappropriateforage","form03b::reflexesappropriateforage","form03b","","Reflexes","","","Abnormal physical exam","EUPATH_0041001","","","value",""
"138","moronormalforage","form03b::moronormalforage","form03b","","Moro reflex","","","Abnormal physical exam","EUPATH_0041001","","","value",""
"139","suckingnormalforage","form03b::suckingnormalforage","form03b","","Sucking","","","Abnormal physical exam","EUPATH_0041001","","","value",""
"140","graspappropriateforage","form03b::graspappropriateforage","form03b","","Grasp","","","Abnormal physical exam","EUPATH_0041001","","","value",""
"141","tonenormal","form03b::tonenormal","form03b","","Muscle tone","","","Abnormal physical exam","EUPATH_0041001","","","value",""
"142","ifabnormal5","form03b::ifabnormal5","form03b","","Muscle tone exam findings","","","Physical examination","OGMS_0000083","If tone abnormal, how it's abnormal","","variable",""
"143","presenceofseizures","form03b::presenceofseizures","form03b","SYMP_0000124","Seizures","","","","","","","value",""
"144","qualityofcry","form03b::qualityofcry","form03b","","Cry quality","","","Physical examination","OGMS_0000083","","","variable",""
"145","imaginganyimagingdone","form03b::imaginganyimagingdone","form03b","","Imaging performed","","","Physical examination","OGMS_0000083","","","variable",""
"146","chestxray","form03b::chestxray","form03b","EUPATH_0021162","Chest X-ray performed","","","Physical examination","OGMS_0000083","Chest xray performed","","variable",""
"147","ifdone","form03b::ifdone","form03b","","Chest X-ray","","","Abnormal physical exam","EUPATH_0041001","If chest x-ray performed, whether findings were normal","","value",""
"148","n571specify","form03b::n571specify","form03b","EUPATH_0033161","Chest X-ray interpretation","","","Physical examination","OGMS_0000083","If chest x-ray abnormal, specify","","variable",""
"149","abdominalxray","form03b::abdominalxray","form03b","","Abdominal X-ray performed","","","Physical examination","OGMS_0000083","abdominal xray performed","","variable",""
"150","ifdone1","form03b::ifdone1","form03b","","Abdominal X-ray","","","Abnormal physical exam","EUPATH_0041001","If abdominal x-ray performed, whether findings were normal","","value",""
"151","specify14","form03b::specify14","form03b","","Abdominal X-ray interpretation","","","Physical examination","OGMS_0000083","If abdominal x-ray abnormal, specify","","variable",""
"152","necdiagnosedbyxray","form03b::necdiagnosedbyxray","form03b","","Necrotizing enterocolitis, by X-ray","Necrotizing enterocolitis diagnosed by abdominal X-ray","","Diagnosis","OGMS_0000073","If abdominal x-ray done, NEC diagnosed","","variable",""
"153","otherxray","form03b::otherxray","form03b","","Other X-ray performed","","","Physical examination","OGMS_0000083","Other xray performed","","variable",""
"154","n591ifdone","form03b::n591ifdone","form03b","","Other X-ray","","","Abnormal physical exam","EUPATH_0041001","If other x-ray performed, whether findings were normal","","value",""
"155","n591specify","form03b::n591specify","form03b","","Other X-ray interpretation","","","Physical examination","OGMS_0000083","If other x-ray abnormal, specify","","variable",""
"156","headultrasound","form03b::headultrasound","form03b","","Cranial ultrasound performed","","","Physical examination","OGMS_0000083","head ultrasound performed","","variable",""
"157","n601ifdone","form03b::n601ifdone","form03b","","Cranial ultrasound","","","Abnormal physical exam","EUPATH_0041001","If head ultrasound performed, whether findings were normal","","value",""
"158","n601specify","form03b::n601specify","form03b","","Cranial ultrasound interpretation","","","Physical examination","OGMS_0000083","If head ultrasound abnormal, specify","","variable",""
"159","n602ivhdiagnosedbyus","form03b::n602ivhdiagnosedbyus","form03b","","Intraventricular hemorrhage, by ultrasound","Intraventricular hemorrhage diagnosed by head ultrasound","","Diagnosis","OGMS_0000073","If head ultrasound done, IVH diagnosed","","variable",""
"160","abdominalultrasound","form03b::abdominalultrasound","form03b","","Abdominal ultrasound performed","","","Physical examination","OGMS_0000083","abdominal ultrasound performed","","variable",""
"161","n611ifdone","form03b::n611ifdone","form03b","","Abdominal ultrasound","","","Abnormal physical exam","EUPATH_0041001","If abdominal ultrasound performed, whether findings were normal","","value",""
"162","n611specify","form03b::n611specify","form03b","","Abdominal ultrasound interpretation","","","Physical examination","OGMS_0000083","If abdominal ultrasound abnormal, specify","","variable",""
"163","n62specify","form03b::n62specify","form03b","","Other ultrasound interpretation","","","Physical examination","OGMS_0000083","If other ultrasound abnormal, specify ","","variable",""
"164","n621ifdone","form03b::n621ifdone","form03b","","Other ultrasound performed","","","Physical examination","OGMS_0000083","other ultrasound performed","","variable",""
"165","n62otherultrasound","form03b::n62otherultrasound","form03b","","Other ultrasound","","","Abnormal physical exam","EUPATH_0041001","If other ultrasound performed, whether findings were normal","","value",""
"166","n63mri","form03b::n63mri","form03b","","MRI performed","","","Physical examination","OGMS_0000083","MRI performed","","variable",""
"167","n631ifdone","form03b::n631ifdone","form03b","","MRI","","","Abnormal physical exam","EUPATH_0041001","If MRI performed, whether findings were normal","","value",""
"168","n631specify","form03b::n631specify","form03b","","MRI interpretation","","","Physical examination","OGMS_0000083","If MRI abnormal, specify","","variable",""
"169","laboratoryanalysesdone","form03b::laboratoryanalysesdone","form03b","","Laboratory tests performed","","","Laboratory test","OGMS_0000056","","","variable",""
"170","completebloodcount","form03b::completebloodcount","form03b","","Complete blood count performed","","","Blood tests performed","EUPATH_0027019","CBC performed","","variable",""
"171","n651ifdone","form03b::n651ifdone","form03b","","Complete blood count normal","","","Blood test","EUPATH_0011795","If CBC performed, whether findings were normal","","variable",""
"172","n651specify","form03b::n651specify","form03b","","Complete blood count interpretation","","","Blood test","EUPATH_0011795","If CBC abnormal, specify","","variable",""
"173","bloodgasanalysis","form03b::bloodgasanalysis","form03b","","Blood gas analysis performed","","","Blood tests performed","EUPATH_0027019","Blood gas analysis performed","","variable",""
"174","n661ifdone","form03b::n661ifdone","form03b","","Blood gas analysis normal","","","Blood test","EUPATH_0011795","If Blood gas analysis performed, whether findings were normal","","variable",""
"175","n661specify","form03b::n661specify","form03b","","Blood gas analysis interpretation","","","Blood test","EUPATH_0011795","If Blood gas analysis abnormal, specify","","variable",""
"176","n67bilirubintest","form03b::n67bilirubintest","form03b","","Bilirubin measurement performed","","","Blood tests performed","EUPATH_0027019","bilirubin test performed","","variable",""
"177","n671ifdone","form03b::n671ifdone","form03b","","Bilirubin normal","","","Blood test","EUPATH_0011795","If bilirubin test performed, whether findings were normal","","variable",""
"178","n67specify","form03b::n67specify","form03b","","Bilirubin measurement interpretation","","","Blood test","EUPATH_0011795","If bilirubin test abnormal, specify","","variable",""
"179","n68randombloodsugar","form03b::n68randombloodsugar","form03b","","Random blood sugar measurement performed","","","Blood tests performed","EUPATH_0027019","random blood sugar performed","","variable",""
"180","n681ifdone","form03b::n681ifdone","form03b","","Random blood sugar normal","","","Blood test","EUPATH_0011795","Ifrandom blood sugar  performed, whether findings were normal","","variable",""
"181","n681specify","form03b::n681specify","form03b","","Random blood sugar measurement interpretation","","","Blood test","EUPATH_0011795","If random blood sugar abnormal, specify","","variable",""
"182","n69bloodculture","form03b::n69bloodculture","form03b","EUPATH_0021159","Blood culture performed","","","","","blood culture performed","","variable",""
"183","n691ifdone","form03b::n691ifdone","form03b","EUPATH_0033143","Blood culture positive","","","","","If blood culture performed, whether findings were normal","","variable",""
"184","n691specify","form03b::n691specify","form03b","EUPATH_0033227","Organism, by culture","","","","","If blood culture abnormal, specify","","variable",""
"","","","","","Cerebrospinal fluid test","","","Laboratory test","OGMS_0000056","","","category",""
"","","","","","Cerebrospinal fluid tests performed","","","Cerebrospinal fluid test","","","","category",""
"185","n70csfanalysis","form03b::n70csfanalysis","form03b","","Cerebrospinal fluid analysis performed","","","Cerebrospinal fluid tests performed","","CSF performed","","variable",""
"186","n701ifdone","form03b::n701ifdone","form03b","","Cerebrospinal fluid analysis normal","","","Cerebrospinal fluid test","","If CSF performed, whether findings were normal","","variable",""
"187","n701specify","form03b::n701specify","form03b","","Cerebrospinal fluid analysis interpretation","","","Cerebrospinal fluid test","","If CSF abnormal, specify","","variable",""
"","","","","","Cerebrospinal fluid microbiology test","","","Laboratory test","OGMS_0000056","","","category",""
"","","","","","Cerebrospinal fluid microbiology test procedures","","","Cerebrospinal fluid microbiology test","","","","category",""
"188","n71csfculture","form03b::n71csfculture","form03b","","Cerebrospinal fluid culture performed","CSF culture performed","","Cerebrospinal fluid microbiology test procedures",""," CSF culture performed","","variable",""
"189","n711ifdone","form03b::n711ifdone","form03b","","Cerebrospinal fluid culture positive","","","Cerebrospinal fluid microbiology test","","If CSF culture performed, whether findings were normal","","variable",""
"190","n711specify1","form03b::n711specify1","form03b","","Organism, by culture","","","Cerebrospinal fluid microbiology test","","If CSF culture abnormal, specify","","variable",""
"","","","","","Other sample microbiology test","","","Laboratory test","OGMS_0000056","","","category",""
"","","","","","Other sample microbiology test procedures","","","Other sample microbiology test","","","","category",""
"191","n72otherculture","form03b::n72otherculture","form03b","","Other culture performed","","","Other sample microbiology test procedures","","Other culture performed","","variable",""
"192","n721ifdone","form03b::n721ifdone","form03b","","Other culture sample","Sample used for other culture. From NICU admission","","Other sample microbiology test","","If Other culture performed, what sample used","","variable",""
"193","n722ifdone","form03b::n722ifdone","form03b","","Other culture positive","From NICU admission","","Other sample microbiology test","","If Other culture performed, whether findings were normal","","variable",""
"194","n73gramstain","form03b::n73gramstain","form03b","","Gram stain performed","","","Other sample microbiology test procedures","","gram stain performed","","variable",""
"195","n731ifdonewhere","form03b::n731ifdonewhere","form03b","","Gram stain sample","","","Other sample microbiology test","","If gram stained performed, what sample used","","variable",""
"196","n731ifdone","form03b::n731ifdone","form03b","","Gram stain normal","","","Other sample microbiology test","","If gram stain performed, whether findings were normal","","variable",""
"197","n722specify","form03b::n722specify","form03b","","Organism, by culture","","","Other sample microbiology test","","If Other culture abnormal, specify","","variable",""
"198","n731specify","form03b::n731specify","form03b","","Gram stain interpretation","","","Other sample microbiology test","","If gram stain abnormal, specify","","variable",""
"199","n74creactiveproteintest","form03b::n74creactiveproteintest","form03b","","C-reactive protein measurement performed","CRP measurement performed","","Blood tests performed","EUPATH_0027019","C-reactive protein test performed","","variable",""
"200","n741ifdone","form03b::n741ifdone","form03b","","C-reactive protein normal","CRP normal","","Blood test","EUPATH_0011795","If C-reactive protein test performed, whether findings were normal","","variable",""
"201","n741specify","form03b::n741specify","form03b","","C-reactive protein measurement interpretation","CRP measurement findings","","Blood test","EUPATH_0011795","If C-reactive protein test abnormal, specify","","variable",""
"202","n75esrdone","form03b::n75esrdone","form03b","","Erythrocyte sedimentation rate measurement performed","ESR measurement performed","","Blood tests performed","EUPATH_0027019","ESR performed","","variable",""
"203","n751ifdone","form03b::n751ifdone","form03b","","Erythrocyte sedimentation rate normal","ESR normal","","Blood test","EUPATH_0011795","If ESR performed, whether findings were normal","","variable",""
"204","n751specify","form03b::n751specify","form03b","","Erythrocyte sedimentation rate measurement interpretation","ESR measurement findings","","Blood test","EUPATH_0011795","If ESR abnormal, specify","","variable",""
"205","n76serumalbumin","form03b::n76serumalbumin","form03b","","Albumin measurement performed","","","Blood tests performed","EUPATH_0027019","serum albumin performed","","variable",""
"206","n761ifdone","form03b::n761ifdone","form03b","","Albumin normal","","","Blood test","EUPATH_0011795","If serum albumin performed, whether findings were normal","","variable",""
"207","n761specify","form03b::n761specify","form03b","","Albumin measurement interpretation","","","Blood test","EUPATH_0011795","If serum albumin abnormal, specify","","variable",""
"208","n77vdrlinbaby","form03b::n77vdrlinbaby","form03b","","VDRL test performed","","","Blood bacteria testing","EUPATH_0021158","VDRL performed","","variable",""
"209","n771ifdone","form03b::n771ifdone","form03b","","Treponema, by VDRL","Infant positive for syphilis ","","Bacteria in blood","EUPATH_0033293","If VDRL performed, whether findings were normal","","variable","see non-raw detection template"
"","","","","","Blood virus testing","","","Blood microbiology tests procedures","EUPATH_0020125","","","category",""
"211","n78hivtestformother","form03b::n78hivtestformother","form03b","","HIV test performed","","","Blood virus testing","","HIV test morther performed","","variable",""
"212","n781ifdone","form03b::n781ifdone","form03b","","HIV, by any method","","","Lentivirus in maternal blood","","If HIV test morther performed, whether findings were normal","","variable","see non-raw detection template"
"213","n781specify","form03b::n781specify","form03b","","HIV test interpretation","","","Lentivirus in maternal blood","","If HIV test morther abnormal, specify","","variable",""
"214","n79liverfunctiontestlft","form03b::n79liverfunctiontestlft","form03b","","Liver function tests performed","","","Blood tests performed","EUPATH_0027019","liver function test performed","","variable",""
"215","n791ifdone","form03b::n791ifdone","form03b","","Liver function tests normal","","","Blood test","EUPATH_0011795","If liver function test performed, whether findings were normal","","variable",""
"216","n791specify","form03b::n791specify","form03b","","Liver function tests interpretation","","","Blood test","EUPATH_0011795","If liver function test abnormal, specify","","variable",""
"217","n80serumelectrolytes","form03b::n80serumelectrolytes","form03b","","Electrolyte panel performed","","","Blood tests performed","EUPATH_0027019","serum electrolytes performed","","variable",""
"218","n801ifdone","form03b::n801ifdone","form03b","","Electrolyte panel normal","","","Blood test","EUPATH_0011795","If serum electrolytes performed, whether findings were normal","","variable",""
"219","n801specify","form03b::n801specify","form03b","","Electrolyte panel interpretation","","","Blood test","EUPATH_0011795","If serum electrolytes abnormal, specify","","variable",""
"220","n802ifabnormalspecifyelectrolyte","form03b::n802ifabnormalspecifyelectrolyte","form03b","","Abnormal electrolyte","","","Blood test","EUPATH_0011795","If serum electrolytes abnormal, specify electrolyte","","variable",""
"221","n81othertest","form03b::n81othertest","form03b","","Other lab test performed","","","Laboratory test","OGMS_0000056","Other test performed","","variable",""
"222","n81specifytest","form03b::n81specifytest","form03b","EUPATH_0042103","Other lab test result","","","","","If other test performed, specify test","","variable",""
"223","n82wereanyconditionsdiagnosed","form03b::n82wereanyconditionsdiagnosed","form03b","","Diagnosed at hospitalization","Whether any conditions were diagnosed at admission to the NICU","","Hospitalization","EUPATH_0000308","","","variable",""
"224","n1respiratorydistresssyndrome","form03b::n1respiratorydistresssyndrome","form03b","","Respiratory distress syndrome","","","Diagnosis at hospitalization","EUPATH_0000638","","","value",""
"225","n2meconomiumaspirationsyndrome","form03b::n2meconomiumaspirationsyndrome","form03b","","Meconium aspiration syndrome","","","Diagnosis at hospitalization","EUPATH_0000638","","","value",""
"226","n4apnea","form03b::n4apnea","form03b","","Apnea","","","Diagnosis at hospitalization","EUPATH_0000638","","","value",""
"227","n4pulmonaryhemorrhage","form03b::n4pulmonaryhemorrhage","form03b","","Pulmonary hemorrhage","","","Diagnosis at hospitalization","EUPATH_0000638","","","value",""
"228","n5otherrespiratory","form03b::n5otherrespiratory","form03b","","Other respiratory disease","","","Diagnosis at hospitalization","EUPATH_0000638","","","value",""
"229","specify15","form03b::specify15","form03b","","Other respiratory disease at hospitalization","","","Hospitalization","EUPATH_0000308","","","variable",""
"230","n6hypoglycemia","form03b::n6hypoglycemia","form03b","","Hypoglycemia","","","Diagnosis at hospitalization","EUPATH_0000638","","","value",""
"231","n7electrolytedisorders","form03b::n7electrolytedisorders","form03b","","Electrolyte disorder","","","Diagnosis at hospitalization","EUPATH_0000638","","","value",""
"232","n8othermetabolicdisorders","form03b::n8othermetabolicdisorders","form03b","","Other metabolic disease","","","Diagnosis at hospitalization","EUPATH_0000638","","","value",""
"233","specify16","form03b::specify16","form03b","","Other metabolic disease at hospitalization","","","Hospitalization","EUPATH_0000308","","","variable",""
"234","n9earlyonsetneonatalsepsis72hours","form03b::n9earlyonsetneonatalsepsis72hours","form03b","","Early onset neonatal sepsis","<72 hours","","Diagnosis at hospitalization","EUPATH_0000638","","","value",""
"235","n10lateonsetneonatalsepsis72hours","form03b::n10lateonsetneonatalsepsis72hours","form03b","","Late onset neonatal sepsis",">= 72 hours","","Diagnosis at hospitalization","EUPATH_0000638","","","value",""
"236","n11pneumonia","form03b::n11pneumonia","form03b","","Pneumonia","","","Diagnosis at hospitalization","EUPATH_0000638","","","value",""
"237","n12meningitis","form03b::n12meningitis","form03b","EUPATH_0033427","Meningitis","","","Diagnosis at hospitalization","EUPATH_0000638","","","value",""
"238","n13hivexposed","form03b::n13hivexposed","form03b","","HIV exposure","","","Diagnosis at hospitalization","EUPATH_0000638","","","value",""
"239","n14congenitalsyphilis","form03b::n14congenitalsyphilis","form03b","","Congenital syphilis","","","Diagnosis at hospitalization","EUPATH_0000638","","","value",""
"240","ophthalmianeonatorum","form03b::ophthalmianeonatorum","form03b","","Ophthalmia neonatorum","","","Diagnosis at hospitalization","EUPATH_0000638","","","value",""
"241","n16otherinfection","form03b::n16otherinfection","form03b","","Other infection","","","Diagnosis at hospitalization","EUPATH_0000638","","","value",""
"242","specify17","form03b::specify17","form03b","","Other infection at hospitalization","","","Hospitalization","EUPATH_0000308","","","variable",""
"243","n17anemia","form03b::n17anemia","form03b","","Anemia","","","Diagnosis at hospitalization","EUPATH_0000638","","","value",""
"244","n18polycythemia","form03b::n18polycythemia","form03b","","Polycthemia","","","Diagnosis at hospitalization","EUPATH_0000638","","","value",""
"245","n19dic","form03b::n19dic","form03b","","Disseminated intravascular coagulation","","","Diagnosis at hospitalization","EUPATH_0000638","","","value",""
"246","n20rhincompatibility","form03b::n20rhincompatibility","form03b","","RH incompatibility","","","Diagnosis at hospitalization","EUPATH_0000638","","","value",""
"247","n21aboincompatibility","form03b::n21aboincompatibility","form03b","","ABO incompatibility","","","Diagnosis at hospitalization","EUPATH_0000638","","","value",""
"248","n22hyperbilirubinemia","form03b::n22hyperbilirubinemia","form03b","","Hyperbilirubinemia","","","Diagnosis at hospitalization","EUPATH_0000638","","","value",""
"249","n23hemorrhagicdiseaseofthenewborn","form03b::n23hemorrhagicdiseaseofthenewborn","form03b","","Hemorrhagic disease of the newborn","","","Diagnosis at hospitalization","EUPATH_0000638","","","value",""
"250","n24otherhematologic","form03b::n24otherhematologic","form03b","","Other hematologic disease","","","Diagnosis at hospitalization","EUPATH_0000638","","","value",""
"251","specify18","form03b::specify18","form03b","","Other hematologic disease at hospitalization","","","Hospitalization","EUPATH_0000308","","","variable",""
"252","n25perinatalasphyxiawithmultipleorganinvolvement","form03b::n25perinatalasphyxiawithmultipleorganinvolvement","form03b","","Perinatal asphyxia with multiple organ involvement","","","Diagnosis at hospitalization","EUPATH_0000638","","","value",""
"253","n26acutebilirubinencephalopathyabe","form03b::n26acutebilirubinencephalopathyabe","form03b","","Acute bilirubin encephalopathy","","","Diagnosis at hospitalization","EUPATH_0000638","","","value",""
"254","seizuredisorder","form03b::seizuredisorder","form03b","","Seizures","","","Diagnosis at hospitalization","EUPATH_0000638","","","value",""
