IRI,label,variable,displayOrder,dataFile,definition,category,parentIRI,parentLabel,codebookDescription,codebookValues,termType,repeated,is_temporal,mergeKey,dataSet,replaces,unitLabel,unitIRI,is_featured,hidden,scale,defaultDisplayRangeMin,defaultDisplayRangeMax,defaultBinWidth
http://purl.obolibrary.org/obo/PCO_0000024,Household,,,,,Household,http://www.w3.org/2002/07/owl#Thing,,,,category,,,,WOMAN,,,,,yes,,,,
http://purl.obolibrary.org/obo/ENVO_00000009,Country,WOMAN_Trial_dataset_anonymised::countrycode,,WOMAN_Trial_dataset_anonymised,Country of randomization,Household,http://purl.obolibrary.org/obo/GAZ_00000448,Geographic location,country of randomisation,,variable,,,,WOMAN,,,,,,,,,
http://purl.obolibrary.org/obo/GAZ_00000448,Geographic location,,,,,Household,http://purl.obolibrary.org/obo/PCO_0000024,Household,,,category,,,,WOMAN,,,,,,,,,
http://purl.obolibrary.org/obo/EUPATH_0000096,Participant,,,,,Participant,http://www.w3.org/2002/07/owl#Thing,,,,category,,,,WOMAN,,,,,yes,,,,
http://purl.obolibrary.org/obo/EUPATH_0010036,Eligibility criteria,,,,,Participant,http://purl.obolibrary.org/obo/EUPATH_0010035,Administrative information,,,category,,,,WOMAN,,,,,,,,,
http://purl.obolibrary.org/obo/EUPATH_0049148,Eligible for WOMAN trial,WOMAN_Trial_dataset_anonymised::fullyeligible,,WOMAN_Trial_dataset_anonymised,,Participant,http://purl.obolibrary.org/obo/EUPATH_0010035,Administrative information,patient eligible for trial,,variable,,,,WOMAN,,,,,,,,,
http://purl.obolibrary.org/obo/EUPATH_0010371,Breastfed,WOMAN_Trial_dataset_anonymised::babybreastfed2 | WOMAN_Trial_dataset_anonymised::babybreastfed4 | WOMAN_Trial_dataset_anonymised::babybreastfed1 | WOMAN_Trial_dataset_anonymised::babybreastfed5 | WOMAN_Trial_dataset_anonymised::babybreastfed3,,WOMAN_Trial_dataset_anonymised,Baby was breastfed any time after randomization,Participant,http://purl.obolibrary.org/obo/EUPATH_0011690,Breastfeeding summary,Was baby breastfed any time after randomisation (Baby number in order of delivery) | Was baby considered healthy at outcome (Baby number in order of delivery),,variable,,,,WOMAN,,,,,,,,,
http://purl.obolibrary.org/obo/EUPATH_0049138,Infant confirmed thromboembolic event,WOMAN_Trial_dataset_anonymised::babythromboembolic4 | WOMAN_Trial_dataset_anonymised::babythromboembolic2 | WOMAN_Trial_dataset_anonymised::babythromboembolic3 | WOMAN_Trial_dataset_anonymised::babythromboembolic1 | WOMAN_Trial_dataset_anonymised::babythromboembolic5,,WOMAN_Trial_dataset_anonymised,,Participant,http://purl.obolibrary.org/obo/EUPATH_0049156,Child immediate clinical history,Had baby had any confirmed thromboembolic event (Baby number in order of delivery),,variable,yes,,,WOMAN,,,,,,,,,
http://purl.obolibrary.org/obo/EUPATH_0049139,Baby was alive at outcome,WOMAN_Trial_dataset_anonymised::babyalive4 | WOMAN_Trial_dataset_anonymised::babyalive5 | WOMAN_Trial_dataset_anonymised::babyalive2 | WOMAN_Trial_dataset_anonymised::babyalive3 | WOMAN_Trial_dataset_anonymised::babyalive1,,WOMAN_Trial_dataset_anonymised,Baby was alive at outcome (Baby number in order of delivery),Participant,http://purl.obolibrary.org/obo/EUPATH_0042289,Child physical exam,Was baby alive at outcome (Baby number in order of delivery),,variable,yes,,,WOMAN,,,,,,,,,
http://purl.obolibrary.org/obo/EUPATH_0049157,Child healthy,WOMAN_Trial_dataset_anonymised::babyhealthy5 | WOMAN_Trial_dataset_anonymised::babyhealthy3 | WOMAN_Trial_dataset_anonymised::babyhealthy4 | WOMAN_Trial_dataset_anonymised::babyhealthy2 | WOMAN_Trial_dataset_anonymised::babyhealthy1,,WOMAN_Trial_dataset_anonymised,,Participant,http://purl.obolibrary.org/obo/EUPATH_0042289,Child physical exam,Was baby considered healthy at outcome (Baby number in order of delivery),,variable,yes,,,WOMAN,,,,,,,,,
http://purl.obolibrary.org/obo/EUPATH_0020001,Cause of death,WOMAN_Trial_dataset_anonymised::causedeath,,WOMAN_Trial_dataset_anonymised,,Participant,http://purl.obolibrary.org/obo/EUPATH_0000671,Death information,cause of death,,variable,,,,WOMAN,,,,,,,,,
http://purl.obolibrary.org/obo/EUPATH_0049145,Meddra code for cause of death,WOMAN_Trial_dataset_anonymised::causedeathothermeddra,,WOMAN_Trial_dataset_anonymised,,Participant,http://purl.obolibrary.org/obo/EUPATH_0000671,Death information,meddra code for other cause of death,,variable,,,,WOMAN,,,,,,,,,
http://purl.obolibrary.org/obo/EUPATH_0049120,Primary cause of hemorrhage,WOMAN_Trial_dataset_anonymised::primarycausehaem,,WOMAN_Trial_dataset_anonymised,,Participant,http://purl.obolibrary.org/obo/HP_0001787,Delivery complications,primary cause of haemorrhage,,variable,,,,WOMAN,,,,,,,,,
http://purl.obolibrary.org/obo/EUPATH_0000671,Death information,,,,,Participant,http://purl.obolibrary.org/obo/EUPATH_0010981,Demographics,,,category,,,,WOMAN,,,,,,,,,
http://purl.obolibrary.org/obo/EUPATH_0038002,Delivered at study hospital,WOMAN_Trial_dataset_anonymised::deliveryinhospital,,WOMAN_Trial_dataset_anonymised,,Participant,http://purl.obolibrary.org/obo/EUPATH_0010036,Eligibility criteria,patient gave birth at randomising hospital,,variable,,,,WOMAN,,,,,,,,,
http://purl.obolibrary.org/obo/EUPATH_0011690,Breastfeeding summary,,,,,Participant,http://purl.obolibrary.org/obo/EUPATH_0000678,Feeding,,,category,,,,WOMAN,,,,,,,,,
http://purl.obolibrary.org/obo/EUPATH_0049108,Discharge status,WOMAN_Trial_dataset_anonymised::dischargestatus,,WOMAN_Trial_dataset_anonymised,,Participant,http://purl.obolibrary.org/obo/EUPATH_0000308,Hospitalization,discharge status of women,,variable,,,,WOMAN,,,,,,,,,
http://purl.obolibrary.org/obo/EUPATH_0049105,ICU duration,WOMAN_Trial_dataset_anonymised::daysicu,,WOMAN_Trial_dataset_anonymised,,Participant,http://purl.obolibrary.org/obo/EUPATH_0000308,Hospitalization,number of days spent in the ICU,,variable,,,,WOMAN,,days,http://purl.obolibrary.org/obo/UO_0000033,,,,,,
http://purl.obolibrary.org/obo/HP_0001787,Delivery complications,,,,,Participant,http://purl.obolibrary.org/obo/EUPATH_0042001,Labor and delivery,,,category,,,,WOMAN,,,,,,,,,
http://purl.obolibrary.org/obo/EUPATH_0000581,Delivery mode,WOMAN_Trial_dataset_anonymised::typeofdelivery,,WOMAN_Trial_dataset_anonymised,,Participant,http://purl.obolibrary.org/obo/EUPATH_0042001,Labor and delivery,type of delivery,,variable,,,,WOMAN,,,,,,,,,
http://purl.obolibrary.org/obo/EUPATH_0049118,Full delivery of placenta,WOMAN_Trial_dataset_anonymised::placentadelivered,,WOMAN_Trial_dataset_anonymised,,Participant,http://purl.obolibrary.org/obo/EUPATH_0042001,Labor and delivery,full delivery of placenta,,variable,,,,WOMAN,,,,,,,,,
http://purl.obolibrary.org/obo/EUPATH_0042087,Infant count,WOMAN_Trial_dataset_anonymised::babynumber,,WOMAN_Trial_dataset_anonymised,,Participant,http://purl.obolibrary.org/obo/EUPATH_0042001,Labor and delivery,number of live babies from this pregnancy,,variable,,,,WOMAN,,,,,,,,,
http://purl.obolibrary.org/obo/EUPATH_0049128,Interval time between randomisation and delivery,WOMAN_Trial_dataset_anonymised::timedeliverytorand,,WOMAN_Trial_dataset_anonymised,"Interval time between randomization and delivery - in days, hours and minutes",Participant,http://purl.obolibrary.org/obo/EUPATH_0000310,Observation details,"interval time between randomisation and delivery - in days, hours and minutes",,variable,,,,WOMAN,,,,,,,,,
http://purl.obolibrary.org/obo/EUPATH_0049131,Interval time between randomization and death,WOMAN_Trial_dataset_anonymised::timerandtodeath,,WOMAN_Trial_dataset_anonymised,"Interval time between randomization and death if applicable - in days, hours and minutes ",Participant,http://purl.obolibrary.org/obo/EUPATH_0000310,Observation details,"interval time between randomisation and death if applicable - in days, hours and minutes",,variable,,,,WOMAN,,,,,,,,,
http://purl.obolibrary.org/obo/EUPATH_0049129,Interval time of hysterectomy after randomization,WOMAN_Trial_dataset_anonymised::timehysterectomyafterrand,,WOMAN_Trial_dataset_anonymised,Interval time of hysterectomy after randomization,Participant,http://purl.obolibrary.org/obo/EUPATH_0000310,Observation details,interval time of hysterectomy after randomisation,,variable,,,,WOMAN,,,,,,,,,
http://purl.obolibrary.org/obo/EUPATH_0049130,Interval time of hysterectomy before randomization,WOMAN_Trial_dataset_anonymised::timehysterectomybeforerand,,WOMAN_Trial_dataset_anonymised,Interval time of hysterectomy before randomization,Participant,http://purl.obolibrary.org/obo/EUPATH_0000310,Observation details,interval time of hysterectomy before randomisation,,variable,,,,WOMAN,,,,,,,,,
http://purl.obolibrary.org/obo/EUPATH_0049106,Time between randomization and discharge,WOMAN_Trial_dataset_anonymised::daysrandtodischarge,,WOMAN_Trial_dataset_anonymised,Interval time between randomisation and discharge if applicable - in days,Participant,http://purl.obolibrary.org/obo/EUPATH_0000310,Observation details,interval time between randomisation and discharge if applicable - in days,,variable,,,,WOMAN,,days,http://purl.obolibrary.org/obo/UO_0000033,,,,,,
http://purl.obolibrary.org/obo/EUPATH_0049141,Decision to perform a hysterectomy before delivery of baby,WOMAN_Trial_dataset_anonymised::hysterectomydecisionbeforedelive,,WOMAN_Trial_dataset_anonymised,,Participant,http://purl.obolibrary.org/obo/EUPATH_0042002,Obstetrics,was the decision to perform a hysterectomy taken before delivery of baby,,variable,,,,WOMAN,,,,,,,,,
http://purl.obolibrary.org/obo/EUPATH_0049142,Decision to perform a hysterectomy before randomization,WOMAN_Trial_dataset_anonymised::hysterectomydecisionbeforerandom,,WOMAN_Trial_dataset_anonymised,,Participant,http://purl.obolibrary.org/obo/EUPATH_0042002,Obstetrics,was the decision to perform a hysterectomy taken before randomisation,,variable,,,,WOMAN,,,,,,,,,
http://purl.obolibrary.org/obo/EUPATH_0049140,Hysterectomy,WOMAN_Trial_dataset_anonymised::hysterectomy,,WOMAN_Trial_dataset_anonymised,,Participant,http://purl.obolibrary.org/obo/EUPATH_0042002,Obstetrics,patient management: hysterectomy performed,,variable,,,,WOMAN,,,,,,,,,
http://purl.obolibrary.org/obo/EUPATH_0049143,Hysterectomy that was not influenced by a decision predelivery or prerandomization,WOMAN_Trial_dataset_anonymised::hysterectomyinfluenced,,WOMAN_Trial_dataset_anonymised,,Participant,http://purl.obolibrary.org/obo/EUPATH_0042002,Obstetrics,"hysterectomy that was not influenced by a decision predelivery or prerandomisation - this variable identifies hysterectomies, the decisions for which were made post randomisation. This variable was used for analysis of treatment effect on hysterectomy",,variable,,,,WOMAN,,,,,,,,,
http://purl.obolibrary.org/obo/EUPATH_0042001,Labor and delivery,,,,,Participant,http://purl.obolibrary.org/obo/EUPATH_0042002,Obstetrics,,,category,,,,WOMAN,,,,,,,,,
http://purl.obolibrary.org/obo/EUPATH_0049144,Reason for performing hysterectomy,WOMAN_Trial_dataset_anonymised::reasonhysterectomy,,WOMAN_Trial_dataset_anonymised,,Participant,http://purl.obolibrary.org/obo/EUPATH_0042002,Obstetrics,reason for performing hysterectomy,,variable,,,,WOMAN,,,,,,,,,
http://purl.obolibrary.org/obo/EUPATH_0010035,Administrative information,,,,,Participant,http://purl.obolibrary.org/obo/EUPATH_0000096,Participant,,,category,,,,WOMAN,,,,,,,,,
http://purl.obolibrary.org/obo/EUPATH_0049156,Child immediate clinical history,,,,,Participant,http://purl.obolibrary.org/obo/EUPATH_0000096,Participant,,,,,,,WOMAN,,,,,,,,,
http://purl.obolibrary.org/obo/EUPATH_0042289,Child physical exam,,,,,Participant,http://purl.obolibrary.org/obo/EUPATH_0000096,Participant,,,,,,,WOMAN,,,,,,,,,
http://purl.obolibrary.org/obo/EUPATH_0010981,Demographics,,,,,Participant,http://purl.obolibrary.org/obo/EUPATH_0000096,Participant,,,category,,,,WOMAN,,,,,,,,,
http://purl.obolibrary.org/obo/EUPATH_0000678,Feeding,,,,,Participant,http://purl.obolibrary.org/obo/EUPATH_0000096,Participant,,,category,,,,WOMAN,,,,,,,,,
http://purl.obolibrary.org/obo/EUPATH_0000308,Hospitalization,,,,,Participant,http://purl.obolibrary.org/obo/EUPATH_0000096,Participant,,,category,,,,WOMAN,,,,,,,,,
http://purl.obolibrary.org/obo/EUPATH_0000310,Observation details,,,,,Participant,http://purl.obolibrary.org/obo/EUPATH_0000096,Participant,,,category,,,,WOMAN,,,,,,,,,
http://purl.obolibrary.org/obo/EUPATH_0042002,Obstetrics,,,,,Participant,http://purl.obolibrary.org/obo/EUPATH_0000096,Participant,,,category,,,,WOMAN,,,,,,,,,
http://purl.obolibrary.org/obo/EUPATH_0000307,Participant study details,,,,,Participant,http://purl.obolibrary.org/obo/EUPATH_0000096,Participant,,,category,,,,WOMAN,,,,,,,,,
http://purl.obolibrary.org/obo/OGMS_0000083,Physical examination,,,,,Participant,http://purl.obolibrary.org/obo/EUPATH_0000096,Participant,,,category,,,,WOMAN,,,,,,,,,
http://purl.obolibrary.org/obo/EUPATH_0000309,Signs and symptoms,,,,,Participant,http://purl.obolibrary.org/obo/EUPATH_0000096,Participant,,,category,,,,WOMAN,,,,,,,,,
http://purl.obolibrary.org/obo/OGMS_0000090,Treatment,,,,,Participant,http://purl.obolibrary.org/obo/EUPATH_0000096,Participant,,,category,,,,WOMAN,,,,,,,,,
http://purl.obolibrary.org/obo/EUPATH_0049153,Randomized patient withdrew or was withdrawn,WOMAN_Trial_dataset_anonymised::wd,,WOMAN_Trial_dataset_anonymised,,Participant,http://purl.obolibrary.org/obo/EUPATH_0000307,Participant study details,randomised patients who later withdrew/ were withdrawn from the trial,,variable,,,,WOMAN,,,,,,,,,
http://purl.obolibrary.org/obo/EUPATH_0049152,Treatment allocation unblinded,WOMAN_Trial_dataset_anonymised::unblinded,,WOMAN_Trial_dataset_anonymised,,Participant,http://purl.obolibrary.org/obo/EUPATH_0000307,Participant study details,was treatment allocation unblinded,,variable,,,,WOMAN,,,,,,,,,
http://purl.obolibrary.org/obo/EUPATH_0021086,Systolic blood pressure,WOMAN_Trial_dataset_anonymised::systolicbloodpressure,,WOMAN_Trial_dataset_anonymised,,Participant,http://purl.obolibrary.org/obo/OGMS_0000083,Physical examination,systolic blood pressure in mmHg,,variable,,,,WOMAN,,mmHg,http://purl.obolibrary.org/obo/UO_0000272,,,,,,
http://purl.obolibrary.org/obo/EUPATH_0049136,Visual scale of patient's health by healthcare provider,WOMAN_Trial_dataset_anonymised::visualanaloguescale,,WOMAN_Trial_dataset_anonymised,,Participant,http://purl.obolibrary.org/obo/OGMS_0000083,Physical examination,scale of how good or bad patienit's health is in healthcarer's opinion,,variable,,,,WOMAN,,,,,,,,,
http://purl.obolibrary.org/obo/EUPATH_0049101,Anxious or depressed,WOMAN_Trial_dataset_anonymised::anxietydepression,,WOMAN_Trial_dataset_anonymised,Patient anxious or depressed at discharge or at 42 days,Participant,http://purl.obolibrary.org/obo/EUPATH_0000309,Signs and symptoms,patient anxious or depressed at discharge or at 42 days,,variable,,,,WOMAN,,,,,,,,,
http://purl.obolibrary.org/obo/EUPATH_0049104,Cardiac failure,WOMAN_Trial_dataset_anonymised::cardiacfailure,,WOMAN_Trial_dataset_anonymised,Patient complications: cardiac failure,Participant,http://purl.obolibrary.org/obo/EUPATH_0000309,Signs and symptoms,patient complications: cardiac failure,,variable,,,,WOMAN,,,,,,,,,
http://purl.obolibrary.org/obo/EUPATH_0049107,Deep vein thrombosis,WOMAN_Trial_dataset_anonymised::deepveinthrombosis,,WOMAN_Trial_dataset_anonymised,Patient complications: deep vein thrombosis,Participant,http://purl.obolibrary.org/obo/EUPATH_0000309,Signs and symptoms,patient complications: deep vein thrombosis,,variable,,,,WOMAN,,,,,,,,,
http://purl.obolibrary.org/obo/EUPATH_0049109,Estaimated blood loss,WOMAN_Trial_dataset_anonymised::estbloodloss,,WOMAN_Trial_dataset_anonymised,,Participant,http://purl.obolibrary.org/obo/EUPATH_0000309,Signs and symptoms,estimated volume of blood lost in mL,,variable,,,,WOMAN,,ml,http://purl.obolibrary.org/obo/UO_0000098,,,,,,
http://purl.obolibrary.org/obo/EUPATH_0049124,Experiencing any problems with selfcare,WOMAN_Trial_dataset_anonymised::selfcare,,WOMAN_Trial_dataset_anonymised,,Participant,http://purl.obolibrary.org/obo/EUPATH_0000309,Signs and symptoms,"patient experiencing any problems with selfcare, at discharge or at 42 days",,variable,,,,WOMAN,,,,,,,,,
http://purl.obolibrary.org/obo/EUPATH_0049133,Experiencing any problems with usual activities,WOMAN_Trial_dataset_anonymised::usualactivities,,WOMAN_Trial_dataset_anonymised,"Patient experiencing any problems with usual activities at discharge, or at 42 days",Participant,http://purl.obolibrary.org/obo/EUPATH_0000309,Signs and symptoms,"patient experiencing any problems with usual activities at discharge, or at 42 days",,variable,,,,WOMAN,,,,,,,,,
http://purl.obolibrary.org/obo/EUPATH_0049126,Hemodynamic instability,WOMAN_Trial_dataset_anonymised::signsinstability,,WOMAN_Trial_dataset_anonymised,,Participant,http://purl.obolibrary.org/obo/EUPATH_0000309,Signs and symptoms,signs of haemodynamic instability,,variable,,,,WOMAN,,,,,,,,,
http://purl.obolibrary.org/obo/EUPATH_0049149,Hepatic failure,WOMAN_Trial_dataset_anonymised::hepaticfailure,,WOMAN_Trial_dataset_anonymised,,Participant,http://purl.obolibrary.org/obo/EUPATH_0000309,Signs and symptoms,patient complications: hepatic failure,,variable,,,,WOMAN,,,,,,,,,
http://purl.obolibrary.org/obo/EUPATH_0049115,Myocardial infarction,WOMAN_Trial_dataset_anonymised::myocardialinfarction,,WOMAN_Trial_dataset_anonymised,,Participant,http://purl.obolibrary.org/obo/EUPATH_0000309,Signs and symptoms,patient complications: myocardial infarction,,variable,,,,WOMAN,,,,,,,,,
http://purl.obolibrary.org/obo/EUPATH_0049117,Pain or discomfort,WOMAN_Trial_dataset_anonymised::paindiscomfort,,WOMAN_Trial_dataset_anonymised,"Patient experiencing any pain or discomfort, at discharge or at 42 days",Participant,http://purl.obolibrary.org/obo/EUPATH_0000309,Signs and symptoms,"patient experiencing any pain or discomfort, at discharge or at 42 days",,variable,,,,WOMAN,,,,,,,,,
http://purl.obolibrary.org/obo/EUPATH_0049114,Problems with mobility,WOMAN_Trial_dataset_anonymised::mobility,,WOMAN_Trial_dataset_anonymised,"Patient experiencing any problems with mobility, at discharge or at 42 days",Participant,http://purl.obolibrary.org/obo/EUPATH_0000309,Signs and symptoms,"patient experiencing any problems with mobility, at discharge or at 42 days",,variable,,,,WOMAN,,,,,,,,,
http://purl.obolibrary.org/obo/EUPATH_0049122,Pulmonary embolism,WOMAN_Trial_dataset_anonymised::pulmonaryembolism,,WOMAN_Trial_dataset_anonymised,,Participant,http://purl.obolibrary.org/obo/EUPATH_0000309,Signs and symptoms,patient complications: pulmonary embolism,,variable,,,,WOMAN,,,,,,,,,
http://purl.obolibrary.org/obo/DOID_1074,Renal failure,WOMAN_Trial_dataset_anonymised::renalfailure,,WOMAN_Trial_dataset_anonymised,,Participant,http://purl.obolibrary.org/obo/EUPATH_0000309,Signs and symptoms,patient complications: renal failure,,variable,,,,WOMAN,,,,,,,,,
http://purl.obolibrary.org/obo/EUPATH_0049123,Respiratory failure,WOMAN_Trial_dataset_anonymised::respiratoryfailure,,WOMAN_Trial_dataset_anonymised,,Participant,http://purl.obolibrary.org/obo/EUPATH_0000309,Signs and symptoms,patient complications: respiratory failure,,variable,,,,WOMAN,,,,,,,,,
http://purl.obolibrary.org/obo/SYMP_0000124,Seizures,WOMAN_Trial_dataset_anonymised::seizure,,WOMAN_Trial_dataset_anonymised,,Participant,http://purl.obolibrary.org/obo/EUPATH_0000309,Signs and symptoms,patient complications: seizure,,variable,,,,WOMAN,,,,,,,,,
http://purl.obolibrary.org/obo/HP_0100806,Sepsis,WOMAN_Trial_dataset_anonymised::sepsis,,WOMAN_Trial_dataset_anonymised,,Participant,http://purl.obolibrary.org/obo/EUPATH_0000309,Signs and symptoms,patient complications: sepsis,,variable,,,,WOMAN,,,,,,,,,
http://purl.obolibrary.org/obo/EUPATH_0049127,Stroke,WOMAN_Trial_dataset_anonymised::stroke,,WOMAN_Trial_dataset_anonymised,,Participant,http://purl.obolibrary.org/obo/EUPATH_0000309,Signs and symptoms,patient complications: stroke,,variable,,,,WOMAN,,,,,,,,,
http://purl.obolibrary.org/obo/EUPATH_0049103,Brace suturing of uterus,WOMAN_Trial_dataset_anonymised::bracesuturesuterus,,WOMAN_Trial_dataset_anonymised,Brace suturing of uterus performed,Participant,http://purl.obolibrary.org/obo/OGMS_0000090,Treatment,patient management: brace suturing of uterus performed,,variable,,,,WOMAN,,,,,,,,,
http://purl.obolibrary.org/obo/EUPATH_0049146,Embolisation,WOMAN_Trial_dataset_anonymised::embolisation,,WOMAN_Trial_dataset_anonymised,,Participant,http://purl.obolibrary.org/obo/OGMS_0000090,Treatment,patient management: embolisation performed,,variable,,,,WOMAN,,,,,,,,,
http://purl.obolibrary.org/obo/EUPATH_0049147,Ergometrine administered,WOMAN_Trial_dataset_anonymised::ergometrine,,WOMAN_Trial_dataset_anonymised,Ergometrine administered after diagnosis of postpartum haemorrhage,Participant,http://purl.obolibrary.org/obo/OGMS_0000090,Treatment,ergometrine administered after diagnosis of postpartum haemorrhage,,variable,,,,WOMAN,,,,,,,,,
http://purl.obolibrary.org/obo/EUPATH_0049150,First dose of trial treatment given,WOMAN_Trial_dataset_anonymised::trialtreatdose1,,WOMAN_Trial_dataset_anonymised,,Participant,http://purl.obolibrary.org/obo/OGMS_0000090,Treatment,first dose of trial treatment given,,variable,,,,WOMAN,,,,,,,,,
http://purl.obolibrary.org/obo/EUPATH_0049121,Injectable prostaglandins,WOMAN_Trial_dataset_anonymised::prostaglandins,,WOMAN_Trial_dataset_anonymised,Injectable prostaglandins administered after diagnosis of postpartum haemorrhage,Participant,http://purl.obolibrary.org/obo/OGMS_0000090,Treatment,injectable prostaglandins administered after diagnosis of postpartum haemorrhage,,variable,,,,WOMAN,,,,,,,,,
http://purl.obolibrary.org/obo/EUPATH_0049110,Intrauterine tamponade,WOMAN_Trial_dataset_anonymised::intrauterinetamponade,,WOMAN_Trial_dataset_anonymised,Intrauterine tamponade performed,Participant,http://purl.obolibrary.org/obo/OGMS_0000090,Treatment,patient management: intrauterine tamponade performed,,variable,,,,WOMAN,,,,,,,,,
http://purl.obolibrary.org/obo/EUPATH_0049111,Laparotomy,WOMAN_Trial_dataset_anonymised::laparotomy,,WOMAN_Trial_dataset_anonymised,Laparotomy performed,Participant,http://purl.obolibrary.org/obo/OGMS_0000090,Treatment,patient management: laparotomy performed,,variable,,,,WOMAN,,,,,,,,,
http://purl.obolibrary.org/obo/EUPATH_0049112,Manual removal of placenta,WOMAN_Trial_dataset_anonymised::manualremovalofplacenta,,WOMAN_Trial_dataset_anonymised,Manual removal of placenta performed,Participant,http://purl.obolibrary.org/obo/OGMS_0000090,Treatment,patient management: manual removal of placenta performed,,variable,,,,WOMAN,,,,,,,,,
http://purl.obolibrary.org/obo/EUPATH_0033450,Mechanical ventilation,WOMAN_Trial_dataset_anonymised::mechanicalventilation,,WOMAN_Trial_dataset_anonymised,,Participant,http://purl.obolibrary.org/obo/OGMS_0000090,Treatment,patient management: mechanical ventilation performed,,variable,,,,WOMAN,,,,,,,,,
http://purl.obolibrary.org/obo/EUPATH_0049113,Misoprostol administered,WOMAN_Trial_dataset_anonymised::misoprostol,,WOMAN_Trial_dataset_anonymised,Misoprostol administered after diagnosis of postpartum haemorrhage,Participant,http://purl.obolibrary.org/obo/OGMS_0000090,Treatment,misoprostol administered after diagnosis of postpartum haemorrhage,,variable,,,,WOMAN,,,,,,,,,
http://purl.obolibrary.org/obo/EUPATH_0049116,Oxytocin administered,WOMAN_Trial_dataset_anonymised::oxytocin,,WOMAN_Trial_dataset_anonymised,Oxytocin administered after diagnosis of postpartum haemorrhage,Participant,http://purl.obolibrary.org/obo/OGMS_0000090,Treatment,oxytocin administered after diagnosis of postpartum haemorrhage,,variable,,,,WOMAN,,,,,,,,,
http://purl.obolibrary.org/obo/EUPATH_0049134,Prophylactic uterotonics adminstered,WOMAN_Trial_dataset_anonymised::uteroproph,,WOMAN_Trial_dataset_anonymised,Prophylactic uterotonics adminstered,Participant,http://purl.obolibrary.org/obo/OGMS_0000090,Treatment,prophylactic uterotonics adminstered,,variable,,,,WOMAN,,,,,,,,,
http://purl.obolibrary.org/obo/EUPATH_0049151,Second dose of trial treatment given,WOMAN_Trial_dataset_anonymised::trialtreatdose2,,WOMAN_Trial_dataset_anonymised,,Participant,http://purl.obolibrary.org/obo/OGMS_0000090,Treatment,second dose of trial treatment given,,variable,,,,WOMAN,,,,,,,,,
http://purl.obolibrary.org/obo/EUPATH_0049132,Transfusion of blood products,WOMAN_Trial_dataset_anonymised::transfusion,,WOMAN_Trial_dataset_anonymised,,Participant,http://purl.obolibrary.org/obo/OGMS_0000090,Treatment,transfusion of blood products given,,variable,,,,WOMAN,,,,,,,,,
http://purl.obolibrary.org/obo/EUPATH_0049119,Units of fresh frozen plasma,WOMAN_Trial_dataset_anonymised::plasma,,WOMAN_Trial_dataset_anonymised,,Participant,http://purl.obolibrary.org/obo/OGMS_0000090,Treatment,units of fressh frozen plasma given,,variable,,,,WOMAN,,,,,,,,,
http://purl.obolibrary.org/obo/EUPATH_0049155,Units of non-blood products given,WOMAN_Trial_dataset_anonymised::otherbp,,WOMAN_Trial_dataset_anonymised,,Participant,http://purl.obolibrary.org/obo/OGMS_0000090,Treatment,units of other blood products given,,variable,,,,WOMAN,,,,,,,,,
http://purl.obolibrary.org/obo/EUPATH_0049154,Units of whole blood/packed cells given,WOMAN_Trial_dataset_anonymised::cells,,WOMAN_Trial_dataset_anonymised,,Participant,http://purl.obolibrary.org/obo/OGMS_0000090,Treatment,units of whole blood/packed cells given,,variable,,,,WOMAN,,,,,,,,,
http://purl.obolibrary.org/obo/EUPATH_0049102,Uterine arterial ligation,WOMAN_Trial_dataset_anonymised::arteryligation,,WOMAN_Trial_dataset_anonymised,Rrterial ligation performed,Participant,http://purl.obolibrary.org/obo/OGMS_0000090,Treatment,patient management: arterial ligation performed,,variable,,,,WOMAN,,,,,,,,,
