IRI,label,variable,displayOrder,dataFile,definition,category,parentIRI,parentLabel,codebookDescription,codebookValues,termType,repeated,is_temporal,mergeKey,dataSet,unitLabel,unitIRI,is_featured,hidden,scale,forceTostring,defaultDisplayRangeMin,defaultDisplayRangeMax,defaultBinWidth
http://purl.obolibrary.org/obo/EUPATH_0054221,People's attitudes about using PrEP make you feel worse about yourself,jilindeprospectiveco_data_labels_2021-12-01_1005::x345,4,jilindeprospectiveco_data_labels_2021-12-01_1005,People's attitudes about using PrEP make you feel worse about yourself,Participant,http://purl.obolibrary.org/obo/EUPATH_0054278,Self-perception of PrEP,137. People's attitudes about using PrEP make you feel worse about yourself,,value,yes,,,Jilinde_prospective_cohort,,,,,,,,,
http://purl.obolibrary.org/obo/EUPATH_0054334,Person who initiated first sexual intercourse,jilindeprospectiveco_data_labels_2021-12-01_1005::x173,71,jilindeprospectiveco_data_labels_2021-12-01_1005,Who initiated your first sexual intercourse encounter?,Participant,http://purl.obolibrary.org/obo/EUPATH_0053598,Sexual behavior,36. Who initiated your first sexual intercourse encounter?,,variable,yes,,,Jilinde_prospective_cohort,,,,,,,,,
http://purl.obolibrary.org/obo/EUPATH_0054335,Person who initiated first sexual intercourse specified,jilindeprospectiveco_data_labels_2021-12-01_1005::x174,72,jilindeprospectiveco_data_labels_2021-12-01_1005,"Other, Specify",Participant,http://purl.obolibrary.org/obo/EUPATH_0053598,Sexual behavior,"Other, Specify",,variable,yes,,,Jilinde_prospective_cohort,,,,,,,,,
http://purl.obolibrary.org/obo/EUPATH_0054222,Personal diary date,jilindeprospectiveco_data_labels_2021-12-01_1005::x356,19,jilindeprospectiveco_data_labels_2021-12-01_1005,Date,Participant,http://purl.obolibrary.org/obo/EUPATH_0010035,Administrative information,Date,,variable,yes,,,Jilinde_prospective_cohort,,,,,,,,,
http://purl.obolibrary.org/obo/EUPATH_0054043,Personal diary form complete,jilindeprospectiveco_data_labels_2021-12-01_1005::x347,9,jilindeprospectiveco_data_labels_2021-12-01_1005,Complete?,Participant,http://purl.obolibrary.org/obo/EUPATH_0010035,Administrative information,Complete?,,variable,yes,,,Jilinde_prospective_cohort,,,,,,,,,
http://purl.obolibrary.org/obo/EUPATH_0000019,Persons living in house count,jilindeprospectiveco_data_labels_2021-12-01_1005::x29,1,jilindeprospectiveco_data_labels_2021-12-01_1005,"How many people live in your household? By household, I mean the number of people who eat from the same pot",Household,http://purl.obolibrary.org/obo/EUPATH_0000304,Socioeconomic factors,"4. How many people live in your household? By household, I mean the number of people who eat from the same pot.",,variable,yes,,,Jilinde_prospective_cohort,,,,,,,,,
http://purl.obolibrary.org/obo/EUPATH_0054223,Poor appetite or overeating,jilindeprospectiveco_data_labels_2021-12-01_1005::x330,6,jilindeprospectiveco_data_labels_2021-12-01_1005,Poor appetite or overeating,Participant,http://purl.obolibrary.org/obo/EUPATH_0054031,Bothered by any of the following problems over the last two weeks,122. Poor appetite or overeating,,value,yes,,,Jilinde_prospective_cohort,,,,,,,,,
http://purl.obolibrary.org/obo/EUPATH_0054225,Post-exposure prophylaxis (PEP),jilindeprospectiveco_data_labels_2021-12-01_1005::x303,7,jilindeprospectiveco_data_labels_2021-12-01_1005,What services have you received from this/these organizations? (choice=Post-exposure prophylaxis (PEP)),Participant,http://purl.obolibrary.org/obo/EUPATH_0054312,Type of received service (AGYW),111. What services have you received from this/these organizations? (choice=Post-exposure prophylaxis (PEP)),,value,yes,,,Jilinde_prospective_cohort,,,,,,,,,
http://purl.obolibrary.org/obo/EUPATH_0054226,Post-exposure prophylaxis (PEP),jilindeprospectiveco_data_labels_2021-12-01_1005::x248,6,jilindeprospectiveco_data_labels_2021-12-01_1005,What services have you received from this/these organizations? (choice=Post-exposure prophylaxis (PEP)),Participant,http://purl.obolibrary.org/obo/EUPATH_0054314,Type of received service (MSM),96. What services have you received from this/these organizations? (choice=Post-exposure prophylaxis (PEP)),,value,yes,,,Jilinde_prospective_cohort,,,,,,,,,
http://purl.obolibrary.org/obo/EUPATH_0054224,Post-exposure prophylaxis (PEP),jilindeprospectiveco_data_labels_2021-12-01_1005::x261,6,jilindeprospectiveco_data_labels_2021-12-01_1005,What services have you received from this/these organizations? (choice=Post-exposure prophylaxis (PEP)),Participant,http://purl.obolibrary.org/obo/EUPATH_0054317,Type of received service(Sex worker),100. What services have you received from this/these organizations? (choice=Post-exposure prophylaxis (PEP)),,value,yes,,,Jilinde_prospective_cohort,,,,,,,,,
http://purl.obolibrary.org/obo/UBERON_0009097,Pregnant,jilindeprospectiveco_data_labels_2021-12-01_1005::x41,1,jilindeprospectiveco_data_labels_2021-12-01_1005,Are you currently pregnant?,Participant,http://purl.obolibrary.org/obo/EUPATH_0042002,Obstetrics,13. Are you currently pregnant?,,variable,yes,,,Jilinde_prospective_cohort,,,,,,,,,
http://purl.obolibrary.org/obo/EUPATH_0053597,PrEP,,1,,,Participant,http://purl.obolibrary.org/obo/EUPATH_0054343,HIV/AIDS and STIs,,,category,,,,Jilinde_prospective_cohort,,,,,,,,,
http://purl.obolibrary.org/obo/EUPATH_0054044,PrEP perception form complete,jilindeprospectiveco_data_labels_2021-12-01_1005::x355,10,jilindeprospectiveco_data_labels_2021-12-01_1005,Complete?,Participant,http://purl.obolibrary.org/obo/EUPATH_0010035,Administrative information,Complete?,,variable,yes,,,Jilinde_prospective_cohort,,,,,,,,,
http://purl.obolibrary.org/obo/EUPATH_0054045,PrEP usage patterns and sexual behaviors form complete,jilindeprospectiveco_data_labels_2021-12-01_1005::x360,11,jilindeprospectiveco_data_labels_2021-12-01_1005,Complete?,Participant,http://purl.obolibrary.org/obo/EUPATH_0010035,Administrative information,Complete?,,variable,yes,,,Jilinde_prospective_cohort,,,,,,,,,
http://purl.obolibrary.org/obo/EUPATH_0054227,PrEP use pattern date,jilindeprospectiveco_data_labels_2021-12-01_1005::x348,32,jilindeprospectiveco_data_labels_2021-12-01_1005,Date,Participant,http://purl.obolibrary.org/obo/EUPATH_0053597,PrEP,Date,,variable,yes,,,Jilinde_prospective_cohort,,,,,,,,,
http://purl.obolibrary.org/obo/EUPATH_0054228,PrEP use pattern day,jilindeprospectiveco_data_labels_2021-12-01_1005::x349,33,jilindeprospectiveco_data_labels_2021-12-01_1005,Day,Participant,http://purl.obolibrary.org/obo/EUPATH_0053597,PrEP,Day,,variable,yes,,,Jilinde_prospective_cohort,,,,,,,,,
http://purl.obolibrary.org/obo/EUPATH_0054229,Prevents HIV Infection,jilindeprospectiveco_data_labels_2021-12-01_1005::x67,1,jilindeprospectiveco_data_labels_2021-12-01_1005,Does PrEP Prevent HIV Infection,Participant,http://purl.obolibrary.org/obo/EUPATH_0054319,Understanding of benefits of PrEP,Does PrEP Prevent HIV Infection,,value,yes,,,Jilinde_prospective_cohort,,,,,,,,,
http://purl.obolibrary.org/obo/EUPATH_0054229,Prevents HIV Infection,jilindeprospectiveco_data_labels_2021-12-01_1005::x93,2,jilindeprospectiveco_data_labels_2021-12-01_1005,Does PrEP Prevent HIV Infection,Participant,http://purl.obolibrary.org/obo/EUPATH_0054319,Understanding of benefits of PrEP,Prevents HIV Infection,,value,yes,,,Jilinde_prospective_cohort,,,,,,,,,
http://purl.obolibrary.org/obo/EUPATH_0054230,Prevents pregnancy,jilindeprospectiveco_data_labels_2021-12-01_1005::x69,3,jilindeprospectiveco_data_labels_2021-12-01_1005,Does PrEP Prevent Pregnancy,Participant,http://purl.obolibrary.org/obo/EUPATH_0054319,Understanding of benefits of PrEP,Does PrEP Prevent Pregnancy,,value,yes,,,Jilinde_prospective_cohort,,,,,,,,,
http://purl.obolibrary.org/obo/EUPATH_0054230,Prevents pregnancy,jilindeprospectiveco_data_labels_2021-12-01_1005::x95,4,jilindeprospectiveco_data_labels_2021-12-01_1005,Does PrEP Prevent Pregnancy,Participant,http://purl.obolibrary.org/obo/EUPATH_0054319,Understanding of benefits of PrEP,Prevents Pregnancy,,value,yes,,,Jilinde_prospective_cohort,,,,,,,,,
http://purl.obolibrary.org/obo/EUPATH_0054231,Prevents STI's,jilindeprospectiveco_data_labels_2021-12-01_1005::x68,5,jilindeprospectiveco_data_labels_2021-12-01_1005,Does PrEP Prevent STI's,Participant,http://purl.obolibrary.org/obo/EUPATH_0054319,Understanding of benefits of PrEP,Does PrEP Prevent STI's,,value,yes,,,Jilinde_prospective_cohort,,,,,,,,,
http://purl.obolibrary.org/obo/EUPATH_0054231,Prevents STI's,jilindeprospectiveco_data_labels_2021-12-01_1005::x94,6,jilindeprospectiveco_data_labels_2021-12-01_1005,Does PrEP Prevent STI's,Participant,http://purl.obolibrary.org/obo/EUPATH_0054319,Understanding of benefits of PrEP,Prevents STI's,,value,yes,,,Jilinde_prospective_cohort,,,,,,,,,
http://purl.obolibrary.org/obo/EUPATH_0054235,Reason at high or medium risk of HIV,,11,jilindeprospectiveco_data_labels_2021-12-01_1005,,Participant,http://purl.obolibrary.org/obo/EUPATH_0054343,HIV/AIDS and STIs,,,multifilter,,,,Jilinde_prospective_cohort,,,,,,,,,
http://purl.obolibrary.org/obo/EUPATH_0054236,Reason at high or medium risk of HIV specified,jilindeprospectiveco_data_labels_2021-12-01_1005::x161,12,jilindeprospectiveco_data_labels_2021-12-01_1005,"Other, Specify",Participant,http://purl.obolibrary.org/obo/EUPATH_0054343,HIV/AIDS and STIs,"Other, Specify",,variable,yes,,,Jilinde_prospective_cohort,,,,,,,,,
http://purl.obolibrary.org/obo/EUPATH_0054237,Reason at low or no risk of HIV,,13,jilindeprospectiveco_data_labels_2021-12-01_1005,,Participant,http://purl.obolibrary.org/obo/EUPATH_0054343,HIV/AIDS and STIs,,,multifilter,,,,Jilinde_prospective_cohort,,,,,,,,,
http://purl.obolibrary.org/obo/EUPATH_0054238,Reason at low or no risk of HIV specified,jilindeprospectiveco_data_labels_2021-12-01_1005::x171,14,jilindeprospectiveco_data_labels_2021-12-01_1005,"Other, Specify",Participant,http://purl.obolibrary.org/obo/EUPATH_0054343,HIV/AIDS and STIs,"Other, Specify",,variable,yes,,,Jilinde_prospective_cohort,,,,,,,,,
http://purl.obolibrary.org/obo/EUPATH_0054239,Reason for becoming a sex worker,,13,jilindeprospectiveco_data_labels_2021-12-01_1005,,Participant,http://purl.obolibrary.org/obo/EUPATH_0054344,Commercial sex and activity,,,multifilter,,,,Jilinde_prospective_cohort,,,,,,,,,
http://purl.obolibrary.org/obo/EUPATH_0054240,Reason for becoming a sex worker specified,jilindeprospectiveco_data_labels_2021-12-01_1005::x275,14,jilindeprospectiveco_data_labels_2021-12-01_1005,"Other, Specify",Participant,http://purl.obolibrary.org/obo/EUPATH_0054344,Commercial sex and activity,"Other, Specify",,variable,yes,,,Jilinde_prospective_cohort,,,,,,,,,
http://purl.obolibrary.org/obo/EUPATH_0054242,Reason for declining PrEP offer specified,jilindeprospectiveco_data_labels_2021-12-01_1005::x92,36,jilindeprospectiveco_data_labels_2021-12-01_1005,"Other, Specify",Participant,http://purl.obolibrary.org/obo/EUPATH_0053597,PrEP,"Other, Specify",,variable,yes,,,Jilinde_prospective_cohort,,,,,,,,,
http://purl.obolibrary.org/obo/EUPATH_0054243,Reason for having condomless sex with clients,,15,jilindeprospectiveco_data_labels_2021-12-01_1005,,Participant,http://purl.obolibrary.org/obo/EUPATH_0054344,Commercial sex and activity,,,multifilter,,,,Jilinde_prospective_cohort,,,,,,,,,
http://purl.obolibrary.org/obo/EUPATH_0054244,Reason for having condomless sex with clients specified,jilindeprospectiveco_data_labels_2021-12-01_1005::x292,16,jilindeprospectiveco_data_labels_2021-12-01_1005,"Other, Specify",Participant,http://purl.obolibrary.org/obo/EUPATH_0054344,Commercial sex and activity,"Other, Specify",,variable,yes,,,Jilinde_prospective_cohort,,,,,,,,,
http://purl.obolibrary.org/obo/EUPATH_0054232,Reason for not participating in follow-up period,jilindeprospectiveco_data_labels_2021-12-01_1005::x363,20,jilindeprospectiveco_data_labels_2021-12-01_1005,Why did the participant not participate in this follow-up period,Participant,http://purl.obolibrary.org/obo/EUPATH_0010035,Administrative information,Why did the participant not participate in this follow-up period,,variable,yes,,,Jilinde_prospective_cohort,,,,,,,,,
http://purl.obolibrary.org/obo/EUPATH_0054233,Reason for not participating in follow-up period specified,jilindeprospectiveco_data_labels_2021-12-01_1005::x364,21,jilindeprospectiveco_data_labels_2021-12-01_1005,Other specify,Participant,http://purl.obolibrary.org/obo/EUPATH_0010035,Administrative information,Other specify,,variable,yes,,,Jilinde_prospective_cohort,,,,,,,,,
http://purl.obolibrary.org/obo/EUPATH_0054247,Reason of not reconsidering taking PrEP ,jilindeprospectiveco_data_labels_2021-12-01_1005::x127,37,jilindeprospectiveco_data_labels_2021-12-01_1005,Are there specific reasons why you would not re-consider taking PrEP again?,Participant,http://purl.obolibrary.org/obo/EUPATH_0053597,PrEP,12. Are there specific reasons why you would not re-consider taking PrEP again?,,variable,yes,,,Jilinde_prospective_cohort,,,,,,,,,
http://purl.obolibrary.org/obo/EUPATH_0054248,Reason of reconsidering taking PrEP,jilindeprospectiveco_data_labels_2021-12-01_1005::x125,38,jilindeprospectiveco_data_labels_2021-12-01_1005,What would most lead you to start taking PrEP again in the future?,Participant,http://purl.obolibrary.org/obo/EUPATH_0053597,PrEP,11. What would most lead you to start taking PrEP again in the future?,,variable,yes,,,Jilinde_prospective_cohort,,,,,,,,,
http://purl.obolibrary.org/obo/EUPATH_0054248,Reason of reconsidering taking PrEP,jilindeprospectiveco_data_labels_2021-12-01_1005::x126,39,jilindeprospectiveco_data_labels_2021-12-01_1005,Other specify,Participant,http://purl.obolibrary.org/obo/EUPATH_0053597,PrEP,Other specify,,variable,yes,,,Jilinde_prospective_cohort,,,,,,,,,
http://purl.obolibrary.org/obo/EUPATH_0054241,Reason to decline PrEP offer,,35,jilindeprospectiveco_data_labels_2021-12-01_1005,,Participant,http://purl.obolibrary.org/obo/EUPATH_0053597,PrEP,,,multifilter,,,,Jilinde_prospective_cohort,,,,,,,,,
http://purl.obolibrary.org/obo/EUPATH_0054245,Reason to have condomless sex with partners (AGYW),,56,jilindeprospectiveco_data_labels_2021-12-01_1005,,Participant,http://purl.obolibrary.org/obo/EUPATH_0053598,Sexual behavior,,,multifilter,,,,Jilinde_prospective_cohort,,,,,,,,,
http://purl.obolibrary.org/obo/EUPATH_0054246,Reason to have condomless sex with partners (AGYW) specified,jilindeprospectiveco_data_labels_2021-12-01_1005::x323,57,jilindeprospectiveco_data_labels_2021-12-01_1005,"Other, Specify",Participant,http://purl.obolibrary.org/obo/EUPATH_0053598,Sexual behavior,"Other, Specify",,variable,yes,,,Jilinde_prospective_cohort,,,,,,,,,
http://purl.obolibrary.org/obo/EUPATH_0054234,Reason to stop PrEP due to provider,jilindeprospectiveco_data_labels_2021-12-01_1005::x119,34,jilindeprospectiveco_data_labels_2021-12-01_1005,"Whenever you stopped taking PrEP, what were the reasons you stopped taking it (or never started taking PrEP at all)? Reason provider gave to stop PrEP",Participant,http://purl.obolibrary.org/obo/EUPATH_0053597,PrEP,"8. Whenever you stopped taking PrEP, what were the reasons you stopped taking it (or never started taking PrEP at all)? Reason provider gave to stop PrEP",,variable,yes,,,Jilinde_prospective_cohort,,,,,,,,,
http://purl.obolibrary.org/obo/EUPATH_0054347,Reason to stop PrEP due to provider specified,jilindeprospectiveco_data_labels_2021-12-01_1005::x120,53,jilindeprospectiveco_data_labels_2021-12-01_1005,Other specify,Participant,http://purl.obolibrary.org/obo/EUPATH_0053597,PrEP,Other specify,,variable,yes,,,Jilinde_prospective_cohort,,,,,,,,,
http://purl.obolibrary.org/obo/EUPATH_0053594,Reason to stop taking PrEP,,2,jilindeprospectiveco_data_labels_2021-12-01_1005,,Participant,http://purl.obolibrary.org/obo/EUPATH_0053597,PrEP,,,multifilter,,,,Jilinde_prospective_cohort,,,,,,,,,
http://purl.obolibrary.org/obo/EUPATH_0054250,Recommended by a peer,jilindeprospectiveco_data_labels_2021-12-01_1005::x269,6,jilindeprospectiveco_data_labels_2021-12-01_1005,What informed your decision to begin sex work? (choice=Sex work recommended by a peer),Participant,http://purl.obolibrary.org/obo/EUPATH_0054239,Reason to become a sex worker,101. What informed your decision to begin sex work? (choice=Sex work recommended by a peer),,value,yes,,,Jilinde_prospective_cohort,,,,,,,,,
http://purl.obolibrary.org/obo/EUPATH_0054251,Reconsider PrEP in the future,jilindeprospectiveco_data_labels_2021-12-01_1005::x124,40,jilindeprospectiveco_data_labels_2021-12-01_1005,Do you think that you might reconsider your decision to stop and begin taking PrEP again at some point in the future?,Participant,http://purl.obolibrary.org/obo/EUPATH_0053597,PrEP,10. Do you think that you might reconsider your decision to stop and begin taking PrEP again at some point in the future?,,variable,yes,,,Jilinde_prospective_cohort,,,,,,,,,
http://purl.obolibrary.org/obo/EUPATH_0054252,Reconsider PrEP offer in the future,jilindeprospectiveco_data_labels_2021-12-01_1005::x96,41,jilindeprospectiveco_data_labels_2021-12-01_1005,Do you think that you might reconsider the offer of PrEP at some future date?,Participant,http://purl.obolibrary.org/obo/EUPATH_0053597,PrEP,32. Do you think that you might reconsider the offer of PrEP at some future date?,,variable,yes,,,Jilinde_prospective_cohort,,,,,,,,,
http://purl.obolibrary.org/obo/EUPATH_0054253,Record create date,jilindeprospectiveco_data_labels_2021-12-01_1005::x8,22,jilindeprospectiveco_data_labels_2021-12-01_1005,Record create date,Participant,http://purl.obolibrary.org/obo/EUPATH_0010035,Administrative information,Record create date,,variable,yes,,,Jilinde_prospective_cohort,,,,,,,,,
http://purl.obolibrary.org/obo/EUPATH_0051796,Refused to answer,jilindeprospectiveco_data_labels_2021-12-01_1005::x52,9,jilindeprospectiveco_data_labels_2021-12-01_1005,"What forms of contraception do you currently use, if any? (choice=Refused to answer)",Participant,http://purl.obolibrary.org/obo/EUPATH_0047689,Current contraceptive method(s),"14. What forms of contraception do you currently use, if any? (choice=Refused to answer)",,value,yes,,,Jilinde_prospective_cohort,,,,,,,,,
http://purl.obolibrary.org/obo/EUPATH_0054254,Refused to answer,jilindeprospectiveco_data_labels_2021-12-01_1005::x81,7,jilindeprospectiveco_data_labels_2021-12-01_1005,"Once you start taking PrEP, how do you think your sexual behaviors may change? (choice=Refused to answer)",Participant,http://purl.obolibrary.org/obo/EUPATH_0054148,Influence of PrEP on sexual behaviors,"28. Once you start taking PrEP, how do you think your sexual behaviors may change? (choice=Refused to answer)",,value,yes,,,Jilinde_prospective_cohort,,,,,,,,,
http://purl.obolibrary.org/obo/EUPATH_0054257,Refused to answer,jilindeprospectiveco_data_labels_2021-12-01_1005::x160,8,jilindeprospectiveco_data_labels_2021-12-01_1005,Why do you say that your risk of HIV is high or medium? (choice=Refused to answer),Participant,http://purl.obolibrary.org/obo/EUPATH_0054235,Reason to at high or medium risk of HIV,34. Why do you say that your risk of HIV is high or medium?  (choice=Refused to answer),,value,yes,,,Jilinde_prospective_cohort,,,,,,,,,
http://purl.obolibrary.org/obo/EUPATH_0054258,Refused to answer,jilindeprospectiveco_data_labels_2021-12-01_1005::x170,7,jilindeprospectiveco_data_labels_2021-12-01_1005,Why do you say you are at low or no risk of HIV? (choice=Refused to answer),Participant,http://purl.obolibrary.org/obo/EUPATH_0054237,Reason to at low or no risk of HIV,35. Why do you say you are at low or no risk of HIV?  (choice=Refused to answer),,value,yes,,,Jilinde_prospective_cohort,,,,,,,,,
http://purl.obolibrary.org/obo/EUPATH_0054262,Refused to answer,jilindeprospectiveco_data_labels_2021-12-01_1005::x274,7,jilindeprospectiveco_data_labels_2021-12-01_1005,What informed your decision to begin sex work? (choice=Refused to answer),Participant,http://purl.obolibrary.org/obo/EUPATH_0054239,Reason to become a sex worker,101. What informed your decision to begin sex work? (choice=Refused to answer),,value,yes,,,Jilinde_prospective_cohort,,,,,,,,,
http://purl.obolibrary.org/obo/EUPATH_0054255,Refused to answer,jilindeprospectiveco_data_labels_2021-12-01_1005::x91,7,jilindeprospectiveco_data_labels_2021-12-01_1005,Why did you decline the offer of PrEP today? (choice=Refused to answer),Participant,http://purl.obolibrary.org/obo/EUPATH_0054241,Reason to decline PrEP offer,30. Why did you decline the offer of PrEP today? (choice=Refused to answer),,value,yes,,,Jilinde_prospective_cohort,,,,,,,,,
http://purl.obolibrary.org/obo/EUPATH_0054263,Refused to answer,jilindeprospectiveco_data_labels_2021-12-01_1005::x291,10,jilindeprospectiveco_data_labels_2021-12-01_1005,What are the reasons you don't use a condom with some or all of your clients? (choice=Refused to answer),Participant,http://purl.obolibrary.org/obo/EUPATH_0054243,Reason to have condomless sex with clients,106. What are the reasons you don't use a condom with some or all of your clients? (choice=Refused to answer),,value,yes,,,Jilinde_prospective_cohort,,,,,,,,,
http://purl.obolibrary.org/obo/EUPATH_0054265,Refused to answer,jilindeprospectiveco_data_labels_2021-12-01_1005::x322,10,jilindeprospectiveco_data_labels_2021-12-01_1005,What are the reasons you don't use a condom with some or all of your partners? (choice=Refused to answer),Participant,http://purl.obolibrary.org/obo/EUPATH_0054245,Reason to have condomless sex with partners (AGYW),116. What are the reasons you don't use a condom with some or all of your partners? (choice=Refused to answer),,value,yes,,,Jilinde_prospective_cohort,,,,,,,,,
http://purl.obolibrary.org/obo/EUPATH_0054256,Refused to answer,jilindeprospectiveco_data_labels_2021-12-01_1005::x118,7,jilindeprospectiveco_data_labels_2021-12-01_1005,"Whenever you stopped taking PrEP, what were the reasons you stopped taking it (or never started taking PrEP at all)? (choice=Refused to answer)",Participant,http://purl.obolibrary.org/obo/EUPATH_0053594,Reason to stop taking PrEP,"8. Whenever you stopped taking PrEP, what were the reasons you stopped taking it (or never started taking PrEP at all)? (choice=Refused to answer)",,value,yes,,,Jilinde_prospective_cohort,,,,,,,,,
http://purl.obolibrary.org/obo/EUPATH_0054259,Refused to answer,jilindeprospectiveco_data_labels_2021-12-01_1005::x240,6,jilindeprospectiveco_data_labels_2021-12-01_1005,I would now want to ask you whether you consider yourself a part of one or more of the following groups: - [for males only] men who have sex with men (MSM) - a sex worker (SW) - [for females only] a young woman between the age of 18-24 yrs (adolescent girl/young woman) (choice=Refused to answer),Participant,http://purl.obolibrary.org/obo/EUPATH_0054277,Self-defined sexual group,93. I would now want to ask you whether you consider yourself a part of one or more of the following groups:   - [for males only] men who have sex with men (MSM)   - a sex worker (SW)   - [for females only] a young woman between the age of 18-24 yrs (adolescent girl/young woman)   (choice=Refused to answer),,value,yes,,,Jilinde_prospective_cohort,,,,,,,,,
http://purl.obolibrary.org/obo/EUPATH_0054264,Refused to answer,jilindeprospectiveco_data_labels_2021-12-01_1005::x306,8,jilindeprospectiveco_data_labels_2021-12-01_1005,What services have you received from this/these organizations? (choice=Refused to answer),Participant,http://purl.obolibrary.org/obo/EUPATH_0054312,Type of received service (AGYW),111. What services have you received from this/these organizations? (choice=Refused to answer),,value,yes,,,Jilinde_prospective_cohort,,,,,,,,,
http://purl.obolibrary.org/obo/EUPATH_0054260,Refused to answer,jilindeprospectiveco_data_labels_2021-12-01_1005::x251,7,jilindeprospectiveco_data_labels_2021-12-01_1005,What services have you received from this/these organizations? (choice=Refused to answer),Participant,http://purl.obolibrary.org/obo/EUPATH_0054314,Type of received service (MSM),96. What services have you received from this/these organizations? (choice=Refused to answer),,value,yes,,,Jilinde_prospective_cohort,,,,,,,,,
http://purl.obolibrary.org/obo/EUPATH_0054261,Refused to answer,jilindeprospectiveco_data_labels_2021-12-01_1005::x264,7,jilindeprospectiveco_data_labels_2021-12-01_1005,What services have you received from this/these organizations? (choice=Refused to answer),Participant,http://purl.obolibrary.org/obo/EUPATH_0054317,Type of received service(Sex worker),100. What services have you received from this/these organizations? (choice=Refused to answer),,value,yes,,,Jilinde_prospective_cohort,,,,,,,,,
http://purl.obolibrary.org/obo/EUPATH_0054268,Relationship with 1st partner,jilindeprospectiveco_data_labels_2021-12-01_1005::x192,60,jilindeprospectiveco_data_labels_2021-12-01_1005,"Keeping these definitions in mind, is [part1_name] your husband/wife (a spouse), a regular partner, or a casual partner?",Participant,http://purl.obolibrary.org/obo/EUPATH_0053598,Sexual behavior,"53. Keeping these definitions in mind, is [part1_name] your husband/wife (a spouse), a regular partner, or a casual partner?",,variable,yes,,,Jilinde_prospective_cohort,,,,,,,,,
http://purl.obolibrary.org/obo/EUPATH_0054266,Relationship with 2nd partner,jilindeprospectiveco_data_labels_2021-12-01_1005::x209,58,jilindeprospectiveco_data_labels_2021-12-01_1005,"Keeping these definitions in mind, is [part2_name] your husband/wife (a spouse), a regular partner, or a casual partner?",Participant,http://purl.obolibrary.org/obo/EUPATH_0053598,Sexual behavior,"68. Keeping these definitions in mind, is [part2_name] your husband/wife (a spouse), a regular partner, or a casual partner?",,variable,yes,,,Jilinde_prospective_cohort,,,,,,,,,
