IRI,label,variable,displayOrder,dataFile,definition,category,parentIRI,parentLabel,codebookDescription,codebookValues,termType,repeated,is_temporal,mergeKey,dataSet,unitLabel,unitIRI,is_featured,hidden,scale,forceTostring,defaultDisplayRangeMin,defaultDisplayRangeMax,defaultBinWidth
http://purl.obolibrary.org/obo/EUPATH_0054172,Main reason to have condomless sex with clients specified,jilindeprospectiveco_data_labels_2021-12-01_1005::x294,11,jilindeprospectiveco_data_labels_2021-12-01_1005,What is the MAIN reason you don't use a condom with some or all of your clients? Specified,Participant,http://purl.obolibrary.org/obo/EUPATH_0054344,Commercial sex and activity,"Other, Specify",,variable,yes,,,Jilinde_prospective_cohort,,,,,,,,,
http://purl.obolibrary.org/obo/EUPATH_0054173,Main reason to have condomless sex with partners (AGYW),jilindeprospectiveco_data_labels_2021-12-01_1005::x324,53,jilindeprospectiveco_data_labels_2021-12-01_1005,What is the MAIN reason you don't use a condom with some or all of your partners?,Participant,http://purl.obolibrary.org/obo/EUPATH_0053598,Sexual behavior,117. What is the MAIN reason you don't use a condom with some or all of your partners?,,variable,yes,,,Jilinde_prospective_cohort,,,,,,,,,
http://purl.obolibrary.org/obo/EUPATH_0054174,Main reason to have condomless sex with partners (AGYW) specifed,jilindeprospectiveco_data_labels_2021-12-01_1005::x325,54,jilindeprospectiveco_data_labels_2021-12-01_1005,"Other, Specify",Participant,http://purl.obolibrary.org/obo/EUPATH_0053598,Sexual behavior,"Other, Specify",,variable,yes,,,Jilinde_prospective_cohort,,,,,,,,,
http://purl.obolibrary.org/obo/EUPATH_0054346,Main reason to stop PrEP due to provider  ,jilindeprospectiveco_data_labels_2021-12-01_1005::x122,52,jilindeprospectiveco_data_labels_2021-12-01_1005,Main reason that provider gave to stop PrEP,Participant,http://purl.obolibrary.org/obo/EUPATH_0053597,PrEP,Main reason that provider gave to stop PrEP,,variable,yes,,,Jilinde_prospective_cohort,,,,,,,,,
http://purl.obolibrary.org/obo/EUPATH_0054345,Main reason to stop PrEP due to provider specified,jilindeprospectiveco_data_labels_2021-12-01_1005::x123,51,jilindeprospectiveco_data_labels_2021-12-01_1005,Other specify,Participant,http://purl.obolibrary.org/obo/EUPATH_0053597,PrEP,Other specify,,variable,yes,,,Jilinde_prospective_cohort,,,,,,,,,
http://purl.obolibrary.org/obo/EUPATH_0053519,Main reason to stop taking PrEP,jilindeprospectiveco_data_labels_2021-12-01_1005::x121,1,jilindeprospectiveco_data_labels_2021-12-01_1005,"Whenever you stopped taking PrEP, what was the MAIN reason you stopped taking it (or never started taking PrEP at all)?",Participant,http://purl.obolibrary.org/obo/EUPATH_0053597,PrEP,"9. Whenever you stopped taking PrEP, what was the MAIN reason you stopped taking it (or never started taking PrEP at all)?",,variable,yes,,,Jilinde_prospective_cohort,,,,,,,,,
http://purl.obolibrary.org/obo/EUPATH_0054177,Male sex worker (MSW),jilindeprospectiveco_data_labels_2021-12-01_1005::x236,3,jilindeprospectiveco_data_labels_2021-12-01_1005,I would now want to ask you whether you consider yourself a part of one or more of the following groups: - [for males only] men who have sex with men (MSM) - a sex worker (SW) - [for females only] a young woman between the age of 18-24 yrs (adolescent girl/young woman) (choice=Male SW),Participant,http://purl.obolibrary.org/obo/EUPATH_0054277,Self-defined sexual group,93. I would now want to ask you whether you consider yourself a part of one or more of the following groups:   - [for males only] men who have sex with men (MSM)   - a sex worker (SW)   - [for females only] a young woman between the age of 18-24 yrs (adolescent girl/young woman)   (choice=Male SW),,value,yes,,,Jilinde_prospective_cohort,,,,,,,,,
http://purl.obolibrary.org/obo/EUPATH_0000374,Marital status,jilindeprospectiveco_data_labels_2021-12-01_1005::x33,1,jilindeprospectiveco_data_labels_2021-12-01_1005,Are you currently married or living together with a man/woman as married,Participant,http://purl.obolibrary.org/obo/EUPATH_0010981,Demographics,8. Are you currently married or living together with a man/woman as married,,variable,yes,,,Jilinde_prospective_cohort,,,,,,,,,
http://purl.obolibrary.org/obo/EUPATH_0054178,Men who have sex with men (MSM),jilindeprospectiveco_data_labels_2021-12-01_1005::x235,4,jilindeprospectiveco_data_labels_2021-12-01_1005,I would now want to ask you whether you consider yourself a part of one or more of the following groups: - [for males only] men who have sex with men (MSM) - a sex worker (SW) - [for females only] a young woman between the age of 18-24 yrs (adolescent girl/young woman) (choice=MSM),Participant,http://purl.obolibrary.org/obo/EUPATH_0054277,Self-defined sexual group,93. I would now want to ask you whether you consider yourself a part of one or more of the following groups:   - [for males only] men who have sex with men (MSM)   - a sex worker (SW)   - [for females only] a young woman between the age of 18-24 yrs (adolescent girl/young woman)   (choice=MSM),,value,yes,,,Jilinde_prospective_cohort,,,,,,,,,
http://purl.obolibrary.org/obo/EUPATH_0054180,Monthly income,jilindeprospectiveco_data_labels_2021-12-01_1005::x32,5,jilindeprospectiveco_data_labels_2021-12-01_1005,Approximately what is your gross monthly income?,Participant,http://purl.obolibrary.org/obo/EUPATH_0010981,Demographics,7. Approximately what is your gross monthly income?,,variable,yes,,,Jilinde_prospective_cohort,,,,,,,,,
http://purl.obolibrary.org/obo/EUPATH_0054181,Most people you know are uncomfortable around someone who takes PrEP,jilindeprospectiveco_data_labels_2021-12-01_1005::x343,1,jilindeprospectiveco_data_labels_2021-12-01_1005,Most people you know are uncomfortable around someone who takes PrEP,Participant,http://purl.obolibrary.org/obo/EUPATH_0054278,Self-perception of PrEP,135. Most people you know are uncomfortable around someone who takes PrEP,,value,yes,,,Jilinde_prospective_cohort,,,,,,,,,
http://purl.obolibrary.org/obo/EUPATH_0054182,Most people you know believe a person who takes PrEP is immoral,jilindeprospectiveco_data_labels_2021-12-01_1005::x341,2,jilindeprospectiveco_data_labels_2021-12-01_1005,Most people you know believe a person who takes PrEP is immoral,Participant,http://purl.obolibrary.org/obo/EUPATH_0054278,Self-perception of PrEP,133. Most people you know believe a person who takes PrEP is immoral,,value,yes,,,Jilinde_prospective_cohort,,,,,,,,,
http://purl.obolibrary.org/obo/EUPATH_0054183,Moving or speaking so slowly that other people could have noticed. Or being so fidgety or restless that you have been moving around a lot more than usual,jilindeprospectiveco_data_labels_2021-12-01_1005::x333,5,jilindeprospectiveco_data_labels_2021-12-01_1005,Moving or speaking so slowly that other people could have noticed . Or being so fidgety or restless that you have been moving around a lot more than usual,Participant,http://purl.obolibrary.org/obo/EUPATH_0054031,Bothered by any of the following problems over the last two weeks,125. Moving or speaking so slowly that other people could have noticed.  Or being so fidgety or restless that you have been moving around a lot more than usual,,value,yes,,,Jilinde_prospective_cohort,,,,,,,,,
http://purl.obolibrary.org/obo/EUPATH_0054184,My customers don't like using condoms and refuse,jilindeprospectiveco_data_labels_2021-12-01_1005::x282,8,jilindeprospectiveco_data_labels_2021-12-01_1005,What are the reasons you don't use a condom with some or all of your clients? (choice=My customers do not like using condoms and refuse),Participant,http://purl.obolibrary.org/obo/EUPATH_0054243,Reason to have condomless sex with clients,106. What are the reasons you don't use a condom with some or all of your clients? (choice=My customers do not like using condoms and refuse),,value,yes,,,Jilinde_prospective_cohort,,,,,,,,,
http://purl.obolibrary.org/obo/EUPATH_0054185,My partner or family members found out about my PrEP use and wanted me to stop taking it,jilindeprospectiveco_data_labels_2021-12-01_1005::x115,3,jilindeprospectiveco_data_labels_2021-12-01_1005,"Whenever you stopped taking PrEP, what were the reasons you stopped taking it (or never started taking PrEP at all)? (choice=My partner or family member(s) found out about my PrEP use and wanted me to stop taking it)",Participant,http://purl.obolibrary.org/obo/EUPATH_0053594,Reason to stop taking PrEP,"8. Whenever you stopped taking PrEP, what were the reasons you stopped taking it (or never started taking PrEP at all)? (choice=My partner or family member(s) found out about my PrEP use and wanted me to stop taking it)",,value,yes,,,Jilinde_prospective_cohort,,,,,,,,,
http://purl.obolibrary.org/obo/EUPATH_0054186,My partner/family/friends would not be supportive of me taking PrEP,jilindeprospectiveco_data_labels_2021-12-01_1005::x89,5,jilindeprospectiveco_data_labels_2021-12-01_1005,Why did you decline the offer of PrEP today? (choice=My partner/family/friends would not be supportive of me taking PrEP),Participant,http://purl.obolibrary.org/obo/EUPATH_0054241,Reason to decline PrEP offer,30. Why did you decline the offer of PrEP today? (choice=My partner/family/friends would not be supportive of me taking PrEP),,value,yes,,,Jilinde_prospective_cohort,,,,,,,,,
http://purl.obolibrary.org/obo/EUPATH_0054187,My partners don't like using condoms and refuse,jilindeprospectiveco_data_labels_2021-12-01_1005::x313,8,jilindeprospectiveco_data_labels_2021-12-01_1005,What are the reasons you don't use a condom with some or all of your partners? (choice=My partners do not like using condoms and refuse),Participant,http://purl.obolibrary.org/obo/EUPATH_0054245,Reason to have condomless sex with partners (AGYW),116. What are the reasons you don't use a condom with some or all of your partners? (choice=My partners do not like using condoms and refuse),,value,yes,,,Jilinde_prospective_cohort,,,,,,,,,
http://purl.obolibrary.org/obo/EUPATH_0054188,My provider advised me to stop taking PrEP,jilindeprospectiveco_data_labels_2021-12-01_1005::x116,4,jilindeprospectiveco_data_labels_2021-12-01_1005,"Whenever you stopped taking PrEP, what were the reasons you stopped taking it (or never started taking PrEP at all)? (choice=My provider advised me to stop)",Participant,http://purl.obolibrary.org/obo/EUPATH_0053594,Reason to stop taking PrEP,"8. Whenever you stopped taking PrEP, what were the reasons you stopped taking it (or never started taking PrEP at all)? (choice=My provider advised me to stop)",,value,yes,,,Jilinde_prospective_cohort,,,,,,,,,
http://purl.obolibrary.org/obo/EUPATH_0054189,Never had sex,jilindeprospectiveco_data_labels_2021-12-01_1005::x162,5,jilindeprospectiveco_data_labels_2021-12-01_1005,Why do you say you are at low or no risk of HIV? (choice=Never had sex),Participant,http://purl.obolibrary.org/obo/EUPATH_0054237,Reason to at low or no risk of HIV,35. Why do you say you are at low or no risk of HIV?  (choice=Never had sex),,value,yes,,,Jilinde_prospective_cohort,,,,,,,,,
http://purl.obolibrary.org/obo/EUPATH_0054190,No longer at risk/no longer needed PrEP,jilindeprospectiveco_data_labels_2021-12-01_1005::x112,5,jilindeprospectiveco_data_labels_2021-12-01_1005,"Whenever you stopped taking PrEP, what were the reasons you stopped taking it (or never started taking PrEP at all)? (choice=No longer at risk/no longer needed PrEP)",Participant,http://purl.obolibrary.org/obo/EUPATH_0053594,Reason to stop taking PrEP,"8. Whenever you stopped taking PrEP, what were the reasons you stopped taking it (or never started taking PrEP at all)? (choice=No longer at risk/no longer needed PrEP)",,value,yes,,,Jilinde_prospective_cohort,,,,,,,,,
http://purl.obolibrary.org/obo/EUPATH_0054191,None,jilindeprospectiveco_data_labels_2021-12-01_1005::x42,11,jilindeprospectiveco_data_labels_2021-12-01_1005,"What forms of contraception do you currently use, if any? (choice=None)",Participant,http://purl.obolibrary.org/obo/EUPATH_0047689,Current contraceptive method(s),"14. What forms of contraception do you currently use, if any? (choice=None)",,value,yes,,,Jilinde_prospective_cohort,,,,,,,,,
http://purl.obolibrary.org/obo/EUPATH_0054194,None,jilindeprospectiveco_data_labels_2021-12-01_1005::x305,4,jilindeprospectiveco_data_labels_2021-12-01_1005,What services have you received from this/these organizations? (choice=None),Participant,http://purl.obolibrary.org/obo/EUPATH_0054312,Type of received service (AGYW),111. What services have you received from this/these organizations? (choice=None),,value,yes,,,Jilinde_prospective_cohort,,,,,,,,,
http://purl.obolibrary.org/obo/EUPATH_0054192,None,jilindeprospectiveco_data_labels_2021-12-01_1005::x250,3,jilindeprospectiveco_data_labels_2021-12-01_1005,What services have you received from this/these organizations? (choice=None),Participant,http://purl.obolibrary.org/obo/EUPATH_0054314,Type of received service (MSM),96. What services have you received from this/these organizations? (choice=None),,value,yes,,,Jilinde_prospective_cohort,,,,,,,,,
http://purl.obolibrary.org/obo/EUPATH_0054193,None,jilindeprospectiveco_data_labels_2021-12-01_1005::x263,3,jilindeprospectiveco_data_labels_2021-12-01_1005,What services have you received from this/these organizations? (choice=None),Participant,http://purl.obolibrary.org/obo/EUPATH_0054317,Type of received service(Sex worker),100. What services have you received from this/these organizations? (choice=None),,value,yes,,,Jilinde_prospective_cohort,,,,,,,,,
http://purl.obolibrary.org/obo/EUPATH_0054195,None of these groups,jilindeprospectiveco_data_labels_2021-12-01_1005::x239,5,jilindeprospectiveco_data_labels_2021-12-01_1005,I would now want to ask you whether you consider yourself a part of one or more of the following groups: - [for males only] men who have sex with men (MSM) - a sex worker (SW) - [for females only] a young woman between the age of 18-24 yrs (adolescent girl/young woman) (choice=None of these group),Participant,http://purl.obolibrary.org/obo/EUPATH_0054277,Self-defined sexual group,93. I would now want to ask you whether you consider yourself a part of one or more of the following groups:   - [for males only] men who have sex with men (MSM)   - a sex worker (SW)   - [for females only] a young woman between the age of 18-24 yrs (adolescent girl/young woman)   (choice=None of these group),,value,yes,,,Jilinde_prospective_cohort,,,,,,,,,
http://purl.obolibrary.org/obo/EUPATH_0054196,Number of alcoholic drinks ,jilindeprospectiveco_data_labels_2021-12-01_1005::x354,55,jilindeprospectiveco_data_labels_2021-12-01_1005,Number of alcoholic drinks taken,Participant,http://purl.obolibrary.org/obo/EUPATH_0053598,Sexual behavior,Number of alcoholic drinks taken,,variable,yes,,,Jilinde_prospective_cohort,,,,,,,,,
http://purl.obolibrary.org/obo/EUPATH_0054198,Number of partners engaged in sex count,jilindeprospectiveco_data_labels_2021-12-01_1005::x351,30,jilindeprospectiveco_data_labels_2021-12-01_1005,Number of partners engaged in sex,Participant,http://purl.obolibrary.org/obo/EUPATH_0053597,PrEP,Number of partners engaged in sex,,variable,yes,,,Jilinde_prospective_cohort,,,,,,,,,
http://purl.obolibrary.org/obo/EUPATH_0054199,"Number of partners to exchange sex for money, gifts, or favors in past 12 months",jilindeprospectiveco_data_labels_2021-12-01_1005::x310,12,jilindeprospectiveco_data_labels_2021-12-01_1005,"From how many partners did you exchange sex for money, gifts, or favors in the past 12 months?",Participant,http://purl.obolibrary.org/obo/EUPATH_0054344,Commercial sex and activity,"114. From how many partners did you exchange sex for money, gifts, or favors in the past 12 months?",,variable,yes,,,Jilinde_prospective_cohort,,,,,,,,,
http://purl.obolibrary.org/obo/EUPATH_0000310,Observation details,,1,,,Participant,http://purl.obolibrary.org/obo/EUPATH_0000096,Participant,,,category,,,,Jilinde_prospective_cohort,,,,,,,,,
http://purl.obolibrary.org/obo/EUPATH_0042002,Obstetrics,,6,,,Participant,http://purl.obolibrary.org/obo/EUPATH_0000096,Participant,,,category,,,,Jilinde_prospective_cohort,,,,,,,,,
http://purl.obolibrary.org/obo/EUPATH_0047700,Other,jilindeprospectiveco_data_labels_2021-12-01_1005::x50,6,jilindeprospectiveco_data_labels_2021-12-01_1005,"What forms of contraception do you currently use, if any? (choice=Other)",Participant,http://purl.obolibrary.org/obo/EUPATH_0047689,Current contraceptive method(s),"14. What forms of contraception do you currently use, if any? (choice=Other)",,value,yes,,,Jilinde_prospective_cohort,,,,,,,,,
http://purl.obolibrary.org/obo/EUPATH_0054204,Other,jilindeprospectiveco_data_labels_2021-12-01_1005::x79,6,jilindeprospectiveco_data_labels_2021-12-01_1005,"Once you start taking PrEP, how do you think your sexual behaviors may change? (choice=Other)",Participant,http://purl.obolibrary.org/obo/EUPATH_0054148,Influence of PrEP on sexual behaviors,"28. Once you start taking PrEP, how do you think your sexual behaviors may change? (choice=Other)",,value,yes,,,Jilinde_prospective_cohort,,,,,,,,,
http://purl.obolibrary.org/obo/EUPATH_0054208,Other,jilindeprospectiveco_data_labels_2021-12-01_1005::x158,7,jilindeprospectiveco_data_labels_2021-12-01_1005,Why do you say that your risk of HIV is high or medium? (choice=Other),Participant,http://purl.obolibrary.org/obo/EUPATH_0054235,Reason to at high or medium risk of HIV,34. Why do you say that your risk of HIV is high or medium?  (choice=Other),,value,yes,,,Jilinde_prospective_cohort,,,,,,,,,
http://purl.obolibrary.org/obo/EUPATH_0054209,Other,jilindeprospectiveco_data_labels_2021-12-01_1005::x168,6,jilindeprospectiveco_data_labels_2021-12-01_1005,Why do you say you are at low or no risk of HIV? (choice=Other),Participant,http://purl.obolibrary.org/obo/EUPATH_0054237,Reason to at low or no risk of HIV,35. Why do you say you are at low or no risk of HIV?  (choice=Other),,value,yes,,,Jilinde_prospective_cohort,,,,,,,,,
http://purl.obolibrary.org/obo/EUPATH_0054212,Other,jilindeprospectiveco_data_labels_2021-12-01_1005::x273,5,jilindeprospectiveco_data_labels_2021-12-01_1005,What informed your decision to begin sex work? (choice=Other),Participant,http://purl.obolibrary.org/obo/EUPATH_0054239,Reason to become a sex worker,101. What informed your decision to begin sex work? (choice=Other),,value,yes,,,Jilinde_prospective_cohort,,,,,,,,,
http://purl.obolibrary.org/obo/EUPATH_0054205,Other,jilindeprospectiveco_data_labels_2021-12-01_1005::x90,6,jilindeprospectiveco_data_labels_2021-12-01_1005,Why did you decline the offer of PrEP today? (choice=Other),Participant,http://purl.obolibrary.org/obo/EUPATH_0054241,Reason to decline PrEP offer,30. Why did you decline the offer of PrEP today? (choice=Other),,value,yes,,,Jilinde_prospective_cohort,,,,,,,,,
http://purl.obolibrary.org/obo/EUPATH_0054213,Other,jilindeprospectiveco_data_labels_2021-12-01_1005::x290,9,jilindeprospectiveco_data_labels_2021-12-01_1005,What are the reasons you don't use a condom with some or all of your clients? (choice=Other),Participant,http://purl.obolibrary.org/obo/EUPATH_0054243,Reason to have condomless sex with clients,106. What are the reasons you don't use a condom with some or all of your clients? (choice=Other),,value,yes,,,Jilinde_prospective_cohort,,,,,,,,,
http://purl.obolibrary.org/obo/EUPATH_0054215,Other,jilindeprospectiveco_data_labels_2021-12-01_1005::x321,9,jilindeprospectiveco_data_labels_2021-12-01_1005,What are the reasons you don't use a condom with some or all of your partners? (choice=Other),Participant,http://purl.obolibrary.org/obo/EUPATH_0054245,Reason to have condomless sex with partners (AGYW),116. What are the reasons you don't use a condom with some or all of your partners? (choice=Other),,value,yes,,,Jilinde_prospective_cohort,,,,,,,,,
http://purl.obolibrary.org/obo/EUPATH_0054206,Other,jilindeprospectiveco_data_labels_2021-12-01_1005::x117,6,jilindeprospectiveco_data_labels_2021-12-01_1005,"Whenever you stopped taking PrEP, what were the reasons you stopped taking it (or never started taking PrEP at all)? (choice=Other)",Participant,http://purl.obolibrary.org/obo/EUPATH_0053594,Reason to stop taking PrEP,"8. Whenever you stopped taking PrEP, what were the reasons you stopped taking it (or never started taking PrEP at all)? (choice=Other)",,value,yes,,,Jilinde_prospective_cohort,,,,,,,,,
http://purl.obolibrary.org/obo/EUPATH_0054214,Other,jilindeprospectiveco_data_labels_2021-12-01_1005::x304,5,jilindeprospectiveco_data_labels_2021-12-01_1005,What services have you received from this/these organizations? (choice=Other),Participant,http://purl.obolibrary.org/obo/EUPATH_0054312,Type of received service (AGYW),111. What services have you received from this/these organizations? (choice=Other),,value,yes,,,Jilinde_prospective_cohort,,,,,,,,,
http://purl.obolibrary.org/obo/EUPATH_0054210,Other,jilindeprospectiveco_data_labels_2021-12-01_1005::x249,4,jilindeprospectiveco_data_labels_2021-12-01_1005,What services have you received from this/these organizations? (choice=Other),Participant,http://purl.obolibrary.org/obo/EUPATH_0054314,Type of received service (MSM),96. What services have you received from this/these organizations? (choice=Other),,value,yes,,,Jilinde_prospective_cohort,,,,,,,,,
http://purl.obolibrary.org/obo/EUPATH_0054211,Other,jilindeprospectiveco_data_labels_2021-12-01_1005::x262,4,jilindeprospectiveco_data_labels_2021-12-01_1005,What services have you received from this/these organizations? (choice=Other),Participant,http://purl.obolibrary.org/obo/EUPATH_0054317,Type of received service(Sex worker),100. What services have you received from this/these organizations? (choice=Other),,value,yes,,,Jilinde_prospective_cohort,,,,,,,,,
http://purl.obolibrary.org/obo/EUPATH_0054207,Other,jilindeprospectiveco_data_labels_2021-12-01_1005::x148,3,jilindeprospectiveco_data_labels_2021-12-01_1005,In what ways have your sexual behaviors changed since you started taking PrEP (choice=Other),Participant,http://purl.obolibrary.org/obo/EUPATH_0054328,Way to change sexual behavior,18. In what ways have your sexual behaviors changed since you started taking PrEP (choice=Other),,variable,yes,,,Jilinde_prospective_cohort,,,,,,,,,
http://purl.obolibrary.org/obo/EUPATH_0054216,Others,jilindeprospectiveco_data_labels_2021-12-01_1005::x137,8,jilindeprospectiveco_data_labels_2021-12-01_1005,What were the challenges you experienced to taking PrEP daily as recommended? (choice=Others),Participant,http://purl.obolibrary.org/obo/EUPATH_0054033,Challenge of taking PrEP,14. What were the challenges you experienced to taking PrEP daily as recommended? (choice=Others),,value,yes,,,Jilinde_prospective_cohort,,,,,,,,,
http://purl.obolibrary.org/obo/EUPATH_0000096,Participant,,,,,Participant,http://www.w3.org/2002/07/owl#Thing,,,,category,,,,Jilinde_prospective_cohort,,,,everywhere,,,,,
http://purl.obolibrary.org/obo/EUPATH_0054219,Peer support groups,jilindeprospectiveco_data_labels_2021-12-01_1005::x302,6,jilindeprospectiveco_data_labels_2021-12-01_1005,What services have you received from this/these organizations? (choice=Peer support groups),Participant,http://purl.obolibrary.org/obo/EUPATH_0054312,Type of received service (AGYW),111. What services have you received from this/these organizations? (choice=Peer support groups),,value,yes,,,Jilinde_prospective_cohort,,,,,,,,,
http://purl.obolibrary.org/obo/EUPATH_0054217,Peer support groups,jilindeprospectiveco_data_labels_2021-12-01_1005::x247,5,jilindeprospectiveco_data_labels_2021-12-01_1005,What services have you received from this/these organizations? (choice=Peer support groups),Participant,http://purl.obolibrary.org/obo/EUPATH_0054314,Type of received service (MSM),96. What services have you received from this/these organizations? (choice=Peer support groups),,value,yes,,,Jilinde_prospective_cohort,,,,,,,,,
http://purl.obolibrary.org/obo/EUPATH_0054218,Peer support groups,jilindeprospectiveco_data_labels_2021-12-01_1005::x260,5,jilindeprospectiveco_data_labels_2021-12-01_1005,What services have you received from this/these organizations? (choice=Peer support groups),Participant,http://purl.obolibrary.org/obo/EUPATH_0054317,Type of received service(Sex worker),100. What services have you received from this/these organizations? (choice=Peer support groups),,value,yes,,,Jilinde_prospective_cohort,,,,,,,,,
http://purl.obolibrary.org/obo/EUPATH_0054308,People with whom you have had sexual intercourse within last month count,jilindeprospectiveco_data_labels_2021-12-01_1005::x181,65,jilindeprospectiveco_data_labels_2021-12-01_1005,"In total, how many different people have you had sexual intercourse within the last 1 month? It is ok to estimate the number if you do not remember exactly",Participant,http://purl.obolibrary.org/obo/EUPATH_0053598,Sexual behavior,"43. In total, how many different people have you had sexual intercourse within the last 1 month?  It is ok to estimate the number if you do not remember exactly.",,variable,yes,,,Jilinde_prospective_cohort,,,,,,,,,
http://purl.obolibrary.org/obo/EUPATH_0054220,People you know who take PrEP are treated like outcasts,jilindeprospectiveco_data_labels_2021-12-01_1005::x342,3,jilindeprospectiveco_data_labels_2021-12-01_1005,People you know who take PrEP are treated like outcasts,Participant,http://purl.obolibrary.org/obo/EUPATH_0054278,Self-perception of PrEP,134. People you know who take PrEP are treated like outcasts,,value,yes,,,Jilinde_prospective_cohort,,,,,,,,,
