IRI,label,variable,displayOrder,dataFile,definition,category,parentIRI,parentLabel,codebookDescription,codebookValues,termType,repeated,is_temporal,mergeKey,dataSet,unitLabel,unitIRI,is_featured,hidden,scale,forceTostring,defaultDisplayRangeMin,defaultDisplayRangeMax,defaultBinWidthhttp://purl.obolibrary.org/obo/ENVO_01000577,Radio,radio,1,jilinde_peandchvcohort_data_labels_2021-11-29_1420,Do you have a radio in your house?,Household,http://purl.obolibrary.org/obo/EUPATH_0000144,Assets,Do you have a radio in your house?,"1, Yes | 0, No | 99, Refused to answer",value,yes,,,Jilinde_pe_chv_cohort,,,,,,,,,http://purl.obolibrary.org/obo/ENVO_01000579,Television,tv,2,jilinde_peandchvcohort_data_labels_2021-11-29_1420,Do you have a television in your house?,Household,http://purl.obolibrary.org/obo/EUPATH_0000144,Assets,Do you have a television in your house?,"1, Yes | 0, No | 99, Refused to answer",value,yes,,,Jilinde_pe_chv_cohort,,,,,,,,,http://purl.obolibrary.org/obo/ENVO_01000581,Mobile phone,mobile_phone,3,jilinde_peandchvcohort_data_labels_2021-11-29_1420,Do you own a cell phone?,Household,http://purl.obolibrary.org/obo/EUPATH_0000144,Assets,Do you own a cell phone?,"1, Yes | 0, No | 99, Refused to answer",value,yes,,,Jilinde_pe_chv_cohort,,,,,,,,,http://purl.obolibrary.org/obo/ENVO_01000583,Refrigerator,fridge,4,jilinde_peandchvcohort_data_labels_2021-11-29_1420,Do you have a refrigerator in your house?,Household,http://purl.obolibrary.org/obo/EUPATH_0000144,Assets,Do you have a refrigerator in your house?,"1, Yes | 0, No | 99, Refused to answer",value,yes,,,Jilinde_pe_chv_cohort,,,,,,,,,http://purl.obolibrary.org/obo/ENVO_01000614,Bicycle,bicycle,5,jilinde_peandchvcohort_data_labels_2021-11-29_1420,Do you have a bicycle?,Household,http://purl.obolibrary.org/obo/EUPATH_0000144,Assets,Do you have a bicycle?,"1, Yes | 0, No | 99, Refused to answer",value,yes,,,Jilinde_pe_chv_cohort,,,,,,,,,http://purl.obolibrary.org/obo/ENVO_01000615,Motorcycle or scooter,motorcycle,6,jilinde_peandchvcohort_data_labels_2021-11-29_1420,Do you have a motorcycle?,Household,http://purl.obolibrary.org/obo/EUPATH_0000144,Assets,Do you have a motorcycle?,"1, Yes | 0, No | 99, Refused to answer",value,yes,,,Jilinde_pe_chv_cohort,,,,,,,,,http://purl.obolibrary.org/obo/EUPATH_0000144,Assets,,1,jilinde_peandchvcohort_data_labels_2021-11-29_1420,,Household,http://purl.obolibrary.org/obo/EUPATH_0000304,Socioeconomic factors,,,multifilter,,,,Jilinde_pe_chv_cohort,,,,,,,,,http://purl.obolibrary.org/obo/EUPATH_0000171,Car or truck,car,7,jilinde_peandchvcohort_data_labels_2021-11-29_1420,Do you have a car?,Household,http://purl.obolibrary.org/obo/EUPATH_0000144,Assets,Do you have a car?,"1, Yes | 0, No | 99, Refused to answer",value,yes,,,Jilinde_pe_chv_cohort,,,,,,,,,http://purl.obolibrary.org/obo/EUPATH_0000342,Employment,employment,1,jilinde_peandchvcohort_data_labels_2021-11-29_1420,What is your type of employment?,Participant,http://purl.obolibrary.org/obo/EUPATH_0000096,Participant,What is your type of employment?,"1, Casual worker | 2, Permanent | 3, Self-employment | 4, Contract | 5, Unemployed | 6, Monthly stipend only",variable,yes,,,Jilinde_pe_chv_cohort,,,,,,,,,http://purl.obolibrary.org/obo/EUPATH_0000374,Marital status,,1,jilinde_peandchvcohort_data_labels_2021-11-29_1420,What is your current maRA003l status?,Participant,http://purl.obolibrary.org/obo/EUPATH_0010981,Demographics,What is your current maRA003l status?,,variable,yes,,,Jilinde_pe_chv_cohort,,,,,,,,,http://purl.obolibrary.org/obo/EUPATH_0021084,Electricity,electricity,8,jilinde_peandchvcohort_data_labels_2021-11-29_1420,"Do you have electricity in your house (from solar, power lines or any other source)?",Household,http://purl.obolibrary.org/obo/EUPATH_0000144,Assets,"Do you have electricity in your house (from solar, power lines or any other source)?","1, Yes | 0, No | 99, Refused to answer",value,yes,,,Jilinde_pe_chv_cohort,,,,,,,,,http://purl.obolibrary.org/obo/EUPATH_0031056,Cluster number,cluster,1,jilinde_peandchvcohort_data_labels_2021-11-29_1420,Cluster,Household,http://purl.obolibrary.org/obo/GAZ_00000448,Geographic location,Cluster,"1,  Cluster 001 | 2,  Cluster 003 | 3, Cluster 002",variable,yes,,,Jilinde_pe_chv_cohort,,,,,,,,,http://purl.obolibrary.org/obo/EUPATH_0048278,Religion,religion,2,jilinde_peandchvcohort_data_labels_2021-11-29_1420,What is your religion?,Participant,http://purl.obolibrary.org/obo/EUPATH_0010981,Demographics,What is your religion?,"1, Christian (protestant) | 2, Christian (catholic) | 3, Muslim | 77, Other",variable,yes,,,Jilinde_pe_chv_cohort,,,,,,,,,http://purl.obolibrary.org/obo/EUPATH_0048278,Religion,other_religion,3,jilinde_peandchvcohort_data_labels_2021-11-29_1420,Other specify,Participant,http://purl.obolibrary.org/obo/EUPATH_0010981,Demographics,Other specify,,variable,yes,,,Jilinde_pe_chv_cohort,,,,,,,,,http://purl.obolibrary.org/obo/EUPATH_0051287,County in Kenya,county,2,jilinde_peandchvcohort_data_labels_2021-11-29_1420,County,Household,http://purl.obolibrary.org/obo/GAZ_00000448,Geographic location,County,"1, County001 | 2, County003 | 3, County002 | 4, County008 | 5, County009 | 6, County010 | 7, County004 | 8, County006 | 9, County007 | 10, County005",variable,,,,Jilinde_pe_chv_cohort,,,,,,,,,http://purl.obolibrary.org/obo/EUPATH_0051850,Total children count,num_children,4,jilinde_peandchvcohort_data_labels_2021-11-29_1420,How many children do you have?,Participant,http://purl.obolibrary.org/obo/EUPATH_0010981,Demographics,How many children do you have?,,variable,yes,,,Jilinde_pe_chv_cohort,,,,,,,,,http://purl.obolibrary.org/obo/EUPATH_0053050,Facility name,fac_name,1,jilinde_peandchvcohort_data_labels_2021-11-29_1420,Facility Name,Participant,http://purl.obolibrary.org/obo/EUPATH_0010035,Administrative information,Facility Name,"101, <b style='color:blue'>********Cluster 1 Facilities*********</b> |1, Facility012 | 2, Facility026 | 3, Facility025 | 4, Facility071 | 5, Facility019 | 6, Facility062 | 7, Facility085 | 8, Facility070 | 9, Facility067 | 10, Facility054 | 11, Facility020 | 12, Facility066| 13, Facility060 | 14, Facility061 | 15, Facility065 | 16, Facility069 | 17, Facility053 | 72, Facility018 | 73, Facility009 | 102, <b style='color:blue'>********COUNTY 003 FACILITIES*********</b> | 18, Facility083 | 19, Facility082 | 20, Facility051 | 21, Facility086 | 22, Facility052 | 23, Facility089 | 24, Facility050 | 25, Facility087 | 69, Facility008 | 70, Facility006 | 71, Facility088 | 103, <b style='color:blue'>******** County002*********</b> | 26, Facility048 | 27, Facility047 | 28, Facility049 | 29, Facility001 | 30, Facility004 | 32, Facility002  | 35, Facility064 | 104, <b style='color:blue'>********County 008 Facilities*********</b> | 36, Facility003 | 37, Facility004 | 38, Facility042 | 39, Facility041 | 40, Facility078 | 74, Facility040 | 105, <b style='color:blue'>********COUNTY009 FACILITIES*********</b> | 41, Facility030 | 42, Facility034 | 43, Facility056 | 44, Facility014 | 45, Facility016 | 46, Facility033 | 47, Facility015 | 48, Facility036 | 49, Facility031| 75, Facility033| 76, Facility035 | 77, Facility029 | 78, Facility030 | 79, Facility031| 106, <b style='color:blue'>********COUNTY 010 FACILITIES*********</b> | 50, Facility059 | 51, Facility021 | 52, Facility058 | 53, Facility068 | 54, Facility032 | 107, <b style='color:blue'>********COUNTY004 FACILITIES*********</b> | 55, Facility080 | 56, Facility010 | 57, Facility011| 58, Facility022 | 59, Facility023 | 80, Facility045 | 81, Facility044 | 82, Facility057 | 83, Facility046 | 84, Facility043 | 108, <b style='color:blue'>********County006 FACILITIES*********</b> | 60, i | 61, Facility084 | 62, Facility013 | 63, Facility039 | 85, Facility072 | 86, Facility076 | 87, Facility075 | 88, Facility073 | 89, Facility074 | 109, <b style='color:blue'>********COUNTY007 FACILITIES*********</b> | 64, Facility024 | 65, Facility006 | 90, Facility063 | 91, Facility077 | 110, <b style='color:blue'>********County 005 FACILITIES*********</b> | 66, Facility028 | 67, Facility027 | 68, Facility081 | 92, Other facility not listed",variable,,,,Jilinde_pe_chv_cohort,,,,,,,,,http://purl.obolibrary.org/obo/EUPATH_0053050,Facility name,other_fac,2,jilinde_peandchvcohort_data_labels_2021-11-29_1420,Other facility,Participant,http://purl.obolibrary.org/obo/EUPATH_0010035,Administrative information,Other facility,,variable,,,,Jilinde_pe_chv_cohort,,,,,,,,,http://purl.obolibrary.org/obo/EUPATH_0053517,Taking PrEP,kpp_q20,1,jilinde_peandchvcohort_data_labels_2021-11-29_1420, Are you currently using PrEP?,Participant,http://purl.obolibrary.org/obo/EUPATH_0053597,PrEP,20. Are you currently using PrEP?,"1, Yes | 0, No | 99, Refused",variable,yes,,,Jilinde_pe_chv_cohort,,,,,,,,,http://purl.obolibrary.org/obo/EUPATH_0054057,Data access group,,3,jilinde_peandchvcohort_data_labels_2021-11-29_1420,Data Access Group,Participant,http://purl.obolibrary.org/obo/EUPATH_0010035,Administrative information,Data Access Group,,variable,,,,Jilinde_pe_chv_cohort,,,,,,,,,http://purl.obolibrary.org/obo/EUPATH_0054276,Self-defined gender,gender,5,jilinde_peandchvcohort_data_labels_2021-11-29_1420,How do you currently define your gender?,Participant,http://purl.obolibrary.org/obo/EUPATH_0010981,Demographics,How do you currently define your gender?,"1, Male | 2, Female | 3, Transgender male | 4, Transgender female | 77, Other | 99, Refused to answer",variable,yes,,,Jilinde_pe_chv_cohort,,,,,,,,,http://purl.obolibrary.org/obo/EUPATH_0054276,Self-defined gender,other_gender,6,jilinde_peandchvcohort_data_labels_2021-11-29_1420,Other specify,Participant,http://purl.obolibrary.org/obo/EUPATH_0010981,Demographics,Other specify,,variable,yes,,,Jilinde_pe_chv_cohort,,,,,,,,,http://purl.obolibrary.org/obo/OBI_0001508,Study timepoint,,1,jilinde_peandchvcohort_data_labels_2021-11-29_1420,Event Name,Participant,http://purl.obolibrary.org/obo/EUPATH_0000310,Observation details,Event Name,,variable,yes,yes,,Jilinde_pe_chv_cohort,,,yes,,,,,,http://purl.obolibrary.org/obo/OMRSE_00002045,Education level,education,7,jilinde_peandchvcohort_data_labels_2021-11-29_1420,What is the highest level of education you have attained?,Participant,http://purl.obolibrary.org/obo/EUPATH_0010981,Demographics,What is the highest level of education you have attained?,,variable,yes,,,Jilinde_pe_chv_cohort,,,,,,,,,http://purl.obolibrary.org/obo/OMRSE_00002045,Education level,other_education,8,jilinde_peandchvcohort_data_labels_2021-11-29_1420,Other specify,Participant,http://purl.obolibrary.org/obo/EUPATH_0010981,Demographics,Other specify,,variable,yes,,,Jilinde_pe_chv_cohort,,,,,,,,,http://purl.obolibrary.org/obo/PATO_0000047,Sex,sex,9,jilinde_peandchvcohort_data_labels_2021-11-29_1420,What is your biological sex (sex at birth)?,Participant,http://purl.obolibrary.org/obo/EUPATH_0010981,Demographics,What is your biological sex (sex at birth)?,"1, Male | 2, Female | 77, Other",variable,,,,Jilinde_pe_chv_cohort,,,,,,,,,http://purl.obolibrary.org/obo/PATO_0000047,Sex,other_sex,10,jilinde_peandchvcohort_data_labels_2021-11-29_1420,Other specify,Participant,http://purl.obolibrary.org/obo/EUPATH_0010981,Demographics,Other specify,,variable,,,,Jilinde_pe_chv_cohort,,,,,,,,,http://purl.obolibrary.org/obo/EUPATH_0056523,Date of completion,completion_date,4,jilinde_peandchvcohort_data_labels_2021-11-29_1420,Date of completion,Participant,http://purl.obolibrary.org/obo/EUPATH_0010035,Administrative information,Date of completion,,variable,,,,Jilinde_pe_chv_cohort,,,,,,,,,http://purl.obolibrary.org/obo/EUPATH_0056602,Age at last birthday,age,11,jilinde_peandchvcohort_data_labels_2021-11-29_1420,What is your age (in years) since your most recent birthday?,Participant,http://purl.obolibrary.org/obo/EUPATH_0010981,Demographics,What is your age (in years) since your most recent birthday?,,variable,yes,yes,,Jilinde_pe_chv_cohort,years,http://purl.obolibrary.org/obo/UO_0000036,,,,,,,http://purl.obolibrary.org/obo/EUPATH_0057001,Length to be peer educator/community health volunteer (CHV),years_of_service,12,jilinde_peandchvcohort_data_labels_2021-11-29_1420,How many years have you served as a Peer educator/Community health volunteer (CHV)?,Participant,http://purl.obolibrary.org/obo/EUPATH_0010981,Demographics,How many years have you served as a Peer educator/Community health volunteer (CHV)?,,variable,yes,,,Jilinde_pe_chv_cohort,years,http://purl.obolibrary.org/obo/UO_0000036,,,,,,,http://purl.obolibrary.org/obo/EUPATH_0057002,Complete form of socio demographics,,5,jilinde_peandchvcohort_data_labels_2021-11-29_1420,Complete?,Participant,http://purl.obolibrary.org/obo/EUPATH_0010035,Administrative information,Complete?,,variable,yes,,,Jilinde_pe_chv_cohort,,,,,,,,,http://purl.obolibrary.org/obo/EUPATH_0056541,Attitude towards high risk population,,1,jilinde_peandchvcohort_data_labels_2021-11-29_1420,,Participant,http://purl.obolibrary.org/obo/EUPATH_0054343,HIV/AIDS and STIs,,,multifilter,,,,Jilinde_pe_chv_cohort,,,,,,,,,http://purl.obolibrary.org/obo/EUPATH_0056526,FSW and MSM/MSW are mainly responsible for the spread of HIV/AIDS across the globe,kpp_q1,1,jilinde_peandchvcohort_data_labels_2021-11-29_1420, FSW and MSM/MSW are mainly responsible for the spread of HIV/AIDS across the globe,Participant,http://purl.obolibrary.org/obo/EUPATH_0056541,Attitude towards high risk population,1. FSW and MSM/MSW are mainly responsible for the spread of HIV/AIDS across the globe,"1, Strongly agree | 2, Agree | 3, Neither agree nor disagree | 4, Disagree | 5, Strongly disagree",value,yes,,,Jilinde_pe_chv_cohort,,,,,,,,,http://purl.obolibrary.org/obo/EUPATH_0056530,I would be willing to work with FSW and MSM/MSW.,kpp_q2,2,jilinde_peandchvcohort_data_labels_2021-11-29_1420,,Participant,http://purl.obolibrary.org/obo/EUPATH_0056541,Attitude towards high risk population,2. I would be willing to work with a FSW and MSM/MSW.,"1, Strongly agree | 2, Agree | 3, Neither agree nor disagree | 4, Disagree | 5, Strongly disagree",value,yes,,,Jilinde_pe_chv_cohort,,,,,,,,,http://purl.obolibrary.org/obo/EUPATH_0056536,"If I worked with FSW and MSM/MSW, I would provide the same quality of care to them that I provide to other patients.",kpp_q3,3,jilinde_peandchvcohort_data_labels_2021-11-29_1420,,Participant,http://purl.obolibrary.org/obo/EUPATH_0056541,Attitude towards high risk population,"3. If I worked with FSW and MSM/MSW, I would provide the same attention and information that I provide to other clients.","1, Strongly agree | 2, Agree | 3, Neither agree nor disagree | 4, Disagree | 5, Strongly disagree",value,yes,,,Jilinde_pe_chv_cohort,,,,,,,,,http://purl.obolibrary.org/obo/EUPATH_0056537,"If the superior in my hospital asked me to do a physical examination of a known FSW and MSM/MSW, I would be willing to do so.",kpp_q4,4,jilinde_peandchvcohort_data_labels_2021-11-29_1420,,Participant,http://purl.obolibrary.org/obo/EUPATH_0056541,Attitude towards high risk population,"4. If the superior in my DICE/Clinic asked me to deal with a known FSW and MSM/MSW, I would be willing to do so.","1, Strongly agree | 2, Agree | 3, Neither agree nor disagree | 4, Disagree | 5, Strongly disagree",value,yes,,,Jilinde_pe_chv_cohort,,,,,,,,,http://purl.obolibrary.org/obo/EUPATH_0056535,"If I worked with FSW and MSM/MSW, I would interact with them just like other clients.",kpp_q5,5,jilinde_peandchvcohort_data_labels_2021-11-29_1420,,Participant,http://purl.obolibrary.org/obo/EUPATH_0056541,Attitude towards high risk population,"5. If I worked with FSW and MSM/MSW, I would interact with them just like other clients.","1, Strongly agree | 2, Agree | 3, Neither agree nor disagree | 4, Disagree | 5, Strongly disagree",value,yes,,,Jilinde_pe_chv_cohort,,,,,,,,,http://purl.obolibrary.org/obo/EUPATH_0056538,People who are FSW and MSM/MSW deserve to get HIV/AIDS.,kpp_q6,6,jilinde_peandchvcohort_data_labels_2021-11-29_1420,,Participant,http://purl.obolibrary.org/obo/EUPATH_0056541,Attitude towards high risk population,6. People who are FSW and MSM/MSW deserve to get HIV/AIDS.,"1, Strongly agree | 2, Agree | 3, Neither agree nor disagree | 4, Disagree | 5, Strongly disagree",value,yes,,,Jilinde_pe_chv_cohort,,,,,,,,,http://purl.obolibrary.org/obo/EUPATH_0056525,AIDS is a punishment for FSW and MSM/MSW for their bad behavior,kpp_q7,7,jilinde_peandchvcohort_data_labels_2021-11-29_1420, AIDS is a punishment for FSW and MSM/MSW for their bad behavior,Participant,http://purl.obolibrary.org/obo/EUPATH_0056541,Attitude towards high risk population,7. AIDS is a punishment for FSW and MSM/MSW for their bad behavior,"1, Strongly agree | 2, Agree | 3, Neither agree nor disagree | 4, Disagree | 5, Strongly disagree",value,yes,,,Jilinde_pe_chv_cohort,,,,,,,,,http://purl.obolibrary.org/obo/EUPATH_0056527,FSW and MSM/MSW behave promiscuously and should be blamed for HIV/AIDS.,kpp_q8,8,jilinde_peandchvcohort_data_labels_2021-11-29_1420,,Participant,http://purl.obolibrary.org/obo/EUPATH_0056541,Attitude towards high risk population,8. FSWs and MSM/MSW behave promiscuously and should be blamed for HIV/AIDS.,"1, Strongly agree | 2, Agree | 3, Neither agree nor disagree | 4, Disagree | 5, Strongly disagree",value,yes,,,Jilinde_pe_chv_cohort,,,,,,,,,http://purl.obolibrary.org/obo/EUPATH_0056528,FSW and MSM/MSW have no rights,kpp_q9,9,jilinde_peandchvcohort_data_labels_2021-11-29_1420, FSW and MSM/MSW have no rights,Participant,http://purl.obolibrary.org/obo/EUPATH_0056541,Attitude towards high risk population,9. FSW and MSM/MSW have no rights,"1, Strongly agree | 2, Agree | 3, Neither agree nor disagree | 4, Disagree | 5, Strongly disagree",value,yes,,,Jilinde_pe_chv_cohort,,,,,,,,,http://purl.obolibrary.org/obo/EUPATH_0056529,I am afraid of FSW and MSM/MSW.,kpp_q10,10,jilinde_peandchvcohort_data_labels_2021-11-29_1420,,Participant,http://purl.obolibrary.org/obo/EUPATH_0056541,Attitude towards high risk population,10. I am afraid of FSW and MSM/MSW.,"1, Strongly agree | 2, Agree | 3, Neither agree nor disagree | 4, Disagree | 5, Strongly disagree",value,yes,,,Jilinde_pe_chv_cohort,,,,,,,,,http://purl.obolibrary.org/obo/EUPATH_0056532,I would feel ashamed if someone knew that I treat FSW and MSM/MSW.,kpp_q11,11,jilinde_peandchvcohort_data_labels_2021-11-29_1420,,Participant,http://purl.obolibrary.org/obo/EUPATH_0056541,Attitude towards high risk population,11. I would feel ashamed if someone knew that I mobilise FSW and MSM/MSW.,"1, Strongly agree | 2, Agree | 3, Neither agree nor disagree | 4, Disagree | 5, Strongly disagree",value,yes,,,Jilinde_pe_chv_cohort,,,,,,,,,http://purl.obolibrary.org/obo/EUPATH_0056531,I would feel ashamed if someone in my family became a FSW or MSM/MSW.,kpp_q12,12,jilinde_peandchvcohort_data_labels_2021-11-29_1420,,Participant,http://purl.obolibrary.org/obo/EUPATH_0056541,Attitude towards high risk population,12. I would feel ashamed if someone in my family became a FSW or MSM/MSW.,"1, Strongly agree | 2, Agree | 3, Neither agree nor disagree | 4, Disagree | 5, Strongly disagree",value,yes,,,Jilinde_pe_chv_cohort,,,,,,,,,http://purl.obolibrary.org/obo/EUPATH_0056533,I would not buy food from a vendor who is a FSW or MSM/MSW.,kpp_q13,13,jilinde_peandchvcohort_data_labels_2021-11-29_1420,,Participant,http://purl.obolibrary.org/obo/EUPATH_0056541,Attitude towards high risk population,13. I would not buy food from a vendor who is a FSW or MSM/MSW.,"1, Strongly agree | 2, Agree | 3, Neither agree nor disagree | 4, Disagree | 5, Strongly disagree",value,yes,,,Jilinde_pe_chv_cohort,,,,,,,,,http://purl.obolibrary.org/obo/EUPATH_0056534,I would not share eating utensils with a FSW and MSM/MSW because I am afraid of HIV infection.,kpp_q14,14,jilinde_peandchvcohort_data_labels_2021-11-29_1420,,Participant,http://purl.obolibrary.org/obo/EUPATH_0056541,Attitude towards high risk population,14. I would not share eating utensils with a FSW and MSM/MSW because I am afraid of HIV infection.,"1, Strongly agree | 2, Agree | 3, Neither agree nor disagree | 4, Disagree | 5, Strongly disagree",value,yes,,,Jilinde_pe_chv_cohort,,,,,,,,,http://purl.obolibrary.org/obo/EUPATH_0057003,Have heard PrEP,kpp_q15,2,jilinde_peandchvcohort_data_labels_2021-11-29_1420, Have you ever heard about PrEP?,Participant,http://purl.obolibrary.org/obo/EUPATH_0053597,PrEP,15. Have you ever heard about PrEP?,"1, Yes | 0, No",variable,yes,,,Jilinde_pe_chv_cohort,,,,,,,,,http://purl.obolibrary.org/obo/EUPATH_0057004,Time of hearing PrEP,kpp_q16,3,jilinde_peandchvcohort_data_labels_2021-11-29_1420, How long ago did you hear about PrEP?,Participant,http://purl.obolibrary.org/obo/EUPATH_0053597,PrEP,16. How long ago did you hear about PrEP?,,variable,yes,,,Jilinde_pe_chv_cohort,,,,,,,,,http://purl.obolibrary.org/obo/EUPATH_0056548,Resource of learning about PrEP,,4,jilinde_peandchvcohort_data_labels_2021-11-29_1420,,Participant,http://purl.obolibrary.org/obo/EUPATH_0053597,PrEP,,,multifilter,,,,Jilinde_pe_chv_cohort,,,,,,,,,http://purl.obolibrary.org/obo/EUPATH_0057005,Whole site orientation,,1,jilinde_peandchvcohort_data_labels_2021-11-29_1420, Through which chRA002els did you hear about PrEP? (choice=Whole site orientation),Participant,http://purl.obolibrary.org/obo/EUPATH_0056548,Resource of learning about PrEP,17. Through which chRA002els did you hear about PrEP? (choice=Whole site orientation),,value,yes,,,Jilinde_pe_chv_cohort,,,,,,,,,http://purl.obolibrary.org/obo/EUPATH_0057006,Reading newspapers/books,,2,jilinde_peandchvcohort_data_labels_2021-11-29_1420, Through which chRA002els did you hear about PrEP? (choice=Reading newspapers/books),Participant,http://purl.obolibrary.org/obo/EUPATH_0056548,Resource of learning about PrEP,17. Through which chRA002els did you hear about PrEP? (choice=Reading newspapers/books),,value,yes,,,Jilinde_pe_chv_cohort,,,,,,,,,http://purl.obolibrary.org/obo/EUPATH_0057007,Through the TV/radio,,3,jilinde_peandchvcohort_data_labels_2021-11-29_1420, Through which chRA002els did you hear about PrEP? (choice=Through the TV/radio),Participant,http://purl.obolibrary.org/obo/EUPATH_0056548,Resource of learning about PrEP,17. Through which chRA002els did you hear about PrEP? (choice=Through the TV/radio),,value,yes,,,Jilinde_pe_chv_cohort,,,,,,,,,http://purl.obolibrary.org/obo/EUPATH_0057008,National guidelines,,4,jilinde_peandchvcohort_data_labels_2021-11-29_1420, Through which chRA002els did you hear about PrEP? (choice=National guidelines),Participant,http://purl.obolibrary.org/obo/EUPATH_0056548,Resource of learning about PrEP,17. Through which chRA002els did you hear about PrEP? (choice=National guidelines),,value,yes,,,Jilinde_pe_chv_cohort,,,,,,,,,http://purl.obolibrary.org/obo/EUPATH_0057009,Social media/Internet,,5,jilinde_peandchvcohort_data_labels_2021-11-29_1420, Through which chRA002els did you hear about PrEP? (choice=Social media/Internet),Participant,http://purl.obolibrary.org/obo/EUPATH_0056548,Resource of learning about PrEP,17. Through which chRA002els did you hear about PrEP? (choice=Social media/Internet),,value,yes,,,Jilinde_pe_chv_cohort,,,,,,,,,http://purl.obolibrary.org/obo/EUPATH_0057010,Bronchures/pamplets,,6,jilinde_peandchvcohort_data_labels_2021-11-29_1420, Through which chRA002els did you hear about PrEP? (choice=Bronchures/pamplets),Participant,http://purl.obolibrary.org/obo/EUPATH_0056548,Resource of learning about PrEP,17. Through which chRA002els did you hear about PrEP? (choice=Bronchures/pamplets),,value,yes,,,Jilinde_pe_chv_cohort,,,,,,,,,http://purl.obolibrary.org/obo/EUPATH_0056579,PrEP training,,7,jilinde_peandchvcohort_data_labels_2021-11-29_1420, Through which chRA002els did you hear about PrEP? (choice=PrEP training),Participant,http://purl.obolibrary.org/obo/EUPATH_0056548,Resource of learning about PrEP,17. Through which chRA002els did you hear about PrEP? (choice=PrEP training),,value,yes,,,Jilinde_pe_chv_cohort,,,,,,,,,http://purl.obolibrary.org/obo/EUPATH_0057011,Through my colleagues,,8,jilinde_peandchvcohort_data_labels_2021-11-29_1420, Through which chRA002els did you hear about PrEP? (choice=Through my colleagues),Participant,http://purl.obolibrary.org/obo/EUPATH_0056548,Resource of learning about PrEP,17. Through which chRA002els did you hear about PrEP? (choice=Through my colleagues),,value,yes,,,Jilinde_pe_chv_cohort,,,,,,,,,http://purl.obolibrary.org/obo/EUPATH_0057012,Other,,9,jilinde_peandchvcohort_data_labels_2021-11-29_1420, Through which chRA002els did you hear about PrEP? (choice=Others),Participant,http://purl.obolibrary.org/obo/EUPATH_0056548,Resource of learning about PrEP,17. Through which chRA002els did you hear about PrEP? (choice=Others),,value,yes,,,Jilinde_pe_chv_cohort,,,,,,,,,http://purl.obolibrary.org/obo/EUPATH_0056549,Resource of learning about PrEP specified,q17_other,5,jilinde_peandchvcohort_data_labels_2021-11-29_1420,Other specify,Participant,http://purl.obolibrary.org/obo/EUPATH_0053597,PrEP,Other specify,,variable,yes,,,Jilinde_pe_chv_cohort,,,,,,,,,http://purl.obolibrary.org/obo/EUPATH_0056546,PrEP training,,6,jilinde_peandchvcohort_data_labels_2021-11-29_1420,,Participant,http://purl.obolibrary.org/obo/EUPATH_0053597,PrEP,,,multifilter,,,,Jilinde_pe_chv_cohort,,,,,,,,,http://purl.obolibrary.org/obo/EUPATH_0056570,On-Job Training,,1,jilinde_peandchvcohort_data_labels_2021-11-29_1420," If you selected PrEP training on Question 17 above, what type of PrEP training did you receive?  (choice=On Job Training)",Participant,http://purl.obolibrary.org/obo/EUPATH_0056546,PrEP training,"18. If you selected PrEP training on Question 17 above, what type of PrEP training did you receive?  (choice=On Job Training)",,value,yes,,,Jilinde_pe_chv_cohort,,,,,,,,,