IRI,label,displayOrder,variable,dataFile,definition,category,parentLabel,parentIRI,codebookDescription,codebookValues,termType
http://purl.obolibrary.org/obo/EUPATH_0035042,Maternal education level,1,enrol_dh::momedu,enrol_dh,Categorization of the amount of education completed by the target child participant's mother. Assessed for the household at enrollment (when target children were in utero).,Household,Schooling,http://purl.obolibrary.org/obo/EUPATH_0011708,Mother's education (category),0 to 2,variabe
http://purl.obolibrary.org/obo/EUPATH_0035043,Paternal education (years),3,enrol_dh::dadeduy,enrol_dh,Number of years of education completed by the target child participant's father. Assessed for the household at enrollment (when target children were in utero).,Household,Schooling,http://purl.obolibrary.org/obo/EUPATH_0011708,"Father, years of education (q010)",0 to 17,variabe
http://purl.obolibrary.org/obo/EUPATH_0000026,Acres,4,enrol_dh::landacre,enrol_dh,Acres of land owned by the target child participant's household. Assessed for the household at enrollment (when target children were in utero).,Household,Socioeconomic factors,http://purl.obolibrary.org/obo/EUPATH_0000304,Acres of land owned (q4110: How much homestead land (decimal) does your household own?),0 to 8.88,variabe
http://purl.obolibrary.org/obo/EUPATH_0000144,Assets,5,enrol_dh::assets,enrol_dh,Whether the target child participant's household owns any of the following items. Assessed for the household at enrollment (when target children were in utero).,Household,Socioeconomic factors,http://purl.obolibrary.org/obo/EUPATH_0000304,,,"multifilter, derived"
http://purl.obolibrary.org/obo/EUPATH_0035046,Chair count,,enrol_dh::n_asset_chair,enrol_dh,Number of chairs owned by the target child participant's household. Assessed for the household at enrollment (when target children were in utero).,Household,Socioeconomic factors,http://purl.obolibrary.org/obo/EUPATH_0000304,Number of Chair,0 to 25,variabe
http://purl.obolibrary.org/obo/EUPATH_0035047,Chouki (traditional wooden bed) count,,enrol_dh::n_asset_chouki,enrol_dh,Number of chouki (a traditional wooden bed that is an indicator of wealth in the study population) owned by the target child participant's household. Assessed for the household at enrollment (when target children were in utero).,Household,Socioeconomic factors,http://purl.obolibrary.org/obo/EUPATH_0000304,Number of chouki (bed),0 to 6,variabe
http://purl.obolibrary.org/obo/EUPATH_0035048,Clock count,,enrol_dh::n_asset_clock,enrol_dh,Number of clocks owned by the target child participant's household. Assessed for the household at enrollment (when target children were in utero).,Household,Socioeconomic factors,http://purl.obolibrary.org/obo/EUPATH_0000304,Number of clock,0 to 10,variabe
http://purl.obolibrary.org/obo/EUPATH_0035049,Cupboard count,,enrol_dh::n_asset_wardrobe,enrol_dh,Number of wardrobes owned by the target child participant's household. Assessed for the household at enrollment (when target children were in utero).,Household,Socioeconomic factors,http://purl.obolibrary.org/obo/EUPATH_0000304,Number of wardrobes,0 to 8,variabe
http://purl.obolibrary.org/obo/EUPATH_0035050,Khat (traditional wooden table) count,,enrol_dh::n_asset_khat,enrol_dh,Number of khat (a traditional wooden table that is an indicator of wealth in the study population) owned by the target child participant's household. Assessed for the household at enrollment (when target children were in utero).,Household,Socioeconomic factors,http://purl.obolibrary.org/obo/EUPATH_0000304,Number of Khat,0 to 10,variabe
http://purl.obolibrary.org/obo/EUPATH_0035051,Mobile phone count,,enrol_dh::n_asset_mobile,enrol_dh,Number of mobile phones owned by the target child participant's household. Assessed for the household at enrollment (when target children were in utero).,Household,Socioeconomic factors,http://purl.obolibrary.org/obo/EUPATH_0000304,Number of mobile phone,0 to 13,variabe
http://purl.obolibrary.org/obo/EUPATH_0035045,Persons 18yrs and younger living in house,3,enrol_dh::nlt18,enrol_dh,Total number of children 18 years of age and younger that lived in the target child participant's household. Assessed for the household at enrollment (when target children were in utero).,Household,Socioeconomic factors,http://purl.obolibrary.org/obo/EUPATH_0000304,N indivs in HH <=18y,0 to 10,variabe
http://purl.obolibrary.org/obo/EUPATH_0035044,Persons living in compound,1,enrol_dh::ncomp,enrol_dh,Total number of people that lived in the target child participant's compound. Assessed for the compound (multiple households sharing a common courtyard) at enrollment (when target children were in utero).,Household,Socioeconomic factors,http://purl.obolibrary.org/obo/EUPATH_0000304,Total indivs in compound,2 to 52,variabe
http://purl.obolibrary.org/obo/EUPATH_0000019,Persons living in house,2,enrol_dh::nhh,enrol_dh,Total number of people that lived in the target child participant's household. Assessed for the household at enrollment (when target children were in utero).,Household,Socioeconomic factors,http://purl.obolibrary.org/obo/EUPATH_0000304,Number of persons in household (q012),1 to 23,variabe
http://purl.obolibrary.org/obo/EUPATH_0011708,Schooling,,,,,Household,Socioeconomic factors,http://purl.obolibrary.org/obo/EUPATH_0000304,,,category
http://purl.obolibrary.org/obo/EUPATH_0035052,Table count,,enrol_dh::n_asset_table,enrol_dh,Number of tables owned by the target child participant's household. Assessed for the household at enrollment (when target children were in utero).,Household,Socioeconomic factors,http://purl.obolibrary.org/obo/EUPATH_0000304,Number of Tables,0 to 10,variabe
http://purl.obolibrary.org/obo/EUPATH_0035056,"Daily open defecation, adult men",4,enrol_dh::odmen,enrol_dh,Whether adult men in the target child participant's compound practice open defecation daily. Assessed for the compound (multiple households sharing a common courtyard) at enrollment (when target children were in utero).,Household,Waste disposal,http://purl.obolibrary.org/obo/EUPATH_0000596,"Daily OD, adult men (q801a)",0 to 1,variabe
http://purl.obolibrary.org/obo/EUPATH_0035057,"Daily open defecation, adult women",5,enrol_dh::odwom,enrol_dh,Whether adult women in the target child participant's compound practice open defecation daily. Assessed for the compound (multiple households sharing a common courtyard) at enrollment (when target children were in utero).,Household,Waste disposal,http://purl.obolibrary.org/obo/EUPATH_0000596,"Daily OD, adult women (q801b)",0 to 1,variabe
http://purl.obolibrary.org/obo/EUPATH_0035054,"Daily open defecation, children 3-8yrs",2,enrol_dh::odch38,enrol_dh,Whether children in the target child participant's compound  3-8 years of age  practice open defecation daily. Assessed for the compound (multiple households sharing a common courtyard) at enrollment (when target children were in utero).,Household,Waste disposal,http://purl.obolibrary.org/obo/EUPATH_0000596,"Daily OD, children 3-8 (q801d)",0 to 1,variabe
http://purl.obolibrary.org/obo/EUPATH_0035055,"Daily open defecation, children 8-15yrs",3,enrol_dh::odch815,enrol_dh,Whether children in the target child participant's compound  8-15 years of age  practice open defecation daily. Assessed for the compound (multiple households sharing a common courtyard) at enrollment (when target children were in utero).,Household,Waste disposal,http://purl.obolibrary.org/obo/EUPATH_0000596,"Daily OD, children 8-15 (q801e)",0 to 1,variabe
http://purl.obolibrary.org/obo/EUPATH_0035053,"Daily open defecation, children under 3yrs",1,enrol_dh::odchu3,enrol_dh,Whether children in the target child participant's compound  under 3 years of age  practice open defecation daily. Assessed for the compound (multiple households sharing a common courtyard) at enrollment (when target children were in utero).,Household,Waste disposal,http://purl.obolibrary.org/obo/EUPATH_0000596,"Daily OD, children <3 (q801c)",0 to 1,variabe
http://purl.obolibrary.org/obo/EUPATH_0011612,Household toilet or latrine has concrete floor,7,enrol_dh::latslab,enrol_dh,Whether the target child participant's toilet or latrine had a concrete floor or slab. Assessed for the compound (multiple households sharing a common courtyard) at enrollment (when target children were in utero).,Household,Waste disposal,http://purl.obolibrary.org/obo/EUPATH_0000596,Latrine has concrete slab (q809_7),0 to 1,variabe
http://purl.obolibrary.org/obo/EUPATH_0035060,Potty,9,enrol_dh::potty,enrol_dh,Whether the target child participant's compound had a potty for child defecation. Assessed for the compound (multiple households sharing a common courtyard) at enrollment (when target children were in utero).,Household,Waste disposal,http://purl.obolibrary.org/obo/EUPATH_0000596,Has a potty for child defecation,0 to 1,variabe
http://purl.obolibrary.org/obo/EUPATH_0035059,Toilet has functional water seal,8,uptake_dh::latseal,uptake_dh,"Whether the flush or pour flush toilet has a functional water seal. Assessed for the compound (multiple households sharing a common courtyard) at enrollment (when target children were in utero), 1 year after intervention initiation (midline, when target children were 8-15m of age) and 2 years after intervention initiation (endline, when target children were 21-27m of age).",Household,Waste disposal,http://purl.obolibrary.org/obo/EUPATH_0000596,Latrine has functional water seal (q809_9a),0 to 1,variabe
http://purl.obolibrary.org/obo/EUPATH_0035058,Unshared toilet or latrine,6,enrol_dh::latown,enrol_dh,Whether the target child participant's household had its own latrine (did not share with other households in the compound). Assessed for the compound (multiple households sharing a common courtyard) at enrollment (when target children were in utero).,Household,Waste disposal,http://purl.obolibrary.org/obo/EUPATH_0000596,Own their latrine (not shared) (q816),0 to 1,variabe
http://purl.obolibrary.org/obo/EUPATH_0000738,Observation,,,,,Observation,,http://www.w3.org/2002/07/owl#Thing,,,category
http://purl.obolibrary.org/obo/EUPATH_0035072,BMI-for-age z-score flag,12,anthro_dh::bmiz_x,anthro_dh,"Whether the BMI-for-age z-score for the target child participant was flagged for being greater than 5 or less than -5. Anthropometry of target children was assessed 1 year after intervention initiation (midline, when target children were 8-15m of age) and 2 years after intervention initiation (endline, when target children were 21-27m of age).",Observation,Anthropometry,http://purl.obolibrary.org/obo/EUPATH_0000649,"Abs(BMIZ)>5, set to missing",0 to 1,variabe
http://purl.obolibrary.org/obo/EUPATH_0035071,"BMI-for-age z-score, using median weight and median length or height",11,anthro_dh::bmiz,anthro_dh,"BMI-for-age z-score for the target child participant, using median weight and median length or height. Values greater than 5 or less than -5 were flagged and set to missing.  Anthropometry of target children was assessed 1 year after intervention initiation (midline, when target children were 8-15m of age) and 2 years after intervention initiation (endline, when target children were 21-27m of age).",Observation,Anthropometry,http://purl.obolibrary.org/obo/EUPATH_0000649,BMI-for-age Z-score,-4.57 to 4.67,variabe
http://purl.obolibrary.org/obo/EUPATH_0010070,Caretaker plus participant weight (kg),29,anthro_dh::c408,anthro_dh,"Measurement #1 of the weight of the target child participant plus the mother, in kg. Anthropometry of target children was assessed 1 year after intervention initiation (midline, when target children were 8-15m of age) and 2 years after intervention initiation (endline, when target children were 21-27m of age). Mother plus target child participant weights may not have been recorded at the endline anthropometry assessment if the target child was weighed directly.",Observation,Anthropometry,http://purl.obolibrary.org/obo/EUPATH_0000649,Child weight w/ mother meas 1,33.25 to 92.95,variabe
http://purl.obolibrary.org/obo/EUPATH_0035086,"Caretaker plus participant weight (kg), 2nd",30,anthro_dh::c409,anthro_dh,"Measurement #2 of the weight of the target child participant plus the mother, in kg. Anthropometry of target children was assessed 1 year after intervention initiation (midline, when target children were 8-15m of age) and 2 years after intervention initiation (endline, when target children were 21-27m of age). Mother plus target child participant weights may not have been recorded at the endline anthropometry assessment if the target child was weighed directly.",Observation,Anthropometry,http://purl.obolibrary.org/obo/EUPATH_0000649,Child weight w/ mother meas 2,33.05 to 92.75,variabe
http://purl.obolibrary.org/obo/EUPATH_0035087,"Caretaker plus participant weight (kg), 3rd",31,anthro_dh::c410,anthro_dh,"Measurement #3 of the weight of the target child participant plus the mother, in kg. A 3rd measurement was only taken if the difference between measures 1 & 2 is greater than or equal to 0.1 kg. Anthropometry of target children was assessed 1 year after intervention initiation (midline, when target children were 8-15m of age) and 2 years after intervention initiation (endline, when target children were 21-27m of age). Mother plus target child participant weights may not have been recorded at the endline anthropometry assessment if the target child was weighed directly.",Observation,Anthropometry,http://purl.obolibrary.org/obo/EUPATH_0000649,Child weight w/ mother meas 3,33.15 to 92.95,variabe
http://purl.obolibrary.org/obo/EUPATH_0010071,Caretaker weight (kg),32,anthro_dh::c404,anthro_dh,"Measurement #1 of the weight of the target child participant's mother, in kg. Anthropometry of target children was assessed 1 year after intervention initiation (midline, when target children were 8-15m of age) and 2 years after intervention initiation (endline, when target children were 21-27m of age). Mother's weights may not have been recorded at the endline anthropometry assessment if the target child was weighed directly.",Observation,Anthropometry,http://purl.obolibrary.org/obo/EUPATH_0000649,Maternal weight meas 1,26.15 to 90,variabe
http://purl.obolibrary.org/obo/EUPATH_0035088,"Caretaker weight (kg), 2nd",33,anthro_dh::c405,anthro_dh,"Measurement #2 of the weight of the target child participant's mother, in kg. Anthropometry of target children was assessed 1 year after intervention initiation (midline, when target children were 8-15m of age) and 2 years after intervention initiation (endline, when target children were 21-27m of age). Mother's weights may not have been recorded at the endline anthropometry assessment if the target child was weighed directly.",Observation,Anthropometry,http://purl.obolibrary.org/obo/EUPATH_0000649,Maternal weight meas 2,26.2 to 90,variabe
http://purl.obolibrary.org/obo/EUPATH_0035089,"Caretaker weight (kg), 3rd",34,anthro_dh::c406,anthro_dh,"Measurement #3 of the weight of the target child participant's mother, in kg. A 3rd measurement was only taken if the difference between measures 1 & 2 is greater than or equal to 0.1 kg. Anthropometry of target children was assessed 1 year after intervention initiation (midline, when target children were 8-15m of age) and 2 years after intervention initiation (endline, when target children were 21-27m of age). Mother's weights may not have been recorded at the endline anthropometry assessment if the target child was weighed directly.",Observation,Anthropometry,http://purl.obolibrary.org/obo/EUPATH_0000649,Maternal weight meas 3,27.7 to 82.65,variabe
http://purl.obolibrary.org/obo/EUPATH_0000683,Head circumference (cm),26,anthro_dh::c418,anthro_dh,"Measurement #1 of the head circumference of the target child participant, in cm. Anthropometry of target children was assessed 1 year after intervention initiation (midline, when target children were 8-15m of age) and 2 years after intervention initiation (endline, when target children were 21-27m of age).",Observation,Anthropometry,http://purl.obolibrary.org/obo/EUPATH_0000649,Head circumference meas 1,34.9 to 99.9,variabe
http://purl.obolibrary.org/obo/EUPATH_0035084,"Head circumference (cm), 2nd",27,anthro_dh::c419,anthro_dh,"Measurement #2 of the head circumference of the target child participant, in cm. Anthropometry of target children was assessed 1 year after intervention initiation (midline, when target children were 8-15m of age) and 2 years after intervention initiation (endline, when target children were 21-27m of age).",Observation,Anthropometry,http://purl.obolibrary.org/obo/EUPATH_0000649,Head circumference meas 2,35 to 99.9,variabe
http://purl.obolibrary.org/obo/EUPATH_0035085,"Head circumference (cm), 3rd",28,anthro_dh::c420,anthro_dh,"Measurement #3 of the head circumference of the target child participant, in cm. Anthropometry of target children was assessed 1 year after intervention initiation (midline, when target children were 8-15m of age) and 2 years after intervention initiation (endline, when target children were 21-27m of age).",Observation,Anthropometry,http://purl.obolibrary.org/obo/EUPATH_0000649,Head circumference meas 3,37.5 to 442.4,variabe
http://purl.obolibrary.org/obo/EUPATH_0035076,Head circumference-for-age z-score flag,16,anthro_dh::hcz_x,anthro_dh,"Whether the head circumference-for-age z-score for the target child participant was flagged for being greater than 5 or less than -5. Anthropometry of target children was assessed 1 year after intervention initiation (midline, when target children were 8-15m of age) and 2 years after intervention initiation (endline, when target children were 21-27m of age).",Observation,Anthropometry,http://purl.obolibrary.org/obo/EUPATH_0000649,"Abs(HCZ)>5, set to missing",0 to 1,variabe
http://purl.obolibrary.org/obo/EUPATH_0035075,"Head circumference-for-age z-score, using median circumference",15,anthro_dh::hcz,anthro_dh,"Head circumference-for-age z-score for the target child participant, using median circumference. Values greater than 5 or less than -5 were flagged and set to missing.  Anthropometry of target children was assessed 1 year after intervention initiation (midline, when target children were 8-15m of age) and 2 years after intervention initiation (endline, when target children were 21-27m of age).",Observation,Anthropometry,http://purl.obolibrary.org/obo/EUPATH_0000649,Head circumference-for-age z-score,-4.96 to 3.33,variabe
http://purl.obolibrary.org/obo/EUPATH_0035068,Length- or height-for-age z-score flag,8,anthro_dh::laz_x,anthro_dh,"Whether the length- or height-for-age z-score for the target child participant was flagged for being greater than 6 or less than -6. Anthropometry of target children was assessed 1 year after intervention initiation (midline, when target children were 8-15m of age) and 2 years after intervention initiation (endline, when target children were 21-27m of age).",Observation,Anthropometry,http://purl.obolibrary.org/obo/EUPATH_0000649,"Abs(LAZ)>6, set to missing",0 to 1,variabe
http://purl.obolibrary.org/obo/EUPATH_0035067,"Length- or height-for-age z-score, using median stature",7,anthro_dh::laz,anthro_dh,"Length- or height-for-age z-score for the target child participant, using median stature. Values greater than 6 or less than -6 were flagged and set to missing.  Anthropometry of target children was assessed 1 year after intervention initiation (midline, when target children were 8-15m of age) and 2 years after intervention initiation (endline, when target children were 21-27m of age).",Observation,Anthropometry,http://purl.obolibrary.org/obo/EUPATH_0000649,Length/height-for-age Z-score,-5.68 to 5.18,variabe
http://purl.obolibrary.org/obo/EUPATH_0035083,Median head circumference (cm),25,anthro_dh::headcir,anthro_dh,"Median head circumference of the target child participant, in cm. Anthropometry of target children was assessed 1 year after intervention initiation (midline, when target children were 8-15m of age) and 2 years after intervention initiation (endline, when target children were 21-27m of age).",Observation,Anthropometry,http://purl.obolibrary.org/obo/EUPATH_0000649,"* Child head circumference (median), cm",34.95 to 69.15,variabe
http://purl.obolibrary.org/obo/EUPATH_0035077,Median stature (cm),17,anthro_dh::length,anthro_dh,"Median stature of the target child participant, in cm. Stature was measured as either recumbent length or height while standing.  Anthropometry of target children was assessed 1 year after intervention initiation (midline, when target children were 8-15m of age) and 2 years after intervention initiation (endline, when target children were 21-27m of age).",Observation,Anthropometry,http://purl.obolibrary.org/obo/EUPATH_0000649,"* Child length (median), cm",42.15 to 99.65,variabe
http://purl.obolibrary.org/obo/EUPATH_0035080,Median weight (kg),21,anthro_dh::weight,anthro_dh,"Median weight of the target child participant, in kg. Target child participant weight was either assessed directly or by measuring the weight of the mother plus the target child and subtracting out the mother's weight. Anthropometry of target children was assessed 1 year after intervention initiation (midline, when target children were 8-15m of age) and 2 years after intervention initiation (endline, when target children were 21-27m of age).",Observation,Anthropometry,http://purl.obolibrary.org/obo/EUPATH_0000649,"* Child weight (median), kg",3.275 to 19,variabe
http://purl.obolibrary.org/obo/EUPATH_0035061,Severely stunted,1,anthro_dh::lazminus3,anthro_dh,"Whether the target child participant was severely stunted, defined as having a length- or height-for-age z-score of less than -3. Anthropometry of target children was assessed 1 year after intervention initiation (midline, when target children were 8-15m of age) and 2 years after intervention initiation (endline, when target children were 21-27m of age).",Observation,Anthropometry,http://purl.obolibrary.org/obo/EUPATH_0000649,Severely Stunted (LAZ<-3),0 to 1,variabe
http://purl.obolibrary.org/obo/EUPATH_0035065,Severely underweight,5,anthro_dh::wazminus3,anthro_dh,"Whether the target child participant was severely underweight, defined as having a weight-for-age z-score of less than -3. Anthropometry of target children was assessed 1 year after intervention initiation (midline, when target children were 8-15m of age) and 2 years after intervention initiation (endline, when target children were 21-27m of age).",Observation,Anthropometry,http://purl.obolibrary.org/obo/EUPATH_0000649,Severely Underweight (WAZ<-3),0 to 1,variabe
http://purl.obolibrary.org/obo/EUPATH_0035063,Severely wasted,3,anthro_dh::whzminus3,anthro_dh,"Whether the target child participant was severely wasted, defined as having a weight-for-length or -height z-score of less than -3. Anthropometry of target children was assessed 1 year after intervention initiation (midline, when target children were 8-15m of age) and 2 years after intervention initiation (endline, when target children were 21-27m of age).",Observation,Anthropometry,http://purl.obolibrary.org/obo/EUPATH_0000649,Severely Wasted (WHZ<-3),0 to 1,variabe
http://purl.obolibrary.org/obo/EUPATH_0011893,Stature (cm),18,anthro_dh::c414,anthro_dh,"Measurement #1 of the stature of the target child participant, in cm. Stature was measured as either recumbent length or height while standing. Anthropometry of target children was assessed 1 year after intervention initiation (midline, when target children were 8-15m of age) and 2 years after intervention initiation (endline, when target children were 21-27m of age).",Observation,Anthropometry,http://purl.obolibrary.org/obo/EUPATH_0000649,Child length meas 1,42.1 to 999.9,variabe
http://purl.obolibrary.org/obo/EUPATH_0035078,"Stature (cm), 2nd",19,anthro_dh::c415,anthro_dh,"Measurement #2 of the stature of the target child participant, in cm. Stature was measured as either recumbent length or height while standing. Anthropometry of target children was assessed 1 year after intervention initiation (midline, when target children were 8-15m of age) and 2 years after intervention initiation (endline, when target children were 21-27m of age).",Observation,Anthropometry,http://purl.obolibrary.org/obo/EUPATH_0000649,Child length meas 2,42.2 to 999.9,variabe
http://purl.obolibrary.org/obo/EUPATH_0035079,"Stature (cm), 3rd",20,anthro_dh::c416,anthro_dh,"Measurement #3 of the stature of the target child participant, in cm. Stature was measured as either recumbent length or height while standing. A 3rd measurement was only taken if the difference between measures 1 & 2 was greater than or equal to 0.5 cm. Anthropometry of target children was assessed 1 year after intervention initiation (midline, when target children were 8-15m of age) and 2 years after intervention initiation (endline, when target children were 21-27m of age).",Observation,Anthropometry,http://purl.obolibrary.org/obo/EUPATH_0000649,Child length meas 3,0 to 999.9,variabe
http://purl.obolibrary.org/obo/EUPATH_0035062,Stunted,2,anthro_dh::lazminus2,anthro_dh,"Whether the target child participant was stunted, defined as having a length- or height-for-age z-score of less than -2. Anthropometry of target children was assessed 1 year after intervention initiation (midline, when target children were 8-15m of age) and 2 years after intervention initiation (endline, when target children were 21-27m of age).",Observation,Anthropometry,http://purl.obolibrary.org/obo/EUPATH_0000649,Stunted (LAZ<-2),0 to 1,variabe
