IRI,label,displayOrder,variable,dataFile,definition,category,parentLabel,parentIRI,codebookDescription,codebookValues,termType
http://purl.obolibrary.org/obo/EUPATH_0035066,Underweight,6,anthro_dh::wazminus2,anthro_dh,"Whether the target child participant was underweight, defined as having a weight-for-age z-score of less than -2. Anthropometry of target children was assessed 1 year after intervention initiation (midline, when target children were 8-15m of age) and 2 years after intervention initiation (endline, when target children were 21-27m of age).",Observation,Anthropometry,http://purl.obolibrary.org/obo/EUPATH_0000649,Underweight (WAZ<-2),0 to 1,variabe
http://purl.obolibrary.org/obo/EUPATH_0035064,Wasted,4,anthro_dh::whzminus2,anthro_dh,"Whether the target child participant was wasted, defined as having a weight-for-length or -height z-score of less than -2. Anthropometry of target children was assessed 1 year after intervention initiation (midline, when target children were 8-15m of age) and 2 years after intervention initiation (endline, when target children were 21-27m of age).",Observation,Anthropometry,http://purl.obolibrary.org/obo/EUPATH_0000649,Wasted (WHZ<-2),0 to 1,variabe
http://purl.obolibrary.org/obo/EUPATH_0000732,Weight (kg),22,anthro_dh::c411,anthro_dh,"Direct measurement #1 of the weight of the target child participant, in kg. These direct weight measurement were reserved for endline anthropometric assessment and did not occur at the midline assessment. Target child participants who were not weighed directly at the endline assessment were weighed in combination with their mother.",Observation,Anthropometry,http://purl.obolibrary.org/obo/EUPATH_0000649,Child weight meas 1,5.2 to 19,variabe
http://purl.obolibrary.org/obo/EUPATH_0035081,"Weight (kg), 2nd",23,anthro_dh::c412,anthro_dh,"Direct measurement #2 of the weight of the target child participant, in kg. These direct weight measurement were reserved for endline anthropometric assessment and did not occur at the midline assessment. Target child participants who were not weighed directly at the endline assessment were weighed in combination with their mother.",Observation,Anthropometry,http://purl.obolibrary.org/obo/EUPATH_0000649,Child weight meas 2,5.2 to 19,variabe
http://purl.obolibrary.org/obo/EUPATH_0035082,"Weight (kg), 3rd",24,anthro_dh::c413,anthro_dh,"Direct measurement #3 of the weight of the target child participant, in kg. These direct weight measurement were reserved for endline anthropometric assessment and did not occur at the midline assessment. Target child participants who were not weighed directly at the endline assessment were weighed in combination with their mother. A 3rd measurement was only taken if the difference between measures 1 & 2 is greater than or equal to 0.1 kg.",Observation,Anthropometry,http://purl.obolibrary.org/obo/EUPATH_0000649,Child weight meas 3,8.25 to 14.35,variabe
http://purl.obolibrary.org/obo/EUPATH_0035074,Weight-for-age z-score flag,14,anthro_dh::waz_x,anthro_dh,"Whether the weight-for-age z-score for the target child participant was flagged for being greater than 5 or less than -6. Anthropometry of target children was assessed 1 year after intervention initiation (midline, when target children were 8-15m of age) and 2 years after intervention initiation (endline, when target children were 21-27m of age).",Observation,Anthropometry,http://purl.obolibrary.org/obo/EUPATH_0000649,"WAZ < -6 or WAZ > 5, set to missing",0 to 1,variabe
http://purl.obolibrary.org/obo/EUPATH_0035073,"Weight-for-age z-score, using median weight",13,anthro_dh::waz,anthro_dh,"Weight-for-age z-score for the target child participant, using median weight. Values greater than 5 or less than -6 were flagged and set to missing.  Anthropometry of target children was assessed 1 year after intervention initiation (midline, when target children were 8-15m of age) and 2 years after intervention initiation (endline, when target children were 21-27m of age).",Observation,Anthropometry,http://purl.obolibrary.org/obo/EUPATH_0000649,Weight-for-age Z-score,-5.48 to 4.28,variabe
http://purl.obolibrary.org/obo/EUPATH_0035070,Weight-for-length or -height z-score flag,10,anthro_dh::whz_x,anthro_dh,"Whether the weight-for-length or -height z-score for the target child participant was flagged for being greater than 5 or less than -5. Anthropometry of target children was assessed 1 year after intervention initiation (midline, when target children were 8-15m of age) and 2 years after intervention initiation (endline, when target children were 21-27m of age).",Observation,Anthropometry,http://purl.obolibrary.org/obo/EUPATH_0000649,"Abs(WHZ)>5, set to missing",0 to 1,variabe
http://purl.obolibrary.org/obo/EUPATH_0035069,"Weight-for-length or -height z-score, using median weight and median length or height",9,anthro_dh::whz,anthro_dh,"Weight-for-length or -height z-score for the target child participant, using median weight and median length or height. Values greater than 5 or less than -5 were flagged and set to missing.  Anthropometry of target children was assessed 1 year after intervention initiation (midline, when target children were 8-15m of age) and 2 years after intervention initiation (endline, when target children were 21-27m of age).",Observation,Anthropometry,http://purl.obolibrary.org/obo/EUPATH_0000649,Weight-for-length/height Z-score,-4.91 to 4.97,variabe
http://purl.obolibrary.org/obo/EUPATH_0035090,Chlorine detected in stored drinking water,NA,uptake_dh::freechl,uptake_dh,"Whether more than 0.1 mg/L of free residual chlorine was detected in stored drinking water. Only water samples collected from compounds that reported treating their drinking water with some form of chlorine were tested. Assessed for the compound (multiple households sharing a common courtyard) 1 year after intervention initiation (midline, when target children were 8-15m of age) and 2 years after intervention initiation (endline, when target children were 21-27m of age).",Observation,Household water,http://purl.obolibrary.org/obo/EUPATH_0000731,Free chlorine detected in stored water (>0.1 mg/L),0 to 1,variabe
http://purl.obolibrary.org/obo/EUPATH_0035091,Stored drinking water,NA,uptake_dh::storewat,uptake_dh,"Whether drinking water for the compound was stored. Assessed for the compound (multiple households sharing a common courtyard) at enrollment (when target children were in utero), 1 year after intervention initiation (midline, when target children were 8-15m of age) and 2 years after intervention initiation (endline, when target children were 21-27m of age).",Observation,Household water,http://purl.obolibrary.org/obo/EUPATH_0000731,Store drinking water (q10001),0 to 1,variabe
http://purl.obolibrary.org/obo/EUPATH_0000579,Age (days),1,anthro_dh::aged | diar_dh::agedays,anthro_dh | diar_dh,,Observation,Observation,http://purl.obolibrary.org/obo/EUPATH_0000738,Age in days (anthro meas) | Age in days,-42 to 2013 | 42 to 1159,variabe
http://purl.obolibrary.org/obo/EUPATH_0000649,Anthropometry,,,,,Observation,Observation,http://purl.obolibrary.org/obo/EUPATH_0000738,,,category
http://purl.obolibrary.org/obo/EUPATH_0000310,Observation details,,,,,Observation,Observation,http://purl.obolibrary.org/obo/EUPATH_0000738,,,category
http://purl.obolibrary.org/obo/EUPATH_0000309,Signs and symptoms,,,,,Observation,Observation,http://purl.obolibrary.org/obo/EUPATH_0000738,,,category
http://purl.obolibrary.org/obo/EUPATH_0035092,Study timepoint,2,diar_dh::svy | anthro_dh::svy,anthro_dh | diar_dh,"Survey data was collected at enrollment (baseline), and outcomes were measured after 12 months (midline) and 24 months (endline) of intervention delivery.",Observation,Observation,http://purl.obolibrary.org/obo/EUPATH_0000738,"Survey round (0,1,2)",0 to 2 | 1 to 2,variabe
http://purl.obolibrary.org/obo/EUPATH_0035095,Assessment month,2,anthro_dh::month | diar_dh::month,anthro_dh | diar_dh,Calendar month in which data on participants was collected.,Observation,Observation details,http://purl.obolibrary.org/obo/EUPATH_0000310,Month of measurement,1 to 12,variabe
http://purl.obolibrary.org/obo/EUPATH_0035096,Assessment week,3,diar_dh::svyweek | anthro_dh::anthroweek,anthro_dh | diar_dh,Calendar week in which data on participants were collected.,Observation,Observation details,http://purl.obolibrary.org/obo/EUPATH_0000310,Week of survey | Week of anthropometry measurement,1 to 52,variabe
http://purl.obolibrary.org/obo/EUPATH_0035094,Assessment year,1,anthro_dh::anthroyear | diar_dh::svyyear,anthro_dh | diar_dh,Calendar year in which data on participants were collected.,Observation,Observation details,http://purl.obolibrary.org/obo/EUPATH_0000310,Year of survey | Year of anthropometry measurement,2012 to 2015 | 2013 to 2015,variabe
http://purl.obolibrary.org/obo/EUPATH_0035093,Field research assistant code,4,enrol_dh::fracode,enrol_dh,Code to identify the field research assistant who took the measurement. This was used as an adjustment variable in case there was any measurement bias based on who collected the data.,Observation,Observation details,http://purl.obolibrary.org/obo/EUPATH_0000310,FRA code (q4001),. to .,variabe
http://purl.obolibrary.org/obo/EUPATH_0011878,Symptoms by caregiver report,,,,,Observation,Signs and symptoms,http://purl.obolibrary.org/obo/EUPATH_0000309,,,category
http://purl.obolibrary.org/obo/EUPATH_0035104,"3+ stools in 24hrs during last 2 days, caregiver report",8,diar_dh::d3plus2d,diar_dh,"Whether the participant had 3 or more bowel movements in a 24 hour period within in the last 2 days. Caregiver reported symptoms were assessed in target children 1 year after intervention initiation (midline, when target children were 8-15m of age) and 2 years after intervention initiation (endline, when target children were 21-27m of age). Caregiver reported symptoms were also assessed in sibling/neighbor participants at enrollment, midline, and endline.",Observation,Symptoms by caregiver report,http://purl.obolibrary.org/obo/EUPATH_0011878,"3+ stools in 24 hr, 2d recall",0 to 1,variabe
http://purl.obolibrary.org/obo/EUPATH_0035103,"3+ stools in 24hrs during last 7 days, caregiver report",7,diar_dh::d3plus7d,diar_dh,"Whether the participant had 3 or more bowel movements in a 24 hour period within in the last 7 days. Caregiver reported symptoms were assessed in target children 1 year after intervention initiation (midline, when target children were 8-15m of age) and 2 years after intervention initiation (endline, when target children were 21-27m of age). Caregiver reported symptoms were also assessed in sibling/neighbor participants at enrollment, midline, and endline.",Observation,Symptoms by caregiver report,http://purl.obolibrary.org/obo/EUPATH_0011878,"3+ stools in 24 hr, 7d recall",0 to 1,variabe
http://purl.obolibrary.org/obo/EUPATH_0035102,"Blood in stool during last 2 days, caregiver report",6,diar_dh::dblood2d,diar_dh,"Whether the participant had blood in their stools within in the last 2 days. Caregiver reported symptoms were assessed in target children 1 year after intervention initiation (midline, when target children were 8-15m of age) and 2 years after intervention initiation (endline, when target children were 21-27m of age). Caregiver reported symptoms were also assessed in sibling/neighbor participants at enrollment, midline, and endline.",Observation,Symptoms by caregiver report,http://purl.obolibrary.org/obo/EUPATH_0011878,"Blood in stool, 2d recall",0 to 1,variabe
http://purl.obolibrary.org/obo/EUPATH_0035101,"Blood in stool during last 7 days, caregiver report",5,diar_dh::dblood7d,diar_dh,"Whether the participant had blood in their stools within in the last 7 days. Caregiver reported symptoms were assessed in target children 1 year after intervention initiation (midline, when target children were 8-15m of age) and 2 years after intervention initiation (endline, when target children were 21-27m of age). Caregiver reported symptoms were also assessed in sibling/neighbor participants at enrollment, midline, and endline.",Observation,Symptoms by caregiver report,http://purl.obolibrary.org/obo/EUPATH_0011878,"Blood in stool, 7d recall",0 to 1,variabe
http://purl.obolibrary.org/obo/EUPATH_0035108,"Bruising during the last 2 days, caregiver report",12,diar_dh::bruise2d,diar_dh,"Whether the participant had bruising (a negative control outcome measured to detect potential differential bias in symptom reporting) within in the last 2 days. Caregiver reported symptoms were assessed in target children 1 year after intervention initiation (midline, when target children were 8-15m of age) and 2 years after intervention initiation (endline, when target children were 21-27m of age). Caregiver reported symptoms were also assessed in sibling/neighbor participants at enrollment, midline, and endline.",Observation,Symptoms by caregiver report,http://purl.obolibrary.org/obo/EUPATH_0011878,"Bruising, 2d recall",0 to 1,variabe
http://purl.obolibrary.org/obo/EUPATH_0035107,"Bruising during the last 7 days, caregiver report",11,diar_dh::bruise7d,diar_dh,"Whether the participant had bruising (a negative control outcome measured to detect potential differential bias in symptom reporting) within in the last 7 days. Caregiver reported symptoms were assessed in target children 1 year after intervention initiation (midline, when target children were 8-15m of age) and 2 years after intervention initiation (endline, when target children were 21-27m of age). Caregiver reported symptoms were also assessed in sibling/neighbor participants at enrollment, midline, and endline.",Observation,Symptoms by caregiver report,http://purl.obolibrary.org/obo/EUPATH_0011878,"Bruising, 7d recall",0 to 1,variabe
http://purl.obolibrary.org/obo/EUPATH_0035098,"Diarrhea case during the last 2 days, caregiver report",2,diar_dh::diar2d,diar_dh,"Whether the participant was classified as a diarrhea case within the last 2 days. To meet the definition for a diarrhea case, the participant must have had 3+ loose or watery stools in 24 hours OR 1+ stool with blood. Caregiver reported symptoms were assessed in target children 1 year after intervention initiation (midline, when target children were 8-15m of age) and 2 years after intervention initiation (endline, when target children were 21-27m of age). Caregiver reported symptoms were also assessed in sibling/neighbor participants at enrollment, midline, and endline.",Observation,Symptoms by caregiver report,http://purl.obolibrary.org/obo/EUPATH_0011878,"* Diarrhea case, 2d recall",0 to 1,variabe
http://purl.obolibrary.org/obo/EUPATH_0035097,"Diarrhea case during the last 7 days, caregiver report",1,diar_dh::diar7d,diar_dh,"Whether the participant was classified as a diarrhea case within the last 7 days. To meet the definition for a diarrhea case, the participant must have had 3+ loose or watery stools in 24 hours OR 1+ stool with blood. This variable, with a 7-day recall period, was used in the primary analysis to improve power as there was no evidence for differential recall by arm. Caregiver reported symptoms were assessed in target children 1 year after intervention initiation (midline, when target children were 8-15m of age) and 2 years after intervention initiation (endline, when target children were 21-27m of age). Caregiver reported symptoms were also assessed in sibling/neighbor participants at enrollment, midline, and endline.",Observation,Symptoms by caregiver report,http://purl.obolibrary.org/obo/EUPATH_0011878,"* Diarrhea case, 7d recall",0 to 1,variabe
http://purl.obolibrary.org/obo/EUPATH_0035100,"Loose or watery stools during last 2 days, caregiver report",4,diar_dh::dloose2d,diar_dh,"Whether the participant had loose or watery stools within in the last 2 days. Caregiver reported symptoms were assessed in target children 1 year after intervention initiation (midline, when target children were 8-15m of age) and 2 years after intervention initiation (endline, when target children were 21-27m of age). Caregiver reported symptoms were also assessed in sibling/neighbor participants at enrollment, midline, and endline.",Observation,Symptoms by caregiver report,http://purl.obolibrary.org/obo/EUPATH_0011878,"Loose or watery stool, 2d recall",0 to 1,variabe
http://purl.obolibrary.org/obo/EUPATH_0035099,"Loose or watery stools during last 7 days, caregiver report",3,diar_dh::dloose7d,diar_dh,"Whether the participant had loose or watery stools within in the last 2 days. Caregiver reported symptoms were assessed in target children 1 year after intervention initiation (midline, when target children were 8-15m of age) and 2 years after intervention initiation (endline, when target children were 21-27m of age). Caregiver reported symptoms were also assessed in sibling/neighbor participants at enrollment, midline, and endline.",Observation,Symptoms by caregiver report,http://purl.obolibrary.org/obo/EUPATH_0011878,"Loose or watery stool, 7d recall",0 to 1,variabe
http://purl.obolibrary.org/obo/EUPATH_0035106,"Toothache during the last 2 days, caregiver report",10,diar_dh::tooth2d,diar_dh,"Whether the participant had a toothache (a negative control outcome measured to detect potential differential bias in symptom reporting) within in the last 2 days. Caregiver reported symptoms were assessed in target children 1 year after intervention initiation (midline, when target children were 8-15m of age) and 2 years after intervention initiation (endline, when target children were 21-27m of age). Caregiver reported symptoms were also assessed in sibling/neighbor participants at enrollment, midline, and endline.",Observation,Symptoms by caregiver report,http://purl.obolibrary.org/obo/EUPATH_0011878,"Toothache, 2d recall",0 to 1,variabe
http://purl.obolibrary.org/obo/EUPATH_0035105,"Toothache during the last 7 days, caregiver report",9,diar_dh::tooth7d,diar_dh,"Whether the participant had a toothache (a negative control outcome measured to detect potential differential bias in symptom reporting) within in the last 7 days. Caregiver reported symptoms were assessed in target children 1 year after intervention initiation (midline, when target children were 8-15m of age) and 2 years after intervention initiation (endline, when target children were 21-27m of age). Caregiver reported symptoms were also assessed in sibling/neighbor participants at enrollment, midline, and endline.",Observation,Symptoms by caregiver report,http://purl.obolibrary.org/obo/EUPATH_0011878,"Toothache, 7d recall",0 to 1,variabe
http://purl.obolibrary.org/obo/EUPATH_0000096,Participant,,,,,Participant,,http://www.w3.org/2002/07/owl#Thing,,,category
http://purl.obolibrary.org/obo/PATO_0000047,Sex,,diar_dh::sex,diar_dh,,Participant,Demographics,http://purl.obolibrary.org/obo/EUPATH_0010981,Sex,0 to 1,variabe
http://purl.obolibrary.org/obo/EUPATH_0035111,Father employed in agriculture,3,enrol_dh::dadagri,enrol_dh,Whether the target child participant's father worked in agriculture. Assessed for the household at enrollment (when target children were in utero).,Participant,Individuals related to participant,http://purl.obolibrary.org/obo/EUPATH_0010037,Father works in agriculture (q011),0 to 1,variabe
http://purl.obolibrary.org/obo/EUPATH_0035110,Median mother's height (cm),2,enrol_dh::momheight,enrol_dh,"Median height of the target child participant's mother, in centimeters, based on measurements taken 1 year after intervention initiation (midline, when target children were 8-15m of age) and 2 years after intervention initiation (endline, when target children were 21-27m of age. Maternal height was measured in later visits and not at enrollment because it could have been influenced by pregnancy.",Participant,Individuals related to participant,http://purl.obolibrary.org/obo/EUPATH_0010037,Maternal height (median),120.65 to 168,variabe
http://purl.obolibrary.org/obo/EUPATH_0035109,Mother's age (years),1,enrol_dh::momage,enrol_dh,"Age of the target child participant's mother, in years. Assessed at enrollment (when target children were in utero).",Participant,Individuals related to participant,http://purl.obolibrary.org/obo/EUPATH_0010037,"Mother's age, years",14 to 60,variabe
http://purl.obolibrary.org/obo/EUPATH_0035114,Birth order,4,anthro_dh::birthord,anthro_dh,Order the target child participant was born into their family.,Participant,Participant,http://purl.obolibrary.org/obo/EUPATH_0000096,Birth order (target child),1 to 11,variabe
http://purl.obolibrary.org/obo/EUPATH_0010981,Demographics,,,,,Participant,Participant,http://purl.obolibrary.org/obo/EUPATH_0000096,,,category
http://purl.obolibrary.org/obo/EUPATH_0010037,Individuals related to participant,,,,,Participant,Participant,http://purl.obolibrary.org/obo/EUPATH_0000096,,,category
http://purl.obolibrary.org/obo/EUPATH_0000095,Participant ID,1,anthro_dh::pid | diar_dh::pid,anthro_dh | diar_dh,Unique identifier for the target child participant or sibling/neighbor participant.,Participant,Participant,http://purl.obolibrary.org/obo/EUPATH_0000096,,,"variable, derived"
http://purl.obolibrary.org/obo/EUPATH_0000307,Participant study details,,,,,Participant,Participant,http://purl.obolibrary.org/obo/EUPATH_0000096,,,category
http://purl.obolibrary.org/obo/EUPATH_0035112,Target child or sibling/neighbor,2,diar_dh::tchild,diar_dh,Target child participants were in utero at enrollment and were the primary study population. Older sibling or neighbor participants were less than 36m at the time of target child enrollment.,Participant,Participant,http://purl.obolibrary.org/obo/EUPATH_0000096,Target child in birth cohort,0 to 1,variabe
http://purl.obolibrary.org/obo/EUPATH_0035113,Twin,3,anthro_dh::t_twin,anthro_dh,Whether the target child participant was a twin.,Participant,Participant,http://purl.obolibrary.org/obo/EUPATH_0000096,,,"variable, derived"
http://purl.obolibrary.org/obo/EUPATH_0000120,Age at enrollment,1,diar_dh::enrolage,diar_dh,,Participant,Participant study details,http://purl.obolibrary.org/obo/EUPATH_0000307,"Age at enrollment, years",-2.683094 to 3.000684,variabe
http://purl.obolibrary.org/obo/EUPATH_0035115,Participant born after enrollment,2,diar_dh::newbirth,diar_dh,"Compounds with a pregnant women were enrolled. Target child participants (the primary study population) were, by definition, in utero at enrollment and always born after enrollment. Older sibling or neighbor participants who were less than 36m at the time of enrollment or who were born during follow-up were also included as participants.",Participant,Participant study details,http://purl.obolibrary.org/obo/EUPATH_0000307,New birth,0 to 1,variabe
