IRI,label,variable,displayOrder,dataFile,definition,category,parentIRI,parentLabel,codebookDescription,codebookValues,termType,repeated,is_temporal,mergeKey,dataSet,replaces,unitLabel,unitIRI,is_featured,hidden,scale,defaultDisplayRangeMin,defaultDisplayRangeMax,defaultBinWidth,forceStringType
http://purl.obolibrary.org/obo/EUPATH_0047974,Considered most effective,pnc_q69_withdrawal___6,6,ganc_phase2,,Participant,http://purl.obolibrary.org/obo/EUPATH_0047968,Factors contributing to recent use of withdrawal,69. What factors contributed to your decision to use Withdrawal method  Ni sababu zipi zilichangia maamuzi yako ya kutumia mbinu ya Kuondoa (choice=Considered the most effective method - Inajulikana kama mbinu iliyo na ufanisi),1 = Checked | 0 = Unchecked,value,,,,GANC,,,,,,,,,,
http://purl.obolibrary.org/obo/EUPATH_0047975,Side effects are unlikely,pnc_q69_withdrawal___7,7,ganc_phase2,,Participant,http://purl.obolibrary.org/obo/EUPATH_0047968,Factors contributing to recent use of withdrawal,69. What factors contributed to your decision to use Withdrawal method  Ni sababu zipi zilichangia maamuzi yako ya kutumia mbinu ya Kuondoa (choice=Unlikely to be bothered by side effects - Uwezekano mdogo wa kupata madhara kutokana na matumizi),1 = Checked | 0 = Unchecked,value,,,,GANC,,,,,,,,,,
http://purl.obolibrary.org/obo/EUPATH_0047976,Safe,pnc_q69_withdrawal___8,8,ganc_phase2,,Participant,http://purl.obolibrary.org/obo/EUPATH_0047968,Factors contributing to recent use of withdrawal,69. What factors contributed to your decision to use Withdrawal method  Ni sababu zipi zilichangia maamuzi yako ya kutumia mbinu ya Kuondoa (choice=Felt method was safe/few health concerns - Nilihisi mbinu ilikuwa salama/haina madhara mengi),1 = Checked | 0 = Unchecked,value,,,,GANC,,,,,,,,,,
http://purl.obolibrary.org/obo/EUPATH_0047977,Health provider influenced choice,pnc_q69_withdrawal___9,9,ganc_phase2,,Participant,http://purl.obolibrary.org/obo/EUPATH_0047968,Factors contributing to recent use of withdrawal,69. What factors contributed to your decision to use Withdrawal method  Ni sababu zipi zilichangia maamuzi yako ya kutumia mbinu ya Kuondoa (choice=Health provider influenced choice - Mhudumu wa Afya alichangia uchukuaji wa mbinu),0 = Unchecked | 1 = Checked,value,,,,GANC,,,,,,,,,,
,Who read with child,,1,,,Participant,http://purl.obolibrary.org/obo/EUPATH_0036005,Family care indicators,,,multifilter,,,,,,,,,,,,,,
,Who sang with child,,2,,,Participant,http://purl.obolibrary.org/obo/EUPATH_0036005,Family care indicators,,,multifilter,,,,,,,,,,,,,,
,Who played with child,,3,,,Participant,http://purl.obolibrary.org/obo/EUPATH_0036005,Family care indicators,,,multifilter,,,,,,,,,,,,,,
,"Who named, counted, or drew things for child",,4,,,Participant,http://purl.obolibrary.org/obo/EUPATH_0036005,Family care indicators,,,multifilter,,,,,,,,,,,,,,
,Who told child stories,,5,,,Participant,http://purl.obolibrary.org/obo/EUPATH_0036005,Family care indicators,,,multifilter,,,,,,,,,,,,,,
http://purl.obolibrary.org/obo/EUPATH_0047001,"Advantages to spacing pregnancies, specified",,13,,This question was asked at baseline and follow-up,Participant,http://purl.obolibrary.org/obo/EUPATH_0047006,Family planning,,,multifilter,,,,GANC,,,,,,,,,,
http://purl.obolibrary.org/obo/EUPATH_0047642,Agreement with advantages to spacing pregnancies,,14,,,Participant,http://purl.obolibrary.org/obo/EUPATH_0047006,Family planning,,,multifilter,,,,GANC,,,,,,,,,,
http://purl.obolibrary.org/obo/EUPATH_0047009,How to use the lactational amenorrhea method,,18,,This question was asked at baseline and follow-up,Participant,http://purl.obolibrary.org/obo/EUPATH_0047006,Family planning,,,multifilter,,,,GANC,,,,,,,,,,
http://purl.obolibrary.org/obo/EUPATH_0047007,Contraception before current pregnancy,,3,,Before this pregnancy  did you use any of the following methods to delay or prevent getting pregnant?,Participant,http://purl.obolibrary.org/obo/EUPATH_0047006,Family planning,,,multifilter,,,,GANC,,,,,,,,,,
http://purl.obolibrary.org/obo/EUPATH_0049806,Adapted contraceptive self-efficacy scale,,32,,Please rate how certain you are that you can do each of the things described,Participant,http://purl.obolibrary.org/obo/EUPATH_0047006,Family planning,,,multifilter,,,,GANC,,,,,,,,,,
http://purl.obolibrary.org/obo/EUPATH_0047011,Knowledge of family planning methods after delivery,,33,,"In addition to the lactational amenorrhea method (LAM), what other forms of birth spacing or family planning can you use immediately after delivery? This was asked at baseline and follow-up",Participant,http://purl.obolibrary.org/obo/EUPATH_0047006,Family planning,,,multifilter,,,,GANC,,,,,,,,,,
http://purl.obolibrary.org/obo/EUPATH_0047021,Postpartum family planning,,34,,,Participant,http://purl.obolibrary.org/obo/EUPATH_0047006,Family planning,,,category,,,,GANC,,,,,,,,,,
http://purl.obolibrary.org/obo/EUPATH_0047883,Other methods used to avoid pregnancy since giving birth,,35,,,Participant,http://purl.obolibrary.org/obo/EUPATH_0047006,Family planning,,,multifilter,,,,GANC,,,,,,,,,,
http://purl.obolibrary.org/obo/EUPATH_0047633,Perceptions about family planning,,36,,,Participant,http://purl.obolibrary.org/obo/EUPATH_0047006,Family planning,,,multifilter,,,,GANC,,,,,,,,,,
http://purl.obolibrary.org/obo/EUPATH_0047662,Factors contributing to not using FP,,37,,,Participant,http://purl.obolibrary.org/obo/EUPATH_0047006,Family planning,,,multifilter,,,,GANC,,,,,,,,,,
http://purl.obolibrary.org/obo/EUPATH_0047689,Current contraceptive method(s),,38,,,Participant,http://purl.obolibrary.org/obo/EUPATH_0047006,Family planning,,,multifilter,,,,GANC,,,,,,,,,,
http://purl.obolibrary.org/obo/EUPATH_0047703,Factors contributing to current use of LAM or breastfeeding,,39,,,Participant,http://purl.obolibrary.org/obo/EUPATH_0047006,Family planning,,,multifilter,,,,GANC,,,,,,,,,,
http://purl.obolibrary.org/obo/EUPATH_0047717,Factors contributing to current use of calendar or rhythm,,40,,,Participant,http://purl.obolibrary.org/obo/EUPATH_0047006,Family planning,,,multifilter,,,,GANC,,,,,,,,,,
http://purl.obolibrary.org/obo/EUPATH_0047731,Factors contributing to current use of Withdrawal,,41,,,Participant,http://purl.obolibrary.org/obo/EUPATH_0047006,Family planning,,,multifilter,,,,GANC,,,,,,,,,,
http://purl.obolibrary.org/obo/EUPATH_0047745,Factors contributing to current use of condoms,,42,,,Participant,http://purl.obolibrary.org/obo/EUPATH_0047006,Family planning,,,multifilter,,,,GANC,,,,,,,,,,
http://purl.obolibrary.org/obo/EUPATH_0047767,Factors contributing to current use of oral contraceptives,,43,,,Participant,http://purl.obolibrary.org/obo/EUPATH_0047006,Family planning,,,multifilter,,,,GANC,,,,,,,,,,
http://purl.obolibrary.org/obo/EUPATH_0047781,Factors contributing to current use of injectables,,44,,,Participant,http://purl.obolibrary.org/obo/EUPATH_0047006,Family planning,,,multifilter,,,,GANC,,,,,,,,,,
http://purl.obolibrary.org/obo/EUPATH_0047795,Factors contributing to current use of implants,,45,,,Participant,http://purl.obolibrary.org/obo/EUPATH_0047006,Family planning,,,multifilter,,,,GANC,,,,,,,,,,
http://purl.obolibrary.org/obo/EUPATH_0047809,Factors contributing to current use of IUD,,46,,,Participant,http://purl.obolibrary.org/obo/EUPATH_0047006,Family planning,,,multifilter,,,,GANC,,,,,,,,,,
http://purl.obolibrary.org/obo/EUPATH_0047823,Factors contributing to current use of emergency contraceptive pill,,47,,,Participant,http://purl.obolibrary.org/obo/EUPATH_0047006,Family planning,,,multifilter,,,,GANC,,,,,,,,,,
http://purl.obolibrary.org/obo/EUPATH_0047837,Factors contributing to current use of sterilization,,48,,,Participant,http://purl.obolibrary.org/obo/EUPATH_0047006,Family planning,,,multifilter,,,,GANC,,,,,,,,,,
http://purl.obolibrary.org/obo/EUPATH_0047997,Source of recent contraceptive method,,49,,,Participant,http://purl.obolibrary.org/obo/EUPATH_0047006,Family planning,,,multifilter,,,,GANC,,,,,,,,,,
http://purl.obolibrary.org/obo/EUPATH_0047851,Most recent family planning method,,50,,,Participant,http://purl.obolibrary.org/obo/EUPATH_0047006,Family planning,,,multifilter,,,,GANC,,,,,,,,,,
http://purl.obolibrary.org/obo/EUPATH_0047910,Factors contributing to recent use of LAM,,51,,,Participant,http://purl.obolibrary.org/obo/EUPATH_0047006,Family planning,,,multifilter,,,,GANC,,,,,,,,,,
http://purl.obolibrary.org/obo/EUPATH_0047939,Factors contributing to recent use of calendar or rhythm,,52,,,Participant,http://purl.obolibrary.org/obo/EUPATH_0047006,Family planning,,,multifilter,,,,GANC,,,,,,,,,,
http://purl.obolibrary.org/obo/EUPATH_0047968,Factors contributing to recent use of withdrawal,,53,,,Participant,http://purl.obolibrary.org/obo/EUPATH_0047006,Family planning,,,multifilter,,,,GANC,,,,,,,,,,
http://purl.obolibrary.org/obo/EUPATH_0049604,Factors contributing to recent use of condoms,,54,,,Participant,http://purl.obolibrary.org/obo/EUPATH_0047006,Family planning,,,multifilter,,,,GANC,,,,,,,,,,
http://purl.obolibrary.org/obo/EUPATH_0049633,Factors contributing to recent use of oral contraceptives,,55,,,Participant,http://purl.obolibrary.org/obo/EUPATH_0047006,Family planning,,,multifilter,,,,GANC,,,,,,,,,,
http://purl.obolibrary.org/obo/EUPATH_0049662,Factors contributing to recent use of injectables,,56,,,Participant,http://purl.obolibrary.org/obo/EUPATH_0047006,Family planning,,,multifilter,,,,GANC,,,,,,,,,,
http://purl.obolibrary.org/obo/EUPATH_0049691,Factors contributing to recent use of implants,,57,,,Participant,http://purl.obolibrary.org/obo/EUPATH_0047006,Family planning,,,multifilter,,,,GANC,,,,,,,,,,
http://purl.obolibrary.org/obo/EUPATH_0049720,Factors contributing to recent use of IUD,,58,,,Participant,http://purl.obolibrary.org/obo/EUPATH_0047006,Family planning,,,multifilter,,,,GANC,,,,,,,,,,
http://purl.obolibrary.org/obo/EUPATH_0049749,Factors contributing to recent use of emergency pill,,59,,,Participant,http://purl.obolibrary.org/obo/EUPATH_0047006,Family planning,,,multifilter,,,,GANC,,,,,,,,,,
http://purl.obolibrary.org/obo/EUPATH_0049763,Factors contributing to recent use of sterilization,,60,,,Participant,http://purl.obolibrary.org/obo/EUPATH_0047006,Family planning,,,multifilter,,,,GANC,,,,,,,,,,
http://purl.obolibrary.org/obo/EUPATH_0049792,Factors contributing to recent use of other method,,61,,,Participant,http://purl.obolibrary.org/obo/EUPATH_0047006,Family planning,,,multifilter,,,,GANC,,,,,,,,,,
http://purl.obolibrary.org/obo/EUPATH_0047867,Reason for discontinuing recent FP method,,62,,,Participant,http://purl.obolibrary.org/obo/EUPATH_0047006,Family planning,,,multifilter,,,,GANC,,,,,,,,,,
http://purl.obolibrary.org/obo/EUPATH_0047895,Reason for discontinuing recent use of LAM,,63,,,Participant,http://purl.obolibrary.org/obo/EUPATH_0047006,Family planning,,,multifilter,,,,GANC,,,,,,,,,,
http://purl.obolibrary.org/obo/EUPATH_0047924,Reason for discontinuing recent use of calendar or rhythm method,,64,,,Participant,http://purl.obolibrary.org/obo/EUPATH_0047006,Family planning,,,multifilter,,,,GANC,,,,,,,,,,
http://purl.obolibrary.org/obo/EUPATH_0047953,Reason for discontinuing recent use of withdrawal,,65,,,Participant,http://purl.obolibrary.org/obo/EUPATH_0047006,Family planning,,,multifilter,,,,GANC,,,,,,,,,,
http://purl.obolibrary.org/obo/EUPATH_0047982,Reason for discontinuing recent use of condoms,,66,,,Participant,http://purl.obolibrary.org/obo/EUPATH_0047006,Family planning,,,multifilter,,,,GANC,,,,,,,,,,
http://purl.obolibrary.org/obo/EUPATH_0049618,Reason for discontinuing recent use of oral contraceptives,,67,,,Participant,http://purl.obolibrary.org/obo/EUPATH_0047006,Family planning,,,multifilter,,,,GANC,,,,,,,,,,
http://purl.obolibrary.org/obo/EUPATH_0049647,Reason for discontinuing recent use of injectables,,68,,,Participant,http://purl.obolibrary.org/obo/EUPATH_0047006,Family planning,,,multifilter,,,,GANC,,,,,,,,,,
http://purl.obolibrary.org/obo/EUPATH_0049676,Reason for discontinuing recent use of implants,,69,,,Participant,http://purl.obolibrary.org/obo/EUPATH_0047006,Family planning,,,multifilter,,,,GANC,,,,,,,,,,
http://purl.obolibrary.org/obo/EUPATH_0049705,Reason for discontinuing recent use of IUD,,70,,,Participant,http://purl.obolibrary.org/obo/EUPATH_0047006,Family planning,,,multifilter,,,,GANC,,,,,,,,,,
http://purl.obolibrary.org/obo/EUPATH_0049734,Reason for discontinuing recent use of emergency pill,,71,,,Participant,http://purl.obolibrary.org/obo/EUPATH_0047006,Family planning,,,multifilter,,,,GANC,,,,,,,,,,
http://purl.obolibrary.org/obo/EUPATH_0049777,Reason for discontinuing recent use of other method,,72,,,Participant,http://purl.obolibrary.org/obo/EUPATH_0047006,Family planning,,,multifilter,,,,GANC,,,,,,,,,,
http://purl.obolibrary.org/obo/EUPATH_0047759,Source of current contraceptive method,,73,,,Participant,http://purl.obolibrary.org/obo/EUPATH_0047006,Family planning,,,multifilter,,,,GANC,,,,,,,,,,
http://purl.obolibrary.org/obo/EUPATH_0047586,Agreement with father of the baby,,9,,,Participant,http://purl.obolibrary.org/obo/EUPATH_0047006,Family planning,,,multifilter,,,,GANC,,,,,,,,,,
http://purl.obolibrary.org/obo/EUPATH_0047124,Desire to delay pregnancy,baseline_women_q10 | intent,1,ganc_pncvisits | ganc_baseline,Would you like to delay another pregnancy? Asked at baseline and phase 2,Participant,http://purl.obolibrary.org/obo/EUPATH_0047006,Family planning,"10. If it was up to you,  after you have this baby  would you want to delay getting pregnant again right away?",1 = Yes | 3 = Not sure/undecided | 2 = No,variable,yes,,,GANC,,,,,,,,,,
http://purl.obolibrary.org/obo/EUPATH_0047132,Knows ideal pregnancy spacing,pregnancy_spacing,10,ganc_baseline,How long should pregnancies be spaced apart for the best health of the mother and baby?,Participant,http://purl.obolibrary.org/obo/EUPATH_0047006,Family planning,13. How long should pregnancies be spaced apart for the best health of the mother and baby?,1 = Knows the time | 2 = Dont know | 3 = No response,variable,,,,GANC,,,,,,,,,,
http://purl.obolibrary.org/obo/EUPATH_0047131,Ideal pregnancy spacing,baseline_women_q13 | pnc_q48,11,ganc_baseline | ganc_phase2,This question was asked at baseline and follow-up,Participant,http://purl.obolibrary.org/obo/EUPATH_0047006,Family planning,,,variable,yes,yes,,GANC,,months,http://purl.obolibrary.org/obo/UO_0000035,,,,,,,
http://purl.obolibrary.org/obo/EUPATH_0047120,Any advantages to spacing pregnancies,baseline_women_q11 | birth_spacing,12,ganc_followup | ganc_baseline,Do you think there are advantages to spacing pregnancies apart? This question was asked at baseline and follow-up,Participant,http://purl.obolibrary.org/obo/EUPATH_0047006,Family planning,29. Do you think there are advantages to spacing pregnancies apart? | 11. Do you think there are advantages to spacing pregnancies apart?,2 = No | 3 = Not sure | 1 = Yes,variable,yes,,,GANC,,,,,,,,,,
http://purl.obolibrary.org/obo/EUPATH_0047122,Pregnancy spacing time,birth_spacing_time,15,ganc_followup,How long should pregnancies be spaced apart for the best health of the mother and baby?,Participant,http://purl.obolibrary.org/obo/EUPATH_0047006,Family planning,,,variable,,,,GANC,,,,,,,,,,
http://purl.obolibrary.org/obo/EUPATH_0047133,Pregnancy before menstrual period return,pnc_q49 | pregnant_before_menstrual | baseline_women_q18,16,ganc_phase2 | ganc_baseline | ganc_followup,After the birth of a child  can a woman become pregnant before her menstrual period has returned? This question was asked at baseline and follow-up.,Participant,http://purl.obolibrary.org/obo/EUPATH_0047006,Family planning,18. After the birth of a child  can a woman become pregnant before her menstrual period has returned? | 49. After the birth of a child  can a woman become pregnant before her menstrual period has returned?   Baada ya kuzaliwa kwa mtoto  mwanamke anaweza kupata ujauzito kabla hedhi yake kurejea? | 36. After the birth of a child  can a woman become pregnant before her menstrual period has returned?,2 = No | 3 = Dont know | 1 = Yes | 3 = Dont know/Unsure - Sijui/Sina Uhakika | 2 = No - La | 1 = Yes - Ndio,variable,yes,,,GANC,,,,,,,,,,
http://purl.obolibrary.org/obo/EUPATH_0047129,Heard of using LAM to delay pregnancy,baseline_women_q16 | ever_heard_of_lam,17,ganc_followup | ganc_baseline,Have you ever heard of using the lactational amenorrhea method  LAM  as a way to delay pregnancy after you have a baby? This method includes breastfeeding your baby. (This was asked at baseline and follow-up),Participant,http://purl.obolibrary.org/obo/EUPATH_0047006,Family planning,16. Have you ever heard of using the lactational amenorrhea method  LAM  as a way to delay pregnancy after you have a baby?  This method includes breastfeeding your baby. | 34. Have you ever heard of using the lactational amenorrhea method  LAM  as a way to delay pregnancy after you have a baby? This method includes breastfeeding your baby.,3 = Not sure | 2 = No | 1 = Yes,variable,yes,,,GANC,,,,,,,,,,
http://purl.obolibrary.org/obo/EUPATH_0047648,Change to method other than LAM when child is not exclusively breastfed,pnc_q50a,19,ganc_phase2,A woman only gives her baby breastmilk but her mother in law also gives the baby water and thin porridge sometimes.  To prevent pregnancy  should she choose a different family planning method?,Participant,http://purl.obolibrary.org/obo/EUPATH_0047006,Family planning,50a. Habiba only gives her baby breastmilk but her mother in law also gives the baby water and thin porridge sometimes.  To prevent pregnancy  should Habiba choose a different family planning method?   Habiba anamnyonyesha mwanawe kama njia ya kipekee laki,3 = Not sure/Dont know - Sina Uhakika/Sijui | 1 = Yes - Ndio | 2 = No - La,variable,,,,GANC,,,,,,,,,,
http://purl.obolibrary.org/obo/EUPATH_0047123,Making contraception decision,use_contraception_decision | baseline_women_q9 | pnc_q30,2,ganc_baseline | ganc_followup | ganc_phase2,"Would you say that using contraception is mainly your decision  mainly your husband or partner's decision  or did you both decide together? This question was asked at baseline, follow-up and phase 2.",Participant,http://purl.obolibrary.org/obo/EUPATH_0047006,Family planning,56. Would you say that using (or not using) contraception is mainly your decision  mainly your husbands/partners decision  or did you both decide together? | 9. Would you say that in the past  using contraception is mainly your decision  mainly your (husbands/partners) decision  or did you both decide together | 30. Would you say that using contraception is mainly  Unaweza kusema kuwa kutumia mbinu ya upangaji uzazi kwa kiasi kikubwa ni,2 = Your husband/partners decision - Uamuzi wa mme/mwenza wako | 2 = Your husband/partners decision | 3 = Joint decision - Maamuzi ya nyote wawili | 2 = Mainly husband/partner | 1 = Your decision - Uamuzi wako | 3 = Joint decision | 1 = Mainly respondent | 4 = Other | 4 = Other - Nyingine | 1 = Your decision,variable,yes,,,GANC,,,,,,,,,,
http://purl.obolibrary.org/obo/EUPATH_0047649,Continue using LAM when period returns,pnc_q50b,20,ganc_phase2,Can a woman continue to use LAM as a family planning method after she sees her first menses/monthly bleeding?,Participant,http://purl.obolibrary.org/obo/EUPATH_0047006,Family planning,50b. Can she continue to use LAM as a family planning method after she sees her first menses/monthly bleeding?    Anaweza kuendelea kutumia LAM kama mbinu ya upangaji uzazi baada ya kupokea hedhi yake ya kwanza,1 = Yes - Ndio | 3 = Not sure/Dont know - Sina Uhakika/Sijui | 2 = No - La,variable,,,,GANC,,,,,,,,,,
http://purl.obolibrary.org/obo/EUPATH_0047650,How long to use LAM,pnc_q50c,21,ganc_phase2,What is the oldest a baby can be before LAM is no longer a good option for the mother?,Participant,http://purl.obolibrary.org/obo/EUPATH_0047006,Family planning,,,variable,,yes,,GANC,,months,http://purl.obolibrary.org/obo/UO_0000035,,,,,,,
http://purl.obolibrary.org/obo/EUPATH_0047136,Transition method chosen if LAM,lam_chosen,22,ganc_followup,,Participant,http://purl.obolibrary.org/obo/EUPATH_0047006,Family planning,29. If LAM select method  transition method chosen?,0 = No | 3 = N/A | 1 = Yes,variable,,,,GANC,,,,,,,,,,
http://purl.obolibrary.org/obo/EUPATH_0047137,Transition method specified,transition_method,23,ganc_followup,,Participant,http://purl.obolibrary.org/obo/EUPATH_0047006,Family planning,29i. Specify method,9 = Standard days or rhythm method | 2 = Implants | 10 = Other | 8 = Sterilisation | 6 = IUD | 4 = Condoms | 3 = Withdrawal | 7 = Emergency contraception | 1 = Injectable | 5 = Pill/Oral contraceptives,variable,,,,GANC,,,,,,,,,,
http://purl.obolibrary.org/obo/EUPATH_0047661,Use of family planning in 12 months since giving birth,pnc_q56,24,ganc_phase2,In the last 12 months since your baby was born have you used any method of family planning to prevent pregnancy ?,Participant,http://purl.obolibrary.org/obo/EUPATH_0047006,Family planning,56. In the last 12 months since your baby was born  have you used any method of family planning to prevent pregnancy  Ndani ya miezi 12 tangu mtoto wako kuzaliwa  umetumia mbinu ya upangaji uzazi kuzuia kupata mimba?,1 = Yes - Ndio | 2 = No - La,variable,,,,GANC,,,,,,,,,,
http://purl.obolibrary.org/obo/EUPATH_0047866,Time after delivery that family planning method was discontinued,pnc_q59num_months,25,ganc_phase2,,Participant,http://purl.obolibrary.org/obo/EUPATH_0047006,Family planning,,,variable,,,,GANC,,months,http://purl.obolibrary.org/obo/UO_0000035,,,,,,,
http://purl.obolibrary.org/obo/EUPATH_0047882,Use of other family planning methods since giving birth,pnc_q63,26,ganc_phase2,,Participant,http://purl.obolibrary.org/obo/EUPATH_0047006,Family planning,63. After the birth of your baby but before using this (these) current/most recent method(s)  did you or your partner do something or use a different method to avoid pregnancy   Baada ya kujifungua mwanao lakini kabla ya mbinu ya hivi sasa/ya hivi karibuni,1 = Yes - Ndio | 2 = No - La,variable,,,,GANC,,,,,,,,,,
http://purl.obolibrary.org/obo/EUPATH_0047688,Currently using FP method,usefp | pnc_q57,27,ganc_phase2 | ganc_pncvisits,,Participant,http://purl.obolibrary.org/obo/EUPATH_0047006,Family planning,57. Are you currently using a family planning method to prevent pregnancy  Kwa sasa hivi unatumia mbinu ya upangaji uzazi kuzuia ujauzito?,1 = Yes - Ndio | 2 = No - La,variable,yes,,,GANC,,,,,,,,,,
http://purl.obolibrary.org/obo/EUPATH_0047651,Planned to start contraception right after delivery,pnc_q51,28,ganc_phase2,"During pregnancy, did you form a plan to deliver at a facility and start a contraceptive before leaving, for example, getting an IUD or implant?
after delivery and before leaving the facility?",Participant,http://purl.obolibrary.org/obo/EUPATH_0047006,Family planning,51. During pregnancy  did you form a plan to deliver at a facility and start a contraceptive before leaving  for example  getting an IUD or implant after delivery and before leaving the facility?  Wakati wa ujauzito  ulitengeneza mpango wa kujifungulia kat,2 = No - La | 1 = Yes - Ndio,variable,,,,GANC,,,,,,,,,,
http://purl.obolibrary.org/obo/EUPATH_0047652,Method of contraception right after delivery,pnc_q51a,29,ganc_phase2,What method did you choose to start at the facility after delivery?,Participant,http://purl.obolibrary.org/obo/EUPATH_0047006,Family planning,51a. What was your method choice  Mbinu yako uliyochagua ilikuwa ipi?,5 = Other - Nyingine | 1 = IUCD insertion - Kuwekwa IUCD | 2 = Implant insertion - Kuwekwa kipandikizi | 3 = Progesterone only pill - Tembe ya Progesterone pekee | 4 = Tubal ligation - Kufunga tubu,variable,,,,GANC,,,,,,,,,,
http://purl.obolibrary.org/obo/EUPATH_0047653,Received contraceptive method after delivery,pnc_q51b,30,ganc_phase2,,Participant,http://purl.obolibrary.org/obo/EUPATH_0047006,Family planning,51b. Did you receive this method prior to leaving the hospital after birth  Ulipokea mbinu hii kabla ya kutoka kwenye kituo cha afya baada ya kujifungua?,2 = No - La | 1 = Yes - Ndio,variable,,,,GANC,,,,,,,,,,
http://purl.obolibrary.org/obo/EUPATH_0047659,Future pregnancy preference,pnc_q55,31,ganc_phase2,,Participant,http://purl.obolibrary.org/obo/EUPATH_0047006,Family planning,55. If it were up to you  which of the following would you prefer  Iwapo ingekuwa juu yako  ni yepi kati yafuatayo ungependelea?,5 = NA: Currently pregnant - Mimi nimjamzito sasa hivi | 2 = Having another child  but not getting pregnant right now - Kuwa na mtoto mwingine  lakini sio kupata mimba sasa hivi | 3 = Getting pregnant as soon as possible - Kupata ujauzito haraka iwezekanavyo | 4 = Undecided - Sijaamua | 1 = Not ever getting pregnant again - Kamwe kutokuwa na ujauzito mwingine,variable,,,,GANC,,,,,,,,,,
http://purl.obolibrary.org/obo/EUPATH_0047121,Ask husband or partner to use condom,ask_to_use_condom | baseline_women_q24,4,ganc_baseline | ganc_followup,Could you ask your husband/partner to use a condom if you wanted him to? This question was asked at baseline and follow-up.,Participant,http://purl.obolibrary.org/obo/EUPATH_0047006,Family planning,55. Could you ask your husband/partner to use a condom if you wanted him to? | 24. Could you ask your husband/partner to use a condom if you wanted him to?,2 = No | 1 = Yes | 3 = Not sure/Depends,variable,yes,,,GANC,,,,,,,,,,
http://purl.obolibrary.org/obo/EUPATH_0047701,Husband knows you are using current FP method,pnc_q57i_b,5,ganc_phase2,Does your husband/partner know that you are currently using a method of family planning,Participant,http://purl.obolibrary.org/obo/EUPATH_0047006,Family planning,57ib. Does your husband/partner know that you are currently using a method of family planning  Mumeo/mwenzaako anafahamu kuwa sasa hivi unatumia mbinu ya upangaji uzazi?,1 = Yes - Ndio | 2 = No - La,variable,,,,GANC,,,,,,,,,,
