IRI,label,variable,displayOrder,dataFile,definition,category,parentIRI,parentLabel,codebookDescription,codebookValues,termType,repeated,is_temporal,mergeKey,dataSet,replaces,unitLabel,unitIRI,is_featured,hidden,scale,defaultDisplayRangeMin,defaultDisplayRangeMax,defaultBinWidth,forceStringType
http://purl.obolibrary.org/obo/EUPATH_0047293,Women in group listened to me,women_listened_to_me,6,ganc_followup,,Participant,http://purl.obolibrary.org/obo/EUPATH_0047018,Perceptions of group antenatal care,f. Women in the group listened to me,1 = Agree | 3 = Neither Agree or Disagree | 2 = Disagree,value,,,,GANC,,,,,,,,,,
http://purl.obolibrary.org/obo/EUPATH_0047291,Group leader talked at us,spent_good_time_talking,7,ganc_followup,,Participant,http://purl.obolibrary.org/obo/EUPATH_0047018,Perceptions of group antenatal care,g. The group leader talked at us or instructed us most of the time,3 = Neither Agree or Disagree | 1 = Agree | 2 = Disagree,value,,,,GANC,,,,,,,,,,
http://purl.obolibrary.org/obo/EUPATH_0047290,Group leader answered questions,group_leader_answd_qstns,8,ganc_followup,,Participant,http://purl.obolibrary.org/obo/EUPATH_0047018,Perceptions of group antenatal care,k. Mostly the group leader  not other members of the group answered our questions.,2 = Disagree | 3 = Neither Agree or Disagree | 1 = Agree,value,,,,GANC,,,,,,,,,,
http://purl.obolibrary.org/obo/EUPATH_0047292,Group leader talked too much,talked_too_much,8,ganc_followup,,Participant,http://purl.obolibrary.org/obo/EUPATH_0047018,Perceptions of group antenatal care,h. The group leader talked too much,2 = Disagree | 1 = Agree | 3 = Neither Agree or Disagree,value,,,,GANC,,,,,,,,,,
http://purl.obolibrary.org/obo/EUPATH_0047289,Group changed my thinking,changed_my_thinking,9,ganc_followup,,Participant,http://purl.obolibrary.org/obo/EUPATH_0047018,Perceptions of group antenatal care,m. The group changed the way I think about some things,2 = Disagree | 3 = Neither Agree or Disagree | 1 = Agree,value,,,,GANC,,,,,,,,,,
http://purl.obolibrary.org/obo/EUPATH_0047316,Mosquito net during ANC,given_mosquito_net,1,ganc_followup,Were you given a mosquito net during ANC care for this pregnancy?,Participant,http://purl.obolibrary.org/obo/EUPATH_0021097,Personal vector intervention,41. Were you given a mosquito net during ANC care for this pregnancy?,2 = No | 3 = Not sure | 1 = Yes,variable,,,,GANC,,,,,,,,,,
http://purl.obolibrary.org/obo/EUPATH_0047317,LLIN given during ANC,given_llin_anc,2,ganc_followup,Was client given LLIN during ANC care?,Participant,http://purl.obolibrary.org/obo/EUPATH_0021097,Personal vector intervention,Was client given LLIN during ANC care,1 = Yes | 3 = N/A | 0 = No,variable,,,,GANC,,,,,,,,,,
http://purl.obolibrary.org/obo/EUPATH_0047042,Has LLIN,have_llin,3,ganc_followup,Participant has long-lasting insecticidal net (LLIN),Participant,http://purl.obolibrary.org/obo/EUPATH_0021097,Personal vector intervention,5. Woman has LLIN?,1 = Yes | 0 = No,variable,,,,GANC,,,,,,,,,,
http://purl.obolibrary.org/obo/EUPATH_0025013,Bednet last night,slept_under_net | pnc_q12,4,ganc_followup | ganc_phase2,,Participant,http://purl.obolibrary.org/obo/EUPATH_0021097,Personal vector intervention,42. Did you sleep under a bed net last night? | 12. Did you sleep under a bed net last night  Jana usiku  ulilala ndani ya neti ya kitanda,1 = Yes | 2 = No | 2 = No - La | 3 = Not sure | 1 = Yes - Ndio,variable,yes,,,GANC,,,,,,,,,,
http://purl.obolibrary.org/obo/EUPATH_0047401,Bednet at GANC meeting,meeting_bednet,5,ganc_meetings,Group antenatal care meeting: Bed net use,Participant,http://purl.obolibrary.org/obo/EUPATH_0021097,Personal vector intervention,,,variable,yes,,,GANC,,,,,,,,,,
http://purl.obolibrary.org/obo/EUPATH_0021087,Diastolic blood pressure,meeting_dias | visit_dias,1,ganc_visits | ganc_meetings,Diastolic blood pressure at antenatal care visit,Participant,http://purl.obolibrary.org/obo/OGMS_0000083,Physical examination,,,"variable, derived | variable",yes,,,GANC,,mmHg,http://purl.obolibrary.org/obo/UO_0000272,,,,,,,
http://purl.obolibrary.org/obo/EUPATH_0021086,Systolic blood pressure,visit_sys | meeting_sys,2,ganc_visits | ganc_meetings,Systolic blood pressure at antenatal care visit,Participant,http://purl.obolibrary.org/obo/OGMS_0000083,Physical examination,,,"variable, derived | variable",yes,,,GANC,,mmHg,http://purl.obolibrary.org/obo/UO_0000272,,,,,,,
,Postpartum family planning perceptions,,5,,,Participant,http://purl.obolibrary.org/obo/EUPATH_0047021,Postpartum family planning,,,multifilter,,,,,,,,,,,,,,
http://purl.obolibrary.org/obo/EUPATH_0047327,Currently using family planning method,currently_using_it,2,ganc_followup,Are you currently using the family planning method selected during antenatal care?,Participant,http://purl.obolibrary.org/obo/EUPATH_0047021,Postpartum family planning,71. Are you currently using it?,2 = No | 1 = Yes,variable,,,,GANC,,,,,,,,,,
http://purl.obolibrary.org/obo/EUPATH_0047330,Selected family planning method after pregnancy,selected_fp_after_preg,1,ganc_followup,During  antenatal care did you select a form of family planning to use after your baby was born?,Participant,http://purl.obolibrary.org/obo/EUPATH_0047021,Postpartum family planning,69. During  antenatal care  did you select a form of family planning to use after your baby was born?,2 = No | 1 = Yes,variable,,,,GANC,,,,,,,,,,
http://purl.obolibrary.org/obo/EUPATH_0047331,Want to delay pregnancy,want_to_delay_pregnancy,3,ganc_followup,If it was up to you  would you want to delay getting pregnant again right away?,Participant,http://purl.obolibrary.org/obo/EUPATH_0047021,Postpartum family planning,68. If it was up to you  would you want to delay getting pregnant again right away?,2 = No | 1 = Yes | 3 = Undecided,variable,,,,GANC,,,,,,,,,,
http://purl.obolibrary.org/obo/EUPATH_0047329,Reason for not selecting family planning method,why_didnot_select_fp,4,ganc_followup,Why didn't you select a method of birth spacing during antenatal care?,Participant,http://purl.obolibrary.org/obo/EUPATH_0047021,Postpartum family planning,74. Why didnt you select a method of birth spacing during antenatal care?,4 = Other | 2 = I didnt know what the options were/wasnt counseled/my provider didnt talk to me about it | 1 = I dont want to space my next pregnancy/want to get pregnant again right away | 3 = I couldnt decide,variable,,,,GANC,,,,,,,,,,
http://purl.obolibrary.org/obo/EUPATH_0047326,Told about methods to space or prevent next pregnancy in ANC,anc_survey_q66a,1,,During ANC care I was told about different methods I could use to space or prevent my next pregnancy,Participant,,Postpartum family planning perceptions,a. During ANC care I was told about different methods I could use to space or prevent my next pregnancy,1 = Agree | 2 = Disagree | 3 = Neither Agree or Disagree,value,,,,GANC,,,,,,,,,,
http://purl.obolibrary.org/obo/EUPATH_0047325,Received all information about decision to space or prevent next pregnancy in ANC,anc_survey_q66b,2,,During ANC care I received all the information I needed to make a decision about if and how to space my next pregnancy,Participant,,Postpartum family planning perceptions,b. During ANC care I received all the information I needed to make a decision about if and how to space my next pregnancy,1 = Agree | 2 = Disagree | 3 = Neither Agree or Disagree,value,,,,GANC,,,,,,,,,,
http://purl.obolibrary.org/obo/EUPATH_0047324,Given opportunity to ask questions about spacing pregnancies in ANC,anc_survey_q66c,3,,During ANC care I was given the opportunity to ask questions about different ways to space pregnancies,Participant,,Postpartum family planning perceptions,c. During ANC care I was given the opportunity to ask questions about different ways to space pregnancies,3 = Neither Agree or Disagree | 2 = Disagree | 1 = Agree,value,,,,GANC,,,,,,,,,,
http://purl.obolibrary.org/obo/EUPATH_0047323,All questions answered in ANC,anc_survey_q66d,4,,All of my questions were answered in a way I understood,Participant,,Postpartum family planning perceptions,d. All of my questions were answered in a way I understood,2 = Disagree | 1 = Agree | 3 = Neither Agree or Disagree,value,,,,GANC,,,,,,,,,,
http://purl.obolibrary.org/obo/EUPATH_0047328,Have control over next pregnancy,anc_survey_q66f,5,,I can have some control over if and when I get pregnant again,Participant,,Postpartum family planning perceptions,e. I can have some control over if and when I get pregnant again,1 = Agree | 2 = Disagree | 3 = Neither Agree or Disagree,value,,,,GANC,,,,,,,,,,
http://purl.obolibrary.org/obo/EUPATH_0047002,Antenatal and postnatal care,,17,,,Participant,http://purl.obolibrary.org/obo/EUPATH_0042004,Pregnancy,,,category,,,,GANC,,,,,,,,,,
http://purl.obolibrary.org/obo/EUPATH_0047004,Attitudes during pregnancy,,18,,,Participant,http://purl.obolibrary.org/obo/EUPATH_0042004,Pregnancy,,,multifilter,,,,GANC,,,,,,,,,,
http://purl.obolibrary.org/obo/EUPATH_0047008,Gestational age determination,,4,,,Participant,http://purl.obolibrary.org/obo/EUPATH_0042004,Pregnancy,,,multifilter,,,,GANC,,,,,,,,,,
http://purl.obolibrary.org/obo/EUPATH_0047391,Birth planning,,1,,,Participant,http://purl.obolibrary.org/obo/EUPATH_0042004,Pregnancy,,,multifilter,,,,GANC,,,,,,,,,,
http://purl.obolibrary.org/obo/EUPATH_0047003,Attitudes about next pregnancy,,19,,This question was asked at baseline and follow-up.,Participant,http://purl.obolibrary.org/obo/EUPATH_0042004,Pregnancy,,,multifilter,,,,GANC,,,,,,,,,,
http://purl.obolibrary.org/obo/EUPATH_0047015,Knowledge of pregnancy warning signs,,20,,What are danger/warning signs during pregnancy?  Things that mean there might be a problem with you or the baby? This question was asked at baseline and follow-up. | What are danger/warning signs during pregnancy?  Things that mean there might be a problem with you or the baby? (This question was asked at baseline and follow-up),Participant,http://purl.obolibrary.org/obo/EUPATH_0042004,Pregnancy,,,multifilter,,,,GANC,,,,,,,,,,
http://purl.obolibrary.org/obo/EUPATH_0049829,Attitudes about life,,21,,This question was asked at baseline and follow-up.,Participant,http://purl.obolibrary.org/obo/EUPATH_0042004,Pregnancy,,,multifilter,,,,GANC,,,,,,,,,,
http://purl.obolibrary.org/obo/EUPATH_0042003,Pregnancy symptoms,,6,,During your pregnancy did you ever have these symptoms?,Participant,http://purl.obolibrary.org/obo/EUPATH_0042004,Pregnancy,,,multifilter,,,,GANC,,,,,,,,,,
http://purl.obolibrary.org/obo/EUPATH_0049831,Sought help for pregnancy symptoms,,7,,,Participant,http://purl.obolibrary.org/obo/EUPATH_0042004,Pregnancy,,,multifilter,,,,GANC,,,,,,,,,,
http://purl.obolibrary.org/obo/EUPATH_0049832,Where sought help for pregnancy symptoms,,8,,,Participant,http://purl.obolibrary.org/obo/EUPATH_0042004,Pregnancy,,,multifilter,,,,GANC,,,,,,,,,,
http://purl.obolibrary.org/obo/EUPATH_0047064,Told about high blood pressure in pregnancy,have_high_blood_pressure,10,ganc_followup,,Participant,http://purl.obolibrary.org/obo/EUPATH_0042004,Pregnancy,8. Have you ever been told you had high blood pressure?,3 = Not sure | 2 = No | 1 = Yes,variable,,,,GANC,,,,,,,,,,
http://purl.obolibrary.org/obo/EUPATH_0047061,Other special care for high blood pressure during pregnancy,receive_care_dueto_hbp,11,ganc_followup,,Participant,http://purl.obolibrary.org/obo/EUPATH_0042004,Pregnancy,12. Did you receive any other special care related to your blood pressure?,2 = No | 1 = Yes,variable,,,,GANC,,,,,,,,,,
http://purl.obolibrary.org/obo/EUPATH_0047058,Medications for high blood pressure in pregnancy,take_hbp_medication,12,ganc_followup,,Participant,http://purl.obolibrary.org/obo/EUPATH_0042004,Pregnancy,11. Did you take any medication for it?,1 = Yes | 2 = No | 3 = Not sure,variable,,,,GANC,,,,,,,,,,
http://purl.obolibrary.org/obo/EUPATH_0047654,Reason for not receiving contraception after delivery,pnc_q51b_1,14,ganc_phase2,,Participant,http://purl.obolibrary.org/obo/EUPATH_0042004,Pregnancy,51b1. If No  why not  Iwapo La  kwa nini?,5 = Provider thought I should wait - Mhudumu alipendekeza ningoje | 2 = Changed my mind - Nilibadilisha nia | 3 = The method wasnt available - Mbinu ya kupanga uzazi niliotaka haikuwa inapatikana | 1 = I forgot - Nilisahau | 6 = Husband or mother in law disagreed - Mme/mama mkwe hawakukubaliana na maoni yangu | 4 = Provider did not know how to insert - Mhudumu hakufahamu namna ya kuiweka | 8 = Other - Nyingine | 7 = Didnt end up delivering in a facility - Sikujifungulia kwenye kituo cha afya,variable,,,,GANC,,,,,,,,,,
http://purl.obolibrary.org/obo/EUPATH_0047656,Baby's age at participant's subsequent pregnancy,pnc_q54a,15,ganc_phase2,How old was your baby when you became pregnant again?,Participant,http://purl.obolibrary.org/obo/EUPATH_0042004,Pregnancy,,,variable,,,,GANC,,months,http://purl.obolibrary.org/obo/UO_0000035,,,,,,,
http://purl.obolibrary.org/obo/EUPATH_0047657,Currently pregnant,pnc_q54b,16,ganc_phase2,,Participant,http://purl.obolibrary.org/obo/EUPATH_0042004,Pregnancy,54b. Are you currently pregnant  Una ujauzito sasa hivi?,1 = Yes - Ndio | 2 = No - La | 3 = Unsure - Sina Uhakika,variable,,,,GANC,,,,,,,,,,
http://purl.obolibrary.org/obo/EUPATH_0042067,Estimated delivery date,edd_date,2,ganc_screening,Expected date of delivery,Participant,http://purl.obolibrary.org/obo/EUPATH_0042004,Pregnancy,,,variable,,yes,,GANC,,,,,,,,,,yes
http://purl.obolibrary.org/obo/EUPATH_0047248,Health decision maker for yourself and newborn,pnc_q29 | baseline_women_q25 | who_makes_health_decision,22,ganc_followup | ganc_phase2 | ganc_baseline,"Who will usually make decisions about health care for yourself and your newborn? This question was asked at baseline, follow-up and postnatal survey",Participant,http://purl.obolibrary.org/obo/EUPATH_0042004,Pregnancy,29. Who will usually make decisions about health care for yourself and your newborn  Nani kwa kawaida hufanya maamuzi ya kiafya ya mtoto wako na yako? | 25. Who will usually make decisions about health care for yourself and your newborn? | 54. Who will usually make decisions about health care for yourself and your newborn?,2 = Your husband/partner - Mme wako/mwenzio | 3 = You and your husband/partner jointly - Wewe na mme/mwenzio kwa ushirikiano | 1 = You - Wewe | 4 = Someone else | 3 = You and your husband/partner jointly | 2 = Your husband/partner | 4 = Someone else - Mtu mwingine | 4 = Someone else  specify | 1 = You,variable,yes,,,GANC,,,,,,,,,,
http://purl.obolibrary.org/obo/ONTONEO_00000255,Gestational age,ga_age,3,ganc_screening,,Participant,http://purl.obolibrary.org/obo/EUPATH_0042004,Pregnancy,,,variable,,,,GANC,,,,,,,,,,
http://purl.obolibrary.org/obo/EUPATH_0047252,Blood pressure counseling in pregnancy,bp_counseling,9,ganc_followup,,Participant,http://purl.obolibrary.org/obo/EUPATH_0042004,Pregnancy,18. BP counseling,1 = Yes | 0 = No,variable,,,,GANC,,,,,,,,,,
http://purl.obolibrary.org/obo/EUPATH_0047332,Fever during pregnancy or after giving birth,had_fever,1,ganc_followup,,Participant,http://purl.obolibrary.org/obo/EUPATH_0042003,Pregnancy symptoms,22. During your pregnancy or since you had your baby have you had a fever?,1 = Yes | 2 = No,value,,,,GANC,,,,,,,,,,
http://purl.obolibrary.org/obo/EUPATH_0047335,Painful contractions or cramping too early,had_painful_contractions,2,ganc_followup,,Participant,http://purl.obolibrary.org/obo/EUPATH_0042003,Pregnancy symptoms,19. During your pregnancy did you ever have painful contractions or cramping when it was too early for the baby to come?,1 = Yes | 2 = No,value,,,,GANC,,,,,,,,,,
http://purl.obolibrary.org/obo/EUPATH_0047341,Vaginal bleeding or fluid leakage,had_vaginal_bleeding,3,ganc_followup,,Participant,http://purl.obolibrary.org/obo/EUPATH_0042003,Pregnancy symptoms,16. During your pregnancy did you ever have any vaginal bleeding or leakage of fluids?,1 = Yes | 2 = No,value,,,,GANC,,,,,,,,,,
http://purl.obolibrary.org/obo/EUPATH_0047336,Severe headache or vision changes,have_severe_headache,4,ganc_followup,,Participant,http://purl.obolibrary.org/obo/EUPATH_0042003,Pregnancy symptoms,13. During your pregnancy did you ever have a severe headache or vision changes?,2 = No | 1 = Yes,value,,,,GANC,,,,,,,,,,
http://purl.obolibrary.org/obo/EUPATH_0047049,Bleeding,asked_if_had_bleeding,1,ganc_followup,,Participant,http://purl.obolibrary.org/obo/EUPATH_0049830,Provider enquired at each ANC visit about,c. Bleeding,1 = Yes | 3 = Not sure | 2 = No,value,,,,GANC,,,,,,,,,,
http://purl.obolibrary.org/obo/EUPATH_0047050,Fever,asked_if_had_fever,2,ganc_followup,,Participant,http://purl.obolibrary.org/obo/EUPATH_0049830,Provider enquired at each ANC visit about,b. Fever,1 = Yes | 2 = No | 3 = Not sure,value,,,,GANC,,,,,,,,,,
http://purl.obolibrary.org/obo/EUPATH_0047051,Fluid leakage,asked_if_had_leakage,3,ganc_followup,,Participant,http://purl.obolibrary.org/obo/EUPATH_0049830,Provider enquired at each ANC visit about,d. leakage of fluids,1 = Yes | 2 = No | 3 = Not sure,value,,,,GANC,,,,,,,,,,
http://purl.obolibrary.org/obo/EUPATH_0047052,Pain,asked_if_had_pain,4,ganc_followup,,Participant,http://purl.obolibrary.org/obo/EUPATH_0049830,Provider enquired at each ANC visit about,a. Pain,3 = Not sure | 2 = No | 1 = Yes,value,,,,GANC,,,,,,,,,,
http://purl.obolibrary.org/obo/EUPATH_0047053,Reduced or no fetal movement,no_fetal_movement,5,ganc_followup,,Participant,http://purl.obolibrary.org/obo/EUPATH_0049830,Provider enquired at each ANC visit about,e. Reduced or no fetal movement,3 = Not sure | 2 = No | 1 = Yes,value,,,,GANC,,,,,,,,,,
http://purl.obolibrary.org/obo/EUPATH_0047868,Infrequent sex,pnc_q60___1,1,ganc_phase2,,Participant,http://purl.obolibrary.org/obo/EUPATH_0047867,Reason for discontinuing recent FP method,60. Why did you stop using this most recent method  Kwa nini uliacha kutumia mbinu hii ya hivi majuzi?  (choice=Infrequent sex/husband or partner away - Mara chache ya shiriki ngono/mme/mwenzio yuko mbali),0 = Unchecked | 1 = Checked,value,,,,GANC,,,,,,,,,,
http://purl.obolibrary.org/obo/EUPATH_0047877,Inconvenient to use,pnc_q60___10,10,ganc_phase2,,Participant,http://purl.obolibrary.org/obo/EUPATH_0047867,Reason for discontinuing recent FP method,60. Why did you stop using this most recent method  Kwa nini uliacha kutumia mbinu hii ya hivi majuzi?  (choice=Inconvenient to use - Sio rahisi kuitumia),1 = Checked | 0 = Unchecked,value,,,,GANC,,,,,,,,,,
http://purl.obolibrary.org/obo/EUPATH_0047878,Up to God or fatalistic,pnc_q60___11,11,ganc_phase2,,Participant,http://purl.obolibrary.org/obo/EUPATH_0047867,Reason for discontinuing recent FP method,60. Why did you stop using this most recent method  Kwa nini uliacha kutumia mbinu hii ya hivi majuzi?  (choice=Up to God/fatalistic - Numwemwachia Mungu),0 = Unchecked | 1 = Checked,value,,,,GANC,,,,,,,,,,
http://purl.obolibrary.org/obo/EUPATH_0047879,Difficult to get pregnant or menopausal,pnc_q60___12,12,ganc_phase2,,Participant,http://purl.obolibrary.org/obo/EUPATH_0047867,Reason for discontinuing recent FP method,60. Why did you stop using this most recent method  Kwa nini uliacha kutumia mbinu hii ya hivi majuzi?  (choice=Difficult to get pregnant/menopausal - Vigumu kupata ujauzito/wamefika umri wa kumaliza kuzaa),1 = Checked | 0 = Unchecked,value,,,,GANC,,,,,,,,,,
http://purl.obolibrary.org/obo/EUPATH_0047880,Marital dissolution or separation,pnc_q60___13,13,ganc_phase2,,Participant,http://purl.obolibrary.org/obo/EUPATH_0047867,Reason for discontinuing recent FP method,60. Why did you stop using this most recent method  Kwa nini uliacha kutumia mbinu hii ya hivi majuzi?  (choice=Marital dissolution/separation - Kutengana na mumewe/mwenza),1 = Checked | 0 = Unchecked,value,,,,GANC,,,,,,,,,,
http://purl.obolibrary.org/obo/EUPATH_0047881,Other,pnc_q60___14,14,ganc_phase2,,Participant,http://purl.obolibrary.org/obo/EUPATH_0047867,Reason for discontinuing recent FP method,60. Why did you stop using this most recent method  Kwa nini uliacha kutumia mbinu hii ya hivi majuzi?  (choice=Other - Nyingine),0 = Unchecked | 1 = Checked,value,,,,GANC,,,,,,,,,,
http://purl.obolibrary.org/obo/EUPATH_0047869,Became pregnant,pnc_q60___2,2,ganc_phase2,,Participant,http://purl.obolibrary.org/obo/EUPATH_0047867,Reason for discontinuing recent FP method,60. Why did you stop using this most recent method  Kwa nini uliacha kutumia mbinu hii ya hivi majuzi?  (choice=Became pregnant while using - Nilipata ujauzito ningali nikitumia),0 = Unchecked | 1 = Checked,value,,,,GANC,,,,,,,,,,
http://purl.obolibrary.org/obo/EUPATH_0047870,Wanted to become pregnant,pnc_q60___3,3,ganc_phase2,,Participant,http://purl.obolibrary.org/obo/EUPATH_0047867,Reason for discontinuing recent FP method,60. Why did you stop using this most recent method  Kwa nini uliacha kutumia mbinu hii ya hivi majuzi?  (choice=Wanted to become pregnant - Nilitaka kupata mimba),0 = Unchecked | 1 = Checked,value,,,,GANC,,,,,,,,,,
http://purl.obolibrary.org/obo/EUPATH_0047871,Partner opposed,pnc_q60___4,4,ganc_phase2,,Participant,http://purl.obolibrary.org/obo/EUPATH_0047867,Reason for discontinuing recent FP method,60. Why did you stop using this most recent method  Kwa nini uliacha kutumia mbinu hii ya hivi majuzi?  (choice=Husband/partner opposed -  Mme/mwenza alipinga ),1 = Checked | 0 = Unchecked,value,,,,GANC,,,,,,,,,,
http://purl.obolibrary.org/obo/EUPATH_0047872,Others opposed,pnc_q60___5,5,ganc_phase2,,Participant,http://purl.obolibrary.org/obo/EUPATH_0047867,Reason for discontinuing recent FP method,60. Why did you stop using this most recent method  Kwa nini uliacha kutumia mbinu hii ya hivi majuzi?  (choice=Others opposed - Wengine walipinga),0 = Unchecked | 1 = Checked,value,,,,GANC,,,,,,,,,,
http://purl.obolibrary.org/obo/EUPATH_0047873,Wanted more effective method,pnc_q60___6,6,ganc_phase2,,Participant,http://purl.obolibrary.org/obo/EUPATH_0047867,Reason for discontinuing recent FP method,60. Why did you stop using this most recent method  Kwa nini uliacha kutumia mbinu hii ya hivi majuzi?  (choice=Wanted more effective method - Nilitaka mbinu iliyo na ufanisi zaidi),0 = Unchecked | 1 = Checked,value,,,,GANC,,,,,,,,,,
http://purl.obolibrary.org/obo/EUPATH_0047874,Side effects or health concerns,pnc_q60___7,7,ganc_phase2,,Participant,http://purl.obolibrary.org/obo/EUPATH_0047867,Reason for discontinuing recent FP method,60. Why did you stop using this most recent method  Kwa nini uliacha kutumia mbinu hii ya hivi majuzi?  (choice=Side effects/health concerns - Athari za matumizi/wasiwasi kuhusu Afya),1 = Checked | 0 = Unchecked,value,,,,GANC,,,,,,,,,,
http://purl.obolibrary.org/obo/EUPATH_0047875,Lack of access,pnc_q60___8,8,ganc_phase2,,Participant,http://purl.obolibrary.org/obo/EUPATH_0047867,Reason for discontinuing recent FP method,60. Why did you stop using this most recent method  Kwa nini uliacha kutumia mbinu hii ya hivi majuzi?  (choice=Lack of access/too far - Kutokupatikana kwa mbinu hiyo/umbali),1 = Checked | 0 = Unchecked,value,,,,GANC,,,,,,,,,,
http://purl.obolibrary.org/obo/EUPATH_0047876,Costs too much,pnc_q60___9,9,ganc_phase2,,Participant,http://purl.obolibrary.org/obo/EUPATH_0047867,Reason for discontinuing recent FP method,60. Why did you stop using this most recent method  Kwa nini uliacha kutumia mbinu hii ya hivi majuzi?  (choice=Costs too much - Ni ghali),0 = Unchecked | 1 = Checked,value,,,,GANC,,,,,,,,,,
http://purl.obolibrary.org/obo/EUPATH_0047925,Infrequent sex,pnc_q67_beads___1,1,ganc_phase2,,Participant,http://purl.obolibrary.org/obo/EUPATH_0047924,Reason for discontinuing recent use of calendar or rhythm method,67. Why did you stop using Calendar/rhythm/cycle beads/natural/Billings method Kwa nini uliacha kutumia mbinu ya Kalenda/mrindimo/ushanga/asilia/mbinu ya Billing (choice=Infrequent sex/husband or partner away - Mara chache ya shiriki ngono/mme/mwenzio yuko,0 = Unchecked | 1 = Checked,value,,,,GANC,,,,,,,,,,
http://purl.obolibrary.org/obo/EUPATH_0047934,Inconvenient to use,pnc_q67_beads___10,10,ganc_phase2,,Participant,http://purl.obolibrary.org/obo/EUPATH_0047924,Reason for discontinuing recent use of calendar or rhythm method,67. Why did you stop using Calendar/rhythm/cycle beads/natural/Billings method Kwa nini uliacha kutumia mbinu ya Kalenda/mrindimo/ushanga/asilia/mbinu ya Billing (choice=Inconvenient to use - Sio rahisi kuitumia),1 = Checked | 0 = Unchecked,value,,,,GANC,,,,,,,,,,
http://purl.obolibrary.org/obo/EUPATH_0047935,Up to God or fatalistic,pnc_q67_beads___11,11,ganc_phase2,,Participant,http://purl.obolibrary.org/obo/EUPATH_0047924,Reason for discontinuing recent use of calendar or rhythm method,67. Why did you stop using Calendar/rhythm/cycle beads/natural/Billings method Kwa nini uliacha kutumia mbinu ya Kalenda/mrindimo/ushanga/asilia/mbinu ya Billing (choice=Up to God/fatalistic - Numwemwachia Mungu),1 = Checked | 0 = Unchecked,value,,,,GANC,,,,,,,,,,
http://purl.obolibrary.org/obo/EUPATH_0047936,Difficult to get pregnant or menopausal,pnc_q67_beads___12,12,ganc_phase2,,Participant,http://purl.obolibrary.org/obo/EUPATH_0047924,Reason for discontinuing recent use of calendar or rhythm method,67. Why did you stop using Calendar/rhythm/cycle beads/natural/Billings method Kwa nini uliacha kutumia mbinu ya Kalenda/mrindimo/ushanga/asilia/mbinu ya Billing (choice=Difficult to get pregnant/menopausal - Vigumu kupata ujauzito/wamefika umri wa kumaliz,1 = Checked | 0 = Unchecked,value,,,,GANC,,,,,,,,,,
